,NODE_FILE_NAME,NODE_NUMBER,NODE_HASH,NODE_TEXT,Q,A_NUMBER,A,helpfulness,correctness,coherence,complexity,verbosity
0,Industrial_Gas_Turbines_AMY_Razak.txt,105,a527e7ff9fce84f888d05eb351312bdbc7c35e79191c246e29af105d0de248ff,11.0,Can 'Python for Data Analysis' help someone with no prior Python knowledge?,A1,"Yes, it covers Python basics before diving into data analysis.",2.15625,2.28125,3.6875,0.86328125,0.294921875
1,Industrial_Gas_Turbines_AMY_Razak.txt,105,a527e7ff9fce84f888d05eb351312bdbc7c35e79191c246e29af105d0de248ff,11.0,Can 'Python for Data Analysis' help someone with no prior Python knowledge?,A2,"Absolutely, it starts with foundational Python concepts for beginners.",2.40625,2.4375,3.5625,0.859375,0.283203125
2,Industrial_Gas_Turbines_AMY_Razak.txt,105,a527e7ff9fce84f888d05eb351312bdbc7c35e79191c246e29af105d0de248ff,11.0,Can 'Python for Data Analysis' help someone with no prior Python knowledge?,A3,"Yes, the book is designed to accommodate readers new to Python.",2.203125,2.296875,3.671875,0.6640625,0.2490234375
3,Industrial_Gas_Turbines_AMY_Razak.txt,105,a527e7ff9fce84f888d05eb351312bdbc7c35e79191c246e29af105d0de248ff,11.0,Can 'Python for Data Analysis' help someone with no prior Python knowledge?,A4,"It provides an introduction to Python, making it accessible to novices.",2.015625,1.984375,3.546875,0.68359375,0.333984375
4,Industrial_Gas_Turbines_AMY_Razak.txt,105,a527e7ff9fce84f888d05eb351312bdbc7c35e79191c246e29af105d0de248ff,11.0,Can 'Python for Data Analysis' help someone with no prior Python knowledge?,A5,"Definitely, it includes introductory Python material for those without prior experience.",2.34375,2.40625,3.640625,0.91015625,0.365234375
5,Industrial_Gas_Turbines_AMY_Razak.txt,105,a527e7ff9fce84f888d05eb351312bdbc7c35e79191c246e29af105d0de248ff,11.0,How does 'Python for Data Analysis' address data visualization?,A1,By teaching the use of Matplotlib and other libraries for creating graphs and charts.,2.140625,2.171875,3.5,1.0703125,0.4296875
6,Industrial_Gas_Turbines_AMY_Razak.txt,105,a527e7ff9fce84f888d05eb351312bdbc7c35e79191c246e29af105d0de248ff,11.0,How does 'Python for Data Analysis' address data visualization?,A2,It includes sections on how to visualize data effectively using Python tools.,1.3515625,1.359375,2.96875,1.0078125,0.28125
7,Industrial_Gas_Turbines_AMY_Razak.txt,105,a527e7ff9fce84f888d05eb351312bdbc7c35e79191c246e29af105d0de248ff,11.0,How does 'Python for Data Analysis' address data visualization?,A3,Through examples and exercises on generating visual representations of data.,1.59375,1.53125,3.0625,0.9765625,0.220703125
8,Industrial_Gas_Turbines_AMY_Razak.txt,105,a527e7ff9fce84f888d05eb351312bdbc7c35e79191c246e29af105d0de248ff,11.0,How does 'Python for Data Analysis' address data visualization?,A4,The book covers data visualization techniques with practical examples.,1.2578125,1.1953125,2.9375,0.90234375,0.2353515625
9,Industrial_Gas_Turbines_AMY_Razak.txt,105,a527e7ff9fce84f888d05eb351312bdbc7c35e79191c246e29af105d0de248ff,11.0,How does 'Python for Data Analysis' address data visualization?,A5,By demonstrating how to use Python libraries to visualize data insights.,1.5859375,1.546875,3.109375,1.0234375,0.28125
10,Industrial_Gas_Turbines_AMY_Razak.txt,105,a527e7ff9fce84f888d05eb351312bdbc7c35e79191c246e29af105d0de248ff,11.0,How does 'Python for Data Analysis' approach teaching data analysis?,A1,Through practical examples and hands-on projects.,1.578125,1.65625,3.203125,0.75,0.119140625
11,Industrial_Gas_Turbines_AMY_Razak.txt,105,a527e7ff9fce84f888d05eb351312bdbc7c35e79191c246e29af105d0de248ff,11.0,How does 'Python for Data Analysis' approach teaching data analysis?,A2,By integrating theory with practical coding exercises.,1.6171875,1.5390625,3.09375,0.78515625,0.16796875
12,Industrial_Gas_Turbines_AMY_Razak.txt,105,a527e7ff9fce84f888d05eb351312bdbc7c35e79191c246e29af105d0de248ff,11.0,How does 'Python for Data Analysis' approach teaching data analysis?,A3,It uses real-world data sets to teach analysis techniques.,1.59375,1.546875,3.109375,0.98828125,0.265625
13,Industrial_Gas_Turbines_AMY_Razak.txt,105,a527e7ff9fce84f888d05eb351312bdbc7c35e79191c246e29af105d0de248ff,11.0,How does 'Python for Data Analysis' approach teaching data analysis?,A4,The book combines conceptual explanations with practical applications.,1.28125,1.1171875,2.90625,0.91796875,0.201171875
14,Industrial_Gas_Turbines_AMY_Razak.txt,105,a527e7ff9fce84f888d05eb351312bdbc7c35e79191c246e29af105d0de248ff,11.0,How does 'Python for Data Analysis' approach teaching data analysis?,A5,By focusing on Python libraries and tools relevant to data analysis.,1.3828125,1.3671875,3.078125,0.91015625,0.154296875
15,Industrial_Gas_Turbines_AMY_Razak.txt,105,a527e7ff9fce84f888d05eb351312bdbc7c35e79191c246e29af105d0de248ff,11.0,Is 'Python for Data Analysis' suitable for academic purposes?,A1,"Yes, it can serve as a textbook for courses on data analysis with Python.",2.453125,2.59375,3.640625,0.96875,0.279296875
16,Industrial_Gas_Turbines_AMY_Razak.txt,105,a527e7ff9fce84f888d05eb351312bdbc7c35e79191c246e29af105d0de248ff,11.0,Is 'Python for Data Analysis' suitable for academic purposes?,A2,"Absolutely, its structured approach makes it suitable for academic settings.",2.640625,2.65625,3.765625,0.921875,0.267578125
17,Industrial_Gas_Turbines_AMY_Razak.txt,105,a527e7ff9fce84f888d05eb351312bdbc7c35e79191c246e29af105d0de248ff,11.0,Is 'Python for Data Analysis' suitable for academic purposes?,A3,"Yes, the book's comprehensive coverage is beneficial for students.",2.28125,2.34375,3.640625,0.82421875,0.380859375
18,Industrial_Gas_Turbines_AMY_Razak.txt,105,a527e7ff9fce84f888d05eb351312bdbc7c35e79191c246e29af105d0de248ff,11.0,Is 'Python for Data Analysis' suitable for academic purposes?,A4,It is appropriate for academic courses focusing on practical data analysis.,2.375,2.46875,3.65625,1.0234375,0.25390625
19,Industrial_Gas_Turbines_AMY_Razak.txt,105,a527e7ff9fce84f888d05eb351312bdbc7c35e79191c246e29af105d0de248ff,11.0,Is 'Python for Data Analysis' suitable for academic purposes?,A5,"Definitely, its blend of theory and practice is ideal for academic use.",2.734375,2.78125,3.78125,0.78125,0.3125
20,Industrial_Gas_Turbines_AMY_Razak.txt,105,a527e7ff9fce84f888d05eb351312bdbc7c35e79191c246e29af105d0de248ff,11.0,What are some key Python libraries discussed in 'Python for Data Analysis'?,A1,"Pandas, NumPy, and Matplotlib.",2.953125,2.953125,3.765625,1.0234375,0.474609375
21,Industrial_Gas_Turbines_AMY_Razak.txt,105,a527e7ff9fce84f888d05eb351312bdbc7c35e79191c246e29af105d0de248ff,11.0,What are some key Python libraries discussed in 'Python for Data Analysis'?,A2,"The book covers Pandas for data manipulation, NumPy for numerical operations, and Matplotlib for visualization.",3.203125,3.203125,3.796875,1.4609375,0.7421875
22,Industrial_Gas_Turbines_AMY_Razak.txt,105,a527e7ff9fce84f888d05eb351312bdbc7c35e79191c246e29af105d0de248ff,11.0,What are some key Python libraries discussed in 'Python for Data Analysis'?,A3,"Key libraries include Pandas, NumPy, and Matplotlib.",3.0625,3.078125,3.8125,1.09375,0.54296875
23,Industrial_Gas_Turbines_AMY_Razak.txt,105,a527e7ff9fce84f888d05eb351312bdbc7c35e79191c246e29af105d0de248ff,11.0,What are some key Python libraries discussed in 'Python for Data Analysis'?,A4,"Pandas, NumPy, and Matplotlib are highlighted as essential tools.",2.96875,2.90625,3.703125,1.1171875,0.546875
24,Industrial_Gas_Turbines_AMY_Razak.txt,105,a527e7ff9fce84f888d05eb351312bdbc7c35e79191c246e29af105d0de248ff,11.0,What are some key Python libraries discussed in 'Python for Data Analysis'?,A5,"It emphasizes the use of Pandas, NumPy, and Matplotlib in data analysis.",2.921875,3.0625,3.71875,1.2890625,0.62890625
25,Industrial_Gas_Turbines_AMY_Razak.txt,105,a527e7ff9fce84f888d05eb351312bdbc7c35e79191c246e29af105d0de248ff,11.0,What is the main purpose of the book 'Python for Data Analysis'?,A1,The main purpose is to teach data analysis techniques using Python.,2.90625,3.109375,3.609375,1.109375,0.47265625
26,Industrial_Gas_Turbines_AMY_Razak.txt,105,a527e7ff9fce84f888d05eb351312bdbc7c35e79191c246e29af105d0de248ff,11.0,What is the main purpose of the book 'Python for Data Analysis'?,A2,It aims to provide readers with the knowledge to perform data analysis with Python.,3.015625,3.203125,3.578125,1.125,0.498046875
27,Industrial_Gas_Turbines_AMY_Razak.txt,105,a527e7ff9fce84f888d05eb351312bdbc7c35e79191c246e29af105d0de248ff,11.0,What is the main purpose of the book 'Python for Data Analysis'?,A3,To introduce Python programming for the purpose of analyzing data.,2.890625,3.015625,3.671875,1.0859375,0.53515625
28,Industrial_Gas_Turbines_AMY_Razak.txt,105,a527e7ff9fce84f888d05eb351312bdbc7c35e79191c246e29af105d0de248ff,11.0,What is the main purpose of the book 'Python for Data Analysis'?,A4,The book focuses on equipping readers with Python skills for data analysis tasks.,2.953125,3.046875,3.4375,1.1875,0.4765625
29,Industrial_Gas_Turbines_AMY_Razak.txt,105,a527e7ff9fce84f888d05eb351312bdbc7c35e79191c246e29af105d0de248ff,11.0,What is the main purpose of the book 'Python for Data Analysis'?,A5,Its goal is to demonstrate how Python can be used effectively for data analysis.,3.03125,3.046875,3.671875,1.078125,0.51953125
30,Industrial_Gas_Turbines_AMY_Razak.txt,105,a527e7ff9fce84f888d05eb351312bdbc7c35e79191c246e29af105d0de248ff,11.0,What makes 'Python for Data Analysis' unique compared to other data analysis books?,A1,"Its focus on Python and practical, hands-on approach.",1.609375,1.921875,3.3125,0.84375,0.2080078125
31,Industrial_Gas_Turbines_AMY_Razak.txt,105,a527e7ff9fce84f888d05eb351312bdbc7c35e79191c246e29af105d0de248ff,11.0,What makes 'Python for Data Analysis' unique compared to other data analysis books?,A2,The book stands out for its emphasis on using Python for real-world data analysis tasks.,1.546875,1.6015625,3.015625,0.97265625,0.248046875
32,Industrial_Gas_Turbines_AMY_Razak.txt,105,a527e7ff9fce84f888d05eb351312bdbc7c35e79191c246e29af105d0de248ff,11.0,What makes 'Python for Data Analysis' unique compared to other data analysis books?,A3,Unique for combining Python programming with data analysis techniques in a practical manner.,1.5859375,1.703125,3.1875,0.9921875,0.2333984375
33,Industrial_Gas_Turbines_AMY_Razak.txt,105,a527e7ff9fce84f888d05eb351312bdbc7c35e79191c246e29af105d0de248ff,11.0,What makes 'Python for Data Analysis' unique compared to other data analysis books?,A4,Its distinctive feature is the integration of Python coding with data analysis concepts.,1.984375,2.0625,3.3125,1.09375,0.34375
34,Industrial_Gas_Turbines_AMY_Razak.txt,105,a527e7ff9fce84f888d05eb351312bdbc7c35e79191c246e29af105d0de248ff,11.0,What makes 'Python for Data Analysis' unique compared to other data analysis books?,A5,The practical examples and focus on Python libraries make it unique.,2.0625,2.109375,3.40625,0.9765625,0.349609375
35,Industrial_Gas_Turbines_AMY_Razak.txt,105,a527e7ff9fce84f888d05eb351312bdbc7c35e79191c246e29af105d0de248ff,11.0,What prerequisites are recommended before starting 'Python for Data Analysis'?,A1,Basic understanding of programming concepts is helpful but not required.,2.25,2.15625,3.515625,0.7734375,0.2294921875
36,Industrial_Gas_Turbines_AMY_Razak.txt,105,a527e7ff9fce84f888d05eb351312bdbc7c35e79191c246e29af105d0de248ff,11.0,What prerequisites are recommended before starting 'Python for Data Analysis'?,A2,"No strict prerequisites, though familiarity with basic math is beneficial.",2.546875,2.65625,3.703125,0.9609375,0.3828125
37,Industrial_Gas_Turbines_AMY_Razak.txt,105,a527e7ff9fce84f888d05eb351312bdbc7c35e79191c246e29af105d0de248ff,11.0,What prerequisites are recommended before starting 'Python for Data Analysis'?,A3,A general awareness of programming can enhance the learning experience.,2.09375,2.140625,3.59375,0.69921875,0.1435546875
38,Industrial_Gas_Turbines_AMY_Razak.txt,105,a527e7ff9fce84f888d05eb351312bdbc7c35e79191c246e29af105d0de248ff,11.0,What prerequisites are recommended before starting 'Python for Data Analysis'?,A4,"The book is accessible to beginners, with no prior knowledge needed.",1.9765625,1.875,3.578125,0.5625,0.296875
39,Industrial_Gas_Turbines_AMY_Razak.txt,105,a527e7ff9fce84f888d05eb351312bdbc7c35e79191c246e29af105d0de248ff,11.0,What prerequisites are recommended before starting 'Python for Data Analysis'?,A5,"While designed for beginners, an interest in data analysis is essential.",2.265625,2.078125,3.5625,0.71484375,0.283203125
40,Industrial_Gas_Turbines_AMY_Razak.txt,105,a527e7ff9fce84f888d05eb351312bdbc7c35e79191c246e29af105d0de248ff,11.0,What types of data analysis projects are included in 'Python for Data Analysis'?,A1,"Projects involving data cleaning, exploration, and visualization.",2.15625,2.109375,3.421875,0.94921875,0.396484375
41,Industrial_Gas_Turbines_AMY_Razak.txt,105,a527e7ff9fce84f888d05eb351312bdbc7c35e79191c246e29af105d0de248ff,11.0,What types of data analysis projects are included in 'Python for Data Analysis'?,A2,"The book features projects on data manipulation, analysis, and graphical representation.",2.0,2.03125,3.4375,1.03125,0.458984375
42,Industrial_Gas_Turbines_AMY_Razak.txt,105,a527e7ff9fce84f888d05eb351312bdbc7c35e79191c246e29af105d0de248ff,11.0,What types of data analysis projects are included in 'Python for Data Analysis'?,A3,Includes practical projects on handling and analyzing data sets.,1.375,1.2734375,3.109375,0.90234375,0.36328125
43,Industrial_Gas_Turbines_AMY_Razak.txt,105,a527e7ff9fce84f888d05eb351312bdbc7c35e79191c246e29af105d0de248ff,11.0,What types of data analysis projects are included in 'Python for Data Analysis'?,A4,Projects range from basic data processing to advanced analysis techniques.,1.3671875,1.3359375,3.125,0.8671875,0.26953125
44,Industrial_Gas_Turbines_AMY_Razak.txt,105,a527e7ff9fce84f888d05eb351312bdbc7c35e79191c246e29af105d0de248ff,11.0,What types of data analysis projects are included in 'Python for Data Analysis'?,A5,It offers a variety of projects focusing on different aspects of data analysis.,1.4609375,1.40625,3.046875,1.0390625,0.328125
45,Industrial_Gas_Turbines_AMY_Razak.txt,105,a527e7ff9fce84f888d05eb351312bdbc7c35e79191c246e29af105d0de248ff,11.0,Who is the target audience for 'Python for Data Analysis'?,A1,Beginners and intermediate learners interested in data analysis with Python.,2.875,2.90625,3.921875,0.671875,0.490234375
46,Industrial_Gas_Turbines_AMY_Razak.txt,105,a527e7ff9fce84f888d05eb351312bdbc7c35e79191c246e29af105d0de248ff,11.0,Who is the target audience for 'Python for Data Analysis'?,A2,Individuals looking to learn data analysis using Python from scratch or enhance their skills.,3.125,3.15625,3.890625,0.84765625,0.58984375
47,Industrial_Gas_Turbines_AMY_Razak.txt,105,a527e7ff9fce84f888d05eb351312bdbc7c35e79191c246e29af105d0de248ff,11.0,Who is the target audience for 'Python for Data Analysis'?,A3,"The book is aimed at those new to data analysis or Python, seeking practical knowledge.",2.703125,2.71875,3.859375,0.859375,0.515625
48,Industrial_Gas_Turbines_AMY_Razak.txt,105,a527e7ff9fce84f888d05eb351312bdbc7c35e79191c246e29af105d0de248ff,11.0,Who is the target audience for 'Python for Data Analysis'?,A4,"Target readers include students, professionals, and hobbyists interested in data analysis.",2.859375,2.71875,3.796875,0.7578125,0.40234375
49,Industrial_Gas_Turbines_AMY_Razak.txt,105,a527e7ff9fce84f888d05eb351312bdbc7c35e79191c246e29af105d0de248ff,11.0,Who is the target audience for 'Python for Data Analysis'?,A5,Anyone with a basic understanding of programming looking to delve into data analysis with Python.,3.046875,3.15625,3.828125,0.97265625,0.546875
