NODE_FILE_NAME,NODE_NUMBER,NODE_HASH,QUESTION,ANSWER
Industrial_Gas_Turbines_AMY_Razak.txt,133,f9dc6ca75d0329229f33e5cfb1d820ab5c874dcbc8db04e3f0e8a9c0fa154e72,What is the role of the HP spool in a three-shaft gas turbine operating with a free power turbine?,"The HP spool in a three-shaft gas turbine operating with a free power turbine acts as the gas generator. It consists of the high-pressure (HP) compressor driven by its own HP turbine. The HP spool effectively functions similarly to a two-shaft gas turbine, where the HP turbine drives the HP compressor, and its performance is influenced by the characteristics of the low-pressure (LP) turbine, which acts as the power turbine in this configuration. The HP spool establishes a unique running line on the HP compressor characteristic, which is essential for determining the operating conditions of the gas turbine."
Industrial_Gas_Turbines_AMY_Razak.txt,133,f9dc6ca75d0329229f33e5cfb1d820ab5c874dcbc8db04e3f0e8a9c0fa154e72,How does the LP turbine interact with the LP compressor in a three-shaft gas turbine system?,"In a three-shaft gas turbine system, the LP turbine interacts with the LP compressor through a power balance relationship. The LP turbine, which acts as the power turbine, drives its own LP compressor, forming what is referred to as the LP spool. The performance and efficiency of the LP turbine directly influence the operational characteristics of the LP compressor.

The pressure ratio of the LP turbine is determined by the matching of the LP turbine and the power turbine characteristics. This matching establishes a unique running line on the LP compressor characteristic, which is essential for maintaining optimal performance. 

As the LP turbine operates, it influences the non-dimensional temperature rise across the LP compressor, which remains constant under specific operating conditions. This means that for a given LP turbine efficiency, the non-dimensional temperature drop across the power turbine is also constant. Consequently, the interaction between the LP turbine and LP compressor is crucial for maintaining the overall efficiency and performance of the gas turbine system, as they work together to optimize the pressure ratios and temperature relationships within the system."
Industrial_Gas_Turbines_AMY_Razak.txt,133,f9dc6ca75d0329229f33e5cfb1d820ab5c874dcbc8db04e3f0e8a9c0fa154e72,What determines the LP turbine pressure ratio in a three-shaft gas turbine?,"The LP turbine pressure ratio in a three-shaft gas turbine is determined by the matching of the LP turbine and power turbine characteristics, as well as the swallowing capacity of the power turbine."
Industrial_Gas_Turbines_AMY_Razak.txt,133,f9dc6ca75d0329229f33e5cfb1d820ab5c874dcbc8db04e3f0e8a9c0fa154e72,How does the choking capacity of the power turbine affect the LP turbine pressure ratio?,"The choking capacity of the power turbine directly affects the LP turbine pressure ratio by determining the maximum allowable pressure ratio that the LP turbine can achieve. In a three-shaft gas turbine operating with a free power turbine, the LP turbine's pressure ratio (P₅/P₆) is constrained by the swallowing capacity and choking characteristics of the power turbine. When the power turbine is choked, it restricts the flow, which in turn limits the pressure ratio that the LP turbine can achieve. Therefore, the matching of the LP turbine and power turbine characteristics is crucial, as it establishes a unique running line on the LP compressor characteristic and ultimately dictates the operational parameters of the LP turbine."
Industrial_Gas_Turbines_AMY_Razak.txt,133,f9dc6ca75d0329229f33e5cfb1d820ab5c874dcbc8db04e3f0e8a9c0fa154e72,What is the significance of the unique running line on the HP compressor characteristic in a three-shaft gas turbine?,"The unique running line on the HP compressor characteristic in a three-shaft gas turbine is significant because it establishes the operational parameters for the HP compressor based on the interaction between the HP spool and the LP turbine. This running line is determined by the swallowing and choking capacity of the LP turbine, which influences the HP turbine pressure ratio. 

As the HP spool behaves like a two-shaft gas turbine operating with a free power turbine, the intersection of the unique running line with the corresponding temperature ratio line (T₄/T₂) fixes the HP compressor inlet non-dimensional flow and pressure ratio. This means that the operating point of the HP compressor is defined, allowing for predictable performance and efficiency under varying operating conditions. Consequently, understanding this relationship is crucial for optimizing the performance and efficiency of the gas turbine system."
Industrial_Gas_Turbines_AMY_Razak.txt,133,f9dc6ca75d0329229f33e5cfb1d820ab5c874dcbc8db04e3f0e8a9c0fa154e72,How does the power balance equation relate the LP compressor and turbine in a three-shaft gas turbine?,"The power balance equation in a three-shaft gas turbine relates the LP compressor and turbine by establishing a relationship between their temperature changes and the work done by the LP turbine. Specifically, the equation is expressed as:

ΔT₂₁ = ΔT₅₆ × cpa × T₅ × W⁵

In this equation, ΔT₂₁ represents the temperature rise across the LP compressor, while ΔT₅₆ represents the temperature drop across the LP turbine. The equation indicates that the temperature changes in the LP compressor and turbine are interconnected, with the efficiency of the LP turbine (represented by cpa) and the inlet temperature (T₅) of the LP turbine also playing critical roles.

This relationship implies that the performance of the LP compressor is directly influenced by the characteristics of the LP turbine, including its swallowing capacity and choking behavior, which ultimately determines the LP turbine pressure ratio. Thus, the power balance equation serves as a fundamental link between the operational characteristics of the LP compressor and the LP turbine in the three-shaft gas turbine system."
Industrial_Gas_Turbines_AMY_Razak.txt,133,f9dc6ca75d0329229f33e5cfb1d820ab5c874dcbc8db04e3f0e8a9c0fa154e72,What factors are assumed to remain constant when analyzing the non-dimensional temperature drop across the LP turbine?,"When analyzing the non-dimensional temperature drop across the LP turbine, it is assumed that the following factors remain constant:

1. **LP turbine efficiency**: The efficiency of the LP turbine is considered constant during the analysis.
2. **Non-dimensional speed line on the LP compressor characteristic**: It is assumed that a constant non-dimensional speed line is operated on.
3. **Specific heats (cpa and cpg)**: Changes in specific heats are ignored in the analysis.
4. **Power balance equation**: The relationship defined by the power balance equation remains constant.

These assumptions allow for the conclusion that the non-dimensional temperature drop, ΔT₅₆/T₅, will also be constant."
Industrial_Gas_Turbines_AMY_Razak.txt,133,f9dc6ca75d0329229f33e5cfb1d820ab5c874dcbc8db04e3f0e8a9c0fa154e72,How does the matching of the HP and LP turbine affect the temperature ratios in a three-shaft gas turbine?,"The matching of the HP (High Pressure) and LP (Low Pressure) turbines in a three-shaft gas turbine affects the temperature ratios by establishing constant non-dimensional temperature drops and ratios across the turbines. 

Specifically, for a given LP turbine efficiency, the non-dimensional temperature drop across the power turbine, represented as ΔT₅₆/T₅, remains constant. This implies that if a constant non-dimensional speed line on the LP compressor characteristic is maintained, the non-dimensional temperature rise across the LP compressor, ΔT₂₁/T₁, will also be constant. Consequently, ignoring variations in specific heats and assuming W₅ = W₁, it can be concluded that the temperature ratio T₅/T₁ is also constant.

Similarly, the matching of the HP and LP turbines results in a constant non-dimensional temperature drop across the HP turbine, expressed as ΔT₄₅/T₄. This leads to the conclusion that the temperature ratio T₅/T₄ remains constant as well. Given a constant ambient temperature T₁, a constant ΔT₂₁/T₁ results in a constant T₂, which in turn means that the ratio T₄/T₂ is also constant. 

Overall, the matching of the HP and LP turbines establishes fixed relationships between the various temperature ratios, which are critical for the performance and efficiency of the gas turbine system."
Industrial_Gas_Turbines_AMY_Razak.txt,133,f9dc6ca75d0329229f33e5cfb1d820ab5c874dcbc8db04e3f0e8a9c0fa154e72,What is the relationship between the non-dimensional temperature rise of the LP compressor and the temperature ratios in a three-shaft gas turbine?,"In a three-shaft gas turbine, the non-dimensional temperature rise of the LP compressor, denoted as ΔT₂₁/T₁, is constant when operating on a constant non-dimensional speed line on the LP compressor characteristic. This relationship implies that for a given LP turbine efficiency, the non-dimensional temperature drop across the power turbine, ΔT₅₆/T₅, is also constant. 

Furthermore, since the power balance equation indicates that W₅ = W₁, it can be concluded that the ratio T₅/T₁ remains constant as well. This interdependence means that the temperature ratios T₄/T₂, which represents the maximum to minimum temperature ratio for the HP spool, is also constant due to the matching of the HP and LP turbines. Thus, the operating conditions of the LP compressor directly influence the temperature ratios and overall performance characteristics of the three-shaft gas turbine."
Industrial_Gas_Turbines_AMY_Razak.txt,133,f9dc6ca75d0329229f33e5cfb1d820ab5c874dcbc8db04e3f0e8a9c0fa154e72,How does the ambient temperature influence the operation of the HP spool in a three-shaft gas turbine?,"The ambient temperature influences the operation of the HP spool in a three-shaft gas turbine by affecting the temperature ratios and the overall performance characteristics of the gas turbine system. Specifically, for a given ambient temperature \( T_1 \), a constant non-dimensional temperature rise \( \Delta T_{21}/T_1 \) leads to a constant \( T_2 \). This, in turn, affects the temperature ratio \( T_4/T_2 \), which is crucial for the HP spool's operation.

As the ambient temperature changes, it alters the inlet conditions for the HP compressor, impacting the non-dimensional flow and pressure ratios. The unique running line of the HP compressor is determined by the intersection of its characteristic with the corresponding \( T_4/T_2 \) line, which is influenced by the ambient temperature. Consequently, variations in ambient temperature can lead to changes in the operating point of the HP compressor, thereby affecting the overall efficiency and performance of the gas turbine system."
Industrial_Gas_Turbines_AMY_Razak.txt,133,f9dc6ca75d0329229f33e5cfb1d820ab5c874dcbc8db04e3f0e8a9c0fa154e72,In what way does the LP turbine behave in relation to the power turbine in a three-shaft gas turbine system?,"In a three-shaft gas turbine system, the LP turbine behaves as the power turbine. It drives its own LP compressor, which acts as the load, and together they form the LP spool. The performance of the LP turbine is characterized by its swallowing capacity, which determines the LP turbine pressure ratio. This relationship is crucial for matching the characteristics of the LP turbine with the power turbine, establishing a unique running line on the LP compressor characteristic. Essentially, the LP turbine operates in conjunction with the power turbine to optimize the overall performance of the gas turbine system."
Industrial_Gas_Turbines_AMY_Razak.txt,133,f9dc6ca75d0329229f33e5cfb1d820ab5c874dcbc8db04e3f0e8a9c0fa154e72,What is the impact of constant HP and LP turbine efficiencies on the temperature drop across the HP turbine?,"The impact of constant HP and LP turbine efficiencies on the temperature drop across the HP turbine is that it results in a constant non-dimensional temperature drop (ΔT₄₅/T₄) across the HP turbine. This means that as the efficiencies of both the HP and LP turbines remain constant, the temperature drop across the HP turbine will also remain consistent. Consequently, this leads to a fixed relationship between the temperatures T₄ and T₂, indicating that the ratio T₄/T₂ will also be constant. Thus, the performance and operating characteristics of the HP spool in a three-shaft gas turbine are stabilized, allowing for predictable behavior during operation."
Industrial_Gas_Turbines_AMY_Razak.txt,133,f9dc6ca75d0329229f33e5cfb1d820ab5c874dcbc8db04e3f0e8a9c0fa154e72,How does the intersection of the HP compressor running line with the T₄/T₂ line determine the HP compressor inlet non-dimensional flow?,"The intersection of the HP compressor running line with the T₄/T₂ line determines the HP compressor inlet non-dimensional flow by establishing a specific operating point for the HP compressor. The running line represents the operational characteristics of the HP compressor, while the T₄/T₂ line indicates the maximum to minimum temperature ratio for the HP spool in a three-shaft gas turbine.

When these two lines intersect, it fixes the non-dimensional flow at the HP compressor inlet, which is expressed as W₂√T₂/P₂. This means that the specific conditions of temperature and pressure at the inlet (T₂ and P₂) are directly related to the flow rate (W₂) at that point. Essentially, the intersection provides a unique operating condition that defines how the HP compressor will perform under those specific thermal and pressure conditions, thereby determining the non-dimensional flow at the inlet."
Industrial_Gas_Turbines_AMY_Razak.txt,133,f9dc6ca75d0329229f33e5cfb1d820ab5c874dcbc8db04e3f0e8a9c0fa154e72,What is the significance of the non-dimensional speed of the LP compressor in fixing the operating point on the HP compressor characteristic?,"The significance of the non-dimensional speed of the LP compressor (N₁/√T₁) in fixing the operating point on the HP compressor characteristic lies in its role in determining the operational parameters of the gas turbine system. 

In a three-shaft gas turbine operating with a free power turbine, the LP compressor and HP compressor are interconnected through their performance characteristics. The non-dimensional speed of the LP compressor is a critical factor because it influences the flow conditions and pressure ratios within the system. Specifically, as the non-dimensional speed of the LP compressor is established, it effectively determines the operating point on the HP compressor characteristic curve.

This relationship is important because the intersection of the unique running line of the HP compressor with the corresponding temperature ratio line (T₄/T₂) will fix the non-dimensional flow at the HP compressor inlet (W₂√T₂/P₂) and the pressure ratio (P₃/P₂). Thus, the non-dimensional speed of the LP compressor directly impacts the performance and efficiency of the HP compressor, ensuring that the entire gas turbine system operates effectively and within its designed performance envelope."
Industrial_Gas_Turbines_AMY_Razak.txt,133,f9dc6ca75d0329229f33e5cfb1d820ab5c874dcbc8db04e3f0e8a9c0fa154e72,How does the swallowing capacity of the power turbine influence the overall performance of the three-shaft gas turbine?,"The swallowing capacity of the power turbine in a three-shaft gas turbine significantly influences the overall performance by determining the LP turbine pressure ratio. Specifically, the power turbine's swallowing capacity affects the matching of the LP turbine and power turbine characteristics, which in turn establishes a unique running line on the LP compressor characteristic.

When the power turbine's swallowing capacity is optimized, it allows for efficient operation of the LP turbine, thereby maximizing the pressure ratio (P₅/P₆). This optimization is crucial because it directly impacts the power balance between the LP compressor and turbine, as indicated by the power balance equation. A well-matched swallowing capacity ensures that the LP turbine can effectively handle the flow and pressure conditions, leading to improved efficiency and performance of the entire gas turbine system.

Moreover, the performance characteristics of the HP spool, which behaves like a two-shaft gas turbine, are also influenced by the power turbine's swallowing capacity. This relationship helps to fix the operating points on the HP compressor characteristic, ultimately affecting the non-dimensional flow and pressure ratios, which are critical for the overall efficiency and effectiveness of the gas turbine operation."
Industrial_Gas_Turbines_AMY_Razak.txt,133,f9dc6ca75d0329229f33e5cfb1d820ab5c874dcbc8db04e3f0e8a9c0fa154e72,What assumptions are made regarding specific heats when analyzing the power balance in a three-shaft gas turbine?,"The analysis of the power balance in a three-shaft gas turbine makes the assumption that the specific heats, denoted as \( c_{pa} \) (specific heat at constant pressure for air) and \( c_{pg} \) (specific heat at constant pressure for gas), remain constant. This simplification allows for the conclusion that certain temperature ratios and relationships can be treated as constant during the operation of the gas turbine."
Industrial_Gas_Turbines_AMY_Razak.txt,133,f9dc6ca75d0329229f33e5cfb1d820ab5c874dcbc8db04e3f0e8a9c0fa154e72,How does the LP turbine's choking capacity restrict the LP pressure ratio in a three-shaft gas turbine?,"In a three-shaft gas turbine, the LP turbine's choking capacity restricts the LP pressure ratio (P₅/P₆) by limiting the amount of mass flow that can pass through the turbine. When the LP turbine reaches its choking point, it cannot accommodate any further increase in flow, which directly affects the pressure ratio across the LP turbine. 

As the choking capacity of the LP turbine determines how much airflow it can handle, it sets a maximum limit on the pressure ratio that can be achieved. If the flow exceeds this choking capacity, the turbine cannot operate efficiently, leading to a decrease in performance and an inability to increase the pressure ratio beyond a certain point. Therefore, the matching of the LP turbine characteristics with the power turbine characteristics is crucial, as it establishes a unique operating point that defines the LP turbine pressure ratio based on its choking capacity."
Industrial_Gas_Turbines_AMY_Razak.txt,133,f9dc6ca75d0329229f33e5cfb1d820ab5c874dcbc8db04e3f0e8a9c0fa154e72,What is the effect of a constant non-dimensional speed line on the LP compressor characteristic during operation?,"The effect of a constant non-dimensional speed line on the LP compressor characteristic during operation is that it leads to a constant non-dimensional temperature rise, ΔT₂₁/T₁. This means that as the LP compressor operates along this speed line, the temperature rise across the compressor remains consistent. Additionally, since the power balance equation indicates that W₅ = W₁, it can be concluded that the ratio T₅/T₁ also remains constant. Consequently, the operating point on the LP compressor characteristic is fixed, which influences the overall performance and efficiency of the gas turbine system."
Industrial_Gas_Turbines_AMY_Razak.txt,133,f9dc6ca75d0329229f33e5cfb1d820ab5c874dcbc8db04e3f0e8a9c0fa154e72,How does the temperature ratio T₄/T₂ relate to the maximum and minimum temperature ratios for the HP spool?,"The temperature ratio T₄/T₂ represents the maximum to minimum temperature ratio for the HP spool in a three-shaft gas turbine. This ratio is constant due to the matching of the HP and LP turbines, which results in a consistent non-dimensional temperature drop across the HP turbine. Since the HP spool behaves as a two-shaft gas turbine operating with a free power turbine, the unique running line of the HP compressor intersects with the corresponding T₄/T₂ line, thereby fixing the operating conditions of the HP compressor. As a result, the temperature ratio T₄/T₂ is crucial in determining the performance characteristics of the HP spool, establishing a relationship between the maximum and minimum temperatures within that system."
Industrial_Gas_Turbines_AMY_Razak.txt,133,f9dc6ca75d0329229f33e5cfb1d820ab5c874dcbc8db04e3f0e8a9c0fa154e72,What role does the HP compressor play in the overall functioning of a three-shaft gas turbine operating with a free power turbine?,"In a three-shaft gas turbine operating with a free power turbine, the HP (High Pressure) compressor plays a crucial role as part of the HP spool. The HP spool consists of the HP compressor driven by its own HP turbine, and it acts as the gas generator of the system. The HP compressor is responsible for compressing the incoming air, which is then directed into the combustor where it mixes with fuel and is ignited. 

The performance of the HP compressor is influenced by the characteristics of the LP (Low Pressure) turbine, which acts as the power turbine in this configuration. The interaction between the HP compressor and the LP turbine establishes a unique running line on the HP compressor characteristic, determining the operating conditions of the gas turbine. 

Additionally, the HP compressor's performance is linked to the pressure ratios and temperature relationships within the system, which are critical for maintaining efficient operation and power output. The HP compressor's inlet non-dimensional flow and pressure ratio are fixed by the intersection of its running line with the corresponding temperature ratio line for the HP spool, ensuring that the overall functioning of the gas turbine remains optimized."
Industrial_Gas_Turbines_AMY_Razak.txt,133,f9dc6ca75d0329229f33e5cfb1d820ab5c874dcbc8db04e3f0e8a9c0fa154e72,How does the temperature ratio T₄/T₂ affect the operation of the HP compressor in a three-shaft gas turbine?,"The temperature ratio T₄/T₂ plays a significant role in the operation of the HP compressor in a three-shaft gas turbine. As T₄/T₂ increases, the lines of constant temperature ratio on the HP compressor characteristic move towards surge. This means that a higher T₄/T₂ ratio can lead to a reduced surge margin for the HP compressor, making it more susceptible to surge conditions during operation.

The intersection of the HP compressor's unique running line with the corresponding T₄/T₂ line fixes the HP compressor inlet non-dimensional flow (W₂√T₂/P₂) and the pressure ratio (P₃/P₂). Therefore, as the T₄/T₂ ratio increases, it influences the operating point of the HP compressor, potentially leading to conditions that could result in surge if not properly managed.

In summary, an increasing T₄/T₂ ratio can adversely affect the stability of the HP compressor by moving the operating point closer to surge conditions, necessitating careful management of the compressor's operating parameters to maintain stable operation."
Industrial_Gas_Turbines_AMY_Razak.txt,133,f9dc6ca75d0329229f33e5cfb1d820ab5c874dcbc8db04e3f0e8a9c0fa154e72,What is the significance of the non-dimensional flow W₂√T₂/P₂ at the HP compressor inlet?,"The non-dimensional flow \( W₂\sqrt{T₂}/P₂ \) at the HP compressor inlet is significant because it establishes a unique operating point for the HP compressor based on the conditions of the gas turbine system. This parameter is crucial for determining the compressor's performance characteristics, as it relates the mass flow rate of the gas through the compressor to its temperature and pressure conditions.

Specifically, the value of \( W₂\sqrt{T₂}/P₂ \) helps to fix the HP compressor inlet non-dimensional flow, which in turn influences the pressure ratio \( P₃/P₂ \) and the non-dimensional speed \( N₁/\sqrt{T₁} \) of the LP compressor. By maintaining a constant \( W₂\sqrt{T₂}/P₂ \), the HP compressor can operate efficiently within its characteristic curve, ensuring stable performance and preventing issues such as surge.

Additionally, the relationship between the HP and LP compressors, facilitated by this non-dimensional flow, allows for effective flow compatibility and coordination between the two stages of the turbine, enhancing overall operational efficiency and performance of the gas turbine system."
