NODE_FILE_NAME,NODE_NUMBER,NODE_HASH,QUESTION,ANSWER
Industrial_Gas_Turbines_AMY_Razak.txt,133,f9dc6ca75d0329229f33e5cfb1d820ab5c874dcbc8db04e3f0e8a9c0fa154e72,How does the choked condition of the LP turbine affect the HP spool in a three-shaft gas turbine?,"In a three-shaft gas turbine, the choked condition of the LP (low-pressure) turbine shields the HP (high-pressure) spool from any changes in the power turbine flow capacity. This means that the HP spool remains unaffected by variations in the power turbine flow capacity because the LP turbine is operating under choked conditions. As a result, the running line on the HP compressor characteristic remains stable, and the HP turbine pressure ratio does not change due to the increase in power turbine flow capacity. Consequently, the HP compressor running line will fall to a lower pressure ratio and inlet non-dimensional flow, while the HP compressor's operating conditions remain relatively constant despite changes in the LP turbine's performance."
Industrial_Gas_Turbines_AMY_Razak.txt,133,f9dc6ca75d0329229f33e5cfb1d820ab5c874dcbc8db04e3f0e8a9c0fa154e72,What happens to the LP compressor discharge temperature when the LP compressor operates at a constant non-dimensional speed?,"When the LP compressor operates at a constant non-dimensional speed, the LP compressor discharge temperature remains approximately constant. This is because, under these conditions, there is little variation in mass flow rate through the LP compressor with any change in LP compressor pressure, leading to a stable discharge temperature."
Industrial_Gas_Turbines_AMY_Razak.txt,133,f9dc6ca75d0329229f33e5cfb1d820ab5c874dcbc8db04e3f0e8a9c0fa154e72,How does an increase in power turbine flow capacity influence the power output of the LP turbine?,"An increase in power turbine flow capacity results in an increase in the LP turbine pressure ratio, which in turn leads to an increase in the LP turbine power output. This is because the increased flow capacity allows the LP turbine to operate at a higher pressure ratio, enhancing its performance and power generation capabilities."
Industrial_Gas_Turbines_AMY_Razak.txt,133,f9dc6ca75d0329229f33e5cfb1d820ab5c874dcbc8db04e3f0e8a9c0fa154e72,What is the relationship between turbine entry temperature (T₄) and the power LP spool balance?,"The relationship between turbine entry temperature (T₄) and the power LP spool balance is that T₄ must decrease to maintain the balance of the LP spool when the power turbine flow capacity is increased. This is because, with an increase in power turbine flow capacity, the LP turbine pressure ratio increases, which in turn affects the operating conditions of the LP compressor. To maintain the balance of the LP spool, the turbine entry temperature (T₄) must reduce, resulting in a decrease in the ratio T₄/T₂, where T₂ remains approximately constant. Thus, a higher power turbine flow capacity leads to a lower turbine entry temperature to ensure proper operation and balance of the gas turbine system."
Industrial_Gas_Turbines_AMY_Razak.txt,133,f9dc6ca75d0329229f33e5cfb1d820ab5c874dcbc8db04e3f0e8a9c0fa154e72,How does the operating point on the HP compressor characteristic running line change with an increase in power turbine flow capacity?,"With an increase in power turbine flow capacity, the operating point on the HP compressor characteristic running line falls to a lower pressure ratio and inlet non-dimensional flow. This change occurs because the increase in power turbine flow capacity leads to an increase in the LP turbine pressure ratio, which in turn affects the operating conditions of the HP compressor. Specifically, as the LP compressor discharge non-dimensional flow decreases, the HP compressor must adjust to maintain balance, resulting in a lower operating point on its characteristic running line."
Industrial_Gas_Turbines_AMY_Razak.txt,133,f9dc6ca75d0329229f33e5cfb1d820ab5c874dcbc8db04e3f0e8a9c0fa154e72,What effect does a reduction in power turbine flow capacity have on turbine entry temperature (T₄)?,A reduction in power turbine flow capacity results in an increase in the turbine entry temperature (T₄). This change causes the operating point to move along the HP compressor running line to a higher non-dimensional flow and pressure ratio.
Industrial_Gas_Turbines_AMY_Razak.txt,133,f9dc6ca75d0329229f33e5cfb1d820ab5c874dcbc8db04e3f0e8a9c0fa154e72,How does the flow identity between the inlet and discharge of the LP compressor affect the LP compressor pressure ratio?,"The flow identity between the inlet and discharge of the LP compressor indicates that the flow conditions at the inlet (P₁, T₁) and the discharge (P₂, T₂) are interconnected. As described, since the non-dimensional speed is constant and the mass flow rate (W) remains unchanged (with no bleeds), any reduction in the LP compressor's non-dimensional discharge flow (W₂√T₂/P₂) must be accompanied by a reduction in the inlet pressure (P₁). 

This relationship implies that if the discharge flow decreases, the pressure ratio (P₂/P₁) must increase to maintain the flow identity. Therefore, when the power turbine flow capacity is increased, leading to a reduced non-dimensional discharge flow from the LP compressor, the LP compressor pressure ratio increases as a result. This is because the increase in pressure ratio compensates for the reduced flow conditions at the discharge, maintaining the overall balance in the system."
Industrial_Gas_Turbines_AMY_Razak.txt,133,f9dc6ca75d0329229f33e5cfb1d820ab5c874dcbc8db04e3f0e8a9c0fa154e72,What is the significance of non-dimensional speed lines in relation to mass flow rate through the LP compressor?,"The significance of non-dimensional speed lines in relation to the mass flow rate through the LP compressor is that they illustrate the relationship between flow and pressure ratio under constant non-dimensional speed conditions. Since the non-dimensional speed lines are steep, there is little variation in mass flow rate through the LP compressor with any change in LP compressor pressure. This means that even if there are changes in the power turbine flow capacity, the power absorbed by the LP compressor remains essentially constant, as the mass flow rate is not significantly affected by small changes in pressure ratio. Thus, the non-dimensional speed lines help to understand the operating behavior of the LP compressor during variations in turbine flow capacity."
Industrial_Gas_Turbines_AMY_Razak.txt,133,f9dc6ca75d0329229f33e5cfb1d820ab5c874dcbc8db04e3f0e8a9c0fa154e72,How does the increase in LP compressor pressure ratio relate to the changes in power turbine flow capacity?,"The increase in LP compressor pressure ratio is directly related to the changes in power turbine flow capacity. When the power turbine flow capacity increases, it leads to an increase in the LP turbine pressure ratio. This occurs because, under the assumption that the turbines remain choked, the HP spool is shielded from changes in the power turbine flow capacity due to the choked condition of the LP turbine. 

As the power turbine flow capacity increases, the LP turbine power output also increases, which results in a higher LP turbine pressure ratio. Consequently, to maintain the balance of the LP spool, the turbine entry temperature (T₄) must decrease. This decrease in T₄ is necessary to keep the power balance, as the HP compressor running line remains unaffected by the changes in power turbine flow capacity. 

Thus, the increase in LP compressor pressure ratio is a response to the increase in power turbine flow capacity, leading to a reduction in turbine entry temperature and a shift in the operating points of the compressors."
Industrial_Gas_Turbines_AMY_Razak.txt,133,f9dc6ca75d0329229f33e5cfb1d820ab5c874dcbc8db04e3f0e8a9c0fa154e72,What occurs to the HP compressor characteristic running line when the power turbine flow capacity is increased?,"When the power turbine flow capacity is increased, the operating point on the HP compressor characteristic running line falls to a lower pressure ratio and inlet non-dimensional flow. This is due to the reduction in the turbine entry temperature (T₄) necessary to maintain the power LP spool balance, as the HP compressor running line remains unaffected by the change in power turbine flow capacity."
Industrial_Gas_Turbines_AMY_Razak.txt,133,f9dc6ca75d0329229f33e5cfb1d820ab5c874dcbc8db04e3f0e8a9c0fa154e72,How does the reduction in LP compressor non-dimensional discharge flow relate to changes in pressure ratio?,"The reduction in LP compressor non-dimensional discharge flow, represented as \( W_2\sqrt{T_2}/P_2 \), must be accompanied by an increase in the LP compressor pressure ratio, \( P_2/P_1 \). This relationship arises from the flow identity between the inlet and discharge of the LP compressor, which indicates that if the non-dimensional discharge flow decreases, the pressure ratio must increase to maintain the balance in the system. Consequently, when the power turbine flow capacity is increased, the turbine entry temperature \( T_4 \) decreases, leading to an increase in the LP compressor pressure ratio."
Industrial_Gas_Turbines_AMY_Razak.txt,133,f9dc6ca75d0329229f33e5cfb1d820ab5c874dcbc8db04e3f0e8a9c0fa154e72,What is the consequence of a decrease in power turbine flow capacity on the operating point of the HP compressor?,"A decrease in power turbine flow capacity will result in an increase in the turbine entry temperature, T₄. This change causes the operating point on the HP compressor running line to move to a higher non-dimensional flow and pressure ratio. Consequently, the HP compressor operates at a higher pressure ratio and non-dimensional flow compared to its previous state."
Industrial_Gas_Turbines_AMY_Razak.txt,133,f9dc6ca75d0329229f33e5cfb1d820ab5c874dcbc8db04e3f0e8a9c0fa154e72,How does the assumption of turbines remaining choked simplify the analysis of a three-shaft gas turbine?,"The assumption that the turbines remain choked simplifies the analysis of a three-shaft gas turbine by allowing us to isolate the effects of changes in the power turbine flow capacity without affecting the high-pressure (HP) spool. When the turbines are choked, the flow through the low-pressure (LP) turbine is limited, which means that any changes in the power turbine flow capacity do not influence the HP spool's performance. As a result, the running line on the HP compressor characteristic remains unaffected by variations in the power turbine flow capacity. This simplification allows for a more straightforward analysis of the relationships between the pressure ratios and power outputs of the turbines without the need to account for complex interactions that would arise if the turbines were not choked."
Industrial_Gas_Turbines_AMY_Razak.txt,133,f9dc6ca75d0329229f33e5cfb1d820ab5c874dcbc8db04e3f0e8a9c0fa154e72,What is the effect of increasing power turbine flow capacity on the operating points of the LP and HP characteristics?,"Increasing the power turbine flow capacity has several effects on the operating points of the LP (low-pressure) and HP (high-pressure) compressor characteristics:

1. **Increase in LP Turbine Pressure Ratio**: The increase in power turbine flow capacity results in an increase in the LP turbine pressure ratio. This is due to the choked condition of the LP turbine, which allows for more flow through the power turbine without affecting the HP spool.

2. **Constant HP Compressor Running Line**: The HP compressor running line remains unaffected by the changes in power turbine flow capacity because the HP turbine pressure ratio does not change under these conditions. Therefore, the operating point on the HP compressor characteristic will fall to a lower pressure ratio and inlet non-dimensional flow.

3. **Reduction in HP Compressor Inlet Non-Dimensional Flow**: As the power turbine flow capacity increases, the operating point on the HP compressor characteristic moves to a lower non-dimensional flow, necessitating a reduction in the LP compressor discharge non-dimensional flow to maintain balance.

4. **Decrease in Turbine Entry Temperature (T₄)**: To maintain the balance of the LP spool, the turbine entry temperature (T₄) must decrease. This occurs because the HP compressor running line is not affected by the increase in power turbine flow capacity, leading to a decrease in the ratio T₄/T₂.

5. **Increase in LP Compressor Pressure Ratio**: The flow identity between the inlet and discharge of the LP compressor indicates that any reduction in LP compressor non-dimensional discharge flow must be accompanied by an increase in the LP compressor pressure ratio (P₂/P₁).

In summary, increasing the power turbine flow capacity leads to an increase in the LP turbine pressure ratio, a decrease in turbine entry temperature, and a shift in the operating points of both the LP and HP compressors, with the HP compressor moving to lower non-dimensional flow and pressure ratios while the LP compressor pressure ratio increases."
Industrial_Gas_Turbines_AMY_Razak.txt,133,f9dc6ca75d0329229f33e5cfb1d820ab5c874dcbc8db04e3f0e8a9c0fa154e72,How does the non-dimensional flow through the LP compressor change with variations in power turbine flow capacity?,"The non-dimensional flow through the LP compressor remains essentially constant with changes in power turbine flow capacity, assuming the LP compressor operates at a constant non-dimensional speed. This is due to the steep non-dimensional speed lines that describe the variation of flow with pressure ratio, which indicate little variation in mass flow rate through the LP compressor with any change in LP compressor pressure. Therefore, while the power turbine flow capacity may increase or decrease, the non-dimensional flow through the LP compressor does not significantly change."
Industrial_Gas_Turbines_AMY_Razak.txt,133,f9dc6ca75d0329229f33e5cfb1d820ab5c874dcbc8db04e3f0e8a9c0fa154e72,What does the steepness of non-dimensional speed lines indicate about the mass flow rate through the LP compressor?,"The steepness of the non-dimensional speed lines indicates that there is little variation in mass flow rate through the LP compressor with any change in LP compressor pressure. This means that even if there are changes in pressure, the mass flow rate remains essentially constant due to the steep nature of the lines."
Industrial_Gas_Turbines_AMY_Razak.txt,133,f9dc6ca75d0329229f33e5cfb1d820ab5c874dcbc8db04e3f0e8a9c0fa154e72,How does the relationship between T₄ and T₂ change with an increase in power turbine flow capacity?,"With an increase in power turbine flow capacity, the relationship between the turbine entry temperature (T₄) and the compressor inlet temperature (T₂) changes in such a way that the ratio T₄/T₂ decreases. This occurs because, to maintain the power balance of the LP spool, the turbine entry temperature T₄ must reduce as the power turbine flow capacity increases. Thus, while T₂ remains approximately constant, T₄ decreases, leading to a lower ratio of T₄ to T₂."
Industrial_Gas_Turbines_AMY_Razak.txt,133,f9dc6ca75d0329229f33e5cfb1d820ab5c874dcbc8db04e3f0e8a9c0fa154e72,In what way does the LP compressor pressure ratio increase when the power turbine capacity is increased?,"When the power turbine capacity is increased, the LP turbine pressure ratio increases due to the following sequence of events:

1. **Choked Conditions**: The assumption is made that the turbines remain choked, meaning that the HP spool is shielded from any changes in the power turbine flow capacity because the LP turbine is in a choked condition.

2. **Increased Flow Capacity**: An increase in the power turbine flow capacity leads to an increase in the LP turbine pressure ratio. This is illustrated in the context where the power output of the LP turbine increases as a result of the higher flow capacity.

3. **Constant Non-Dimensional Speed**: If the LP compressor continues to operate at a constant non-dimensional speed, the discharge temperature of the LP compressor remains approximately constant. However, the mass flow rate through the LP compressor shows little variation with changes in pressure.

4. **Pressure Ratio Dynamics**: As the power turbine flow capacity increases, the turbine entry temperature (T₄) must decrease to maintain the balance of the LP spool. This reduction in T₄ results in an increase in the LP compressor pressure ratio (P₂/P₁), as the operating point shifts along the LP compressor characteristic.

5. **Flow Identity**: The flow identity between the inlet and discharge of the LP compressor indicates that any reduction in the non-dimensional discharge flow (W₂√T₂/P₂) must be accompanied by an increase in the LP compressor pressure ratio (P₂/P₁).

In summary, the increase in power turbine capacity leads to a decrease in turbine entry temperature, which in turn causes the LP compressor pressure ratio to increase as the system adjusts to maintain balance."
Industrial_Gas_Turbines_AMY_Razak.txt,133,f9dc6ca75d0329229f33e5cfb1d820ab5c874dcbc8db04e3f0e8a9c0fa154e72,How does an increase in power turbine capacity affect the LP compressor pressure ratio and turbine entry temperature?,"An increase in power turbine capacity results in a decrease in the turbine entry temperature (T₄) and an increase in the LP compressor pressure ratio (P₂/P₁). This means that as the power turbine capacity increases, the operating conditions lead to a higher pressure ratio in the LP compressor while the turbine entry temperature decreases."
Industrial_Gas_Turbines_AMY_Razak.txt,133,f9dc6ca75d0329229f33e5cfb1d820ab5c874dcbc8db04e3f0e8a9c0fa154e72,What is the relationship between power turbine flow capacity and turbine entry temperature?,"The relationship between power turbine flow capacity and turbine entry temperature is inversely proportional. A reduction in the power turbine flow capacity results in an increase in the turbine entry temperature (T₄). This means that as the flow capacity of the power turbine decreases, the temperature at the entry of the turbine increases."
Industrial_Gas_Turbines_AMY_Razak.txt,133,f9dc6ca75d0329229f33e5cfb1d820ab5c874dcbc8db04e3f0e8a9c0fa154e72,Describe the impact of a reduction in power turbine flow capacity on the operating point of a gas turbine.,"A reduction in power turbine flow capacity leads to an increase in the turbine entry temperature (T₄). This change causes the operating point of the gas turbine to shift along the high-pressure (HP) compressor running line towards a higher non-dimensional flow and pressure ratio. As a result, the pressure ratio of the low-pressure (LP) compressor decreases along a given non-dimensional speed line. This indicates that the overall performance and efficiency of the gas turbine may be affected due to the altered operating conditions."
Industrial_Gas_Turbines_AMY_Razak.txt,133,f9dc6ca75d0329229f33e5cfb1d820ab5c874dcbc8db04e3f0e8a9c0fa154e72,How does the LP compressor characteristic change when the pressure ratio decreases along a given non-dimensional speed line?,"When the pressure ratio decreases along a given non-dimensional speed line for the LP compressor, it indicates that the operating point is moving to a lower pressure ratio on the LP compressor characteristic curve. This change typically results in a reduction in the efficiency of the compressor, as it operates farther away from its optimal performance range. Additionally, a decrease in pressure ratio may lead to an increase in the flow capacity of the compressor, which can affect the overall performance of the gas turbine system. The operating point will shift along the characteristic curve, reflecting these changes in performance metrics."
Industrial_Gas_Turbines_AMY_Razak.txt,133,f9dc6ca75d0329229f33e5cfb1d820ab5c874dcbc8db04e3f0e8a9c0fa154e72,Explain the significance of the two-shaft gas turbine configuration in relation to the LP and power turbine.,"The significance of the two-shaft gas turbine configuration lies in its integration of the low-pressure (LP) turbine with both the LP compressor and the load, creating a more efficient and effective system for power generation. In this configuration, the LP turbine drives the LP compressor and the load simultaneously, which allows for a consistent operational speed that corresponds to the synchronous speed of the generator. This is particularly advantageous for electrical power generation applications.

By operating along a constant non-dimensional speed line on the LP compressor characteristic, the two-shaft gas turbine can maintain stable performance under varying ambient conditions. This integration simplifies the design and enhances the operational efficiency of the turbine system, making it suitable for applications where reliable and steady power output is essential. Additionally, this configuration allows for better management of the turbine entry temperature and pressure ratios, contributing to improved overall performance and adaptability in different operating scenarios."
Industrial_Gas_Turbines_AMY_Razak.txt,133,f9dc6ca75d0329229f33e5cfb1d820ab5c874dcbc8db04e3f0e8a9c0fa154e72,What is the role of the LP turbine in driving both the LP compressor and load in a two-shaft gas turbine?,"The role of the LP turbine in a two-shaft gas turbine is to drive both the LP compressor and the load. In this configuration, the LP turbine operates at a constant speed, which is synchronized with the generator's synchronous speed. This allows the LP turbine to effectively manage the flow and pressure within the system while providing the necessary power to the LP compressor and the load, making it suitable for applications such as electrical power generation."
Industrial_Gas_Turbines_AMY_Razak.txt,133,f9dc6ca75d0329229f33e5cfb1d820ab5c874dcbc8db04e3f0e8a9c0fa154e72,"How does the constant speed operation of the LP compressor, LP turbine, and load relate to electrical power generation?","The constant speed operation of the LP compressor, LP turbine, and load is significant for electrical power generation because it allows for stable and efficient performance of the system. In this configuration, the LP turbine drives both the LP compressor and the load (such as a generator) at a synchronous speed, which is essential for maintaining the frequency and stability of the electrical output. 

Since the LP compressor, LP turbine, and load operate at a constant speed, the system can achieve a consistent non-dimensional speed line on the LP compressor characteristic. This ensures that the performance of the gas turbine remains predictable and reliable, which is crucial for applications in electrical power generation. The integration of these components enables the gas turbine to efficiently convert fuel into electrical energy while maintaining optimal operating conditions, thus enhancing the overall efficiency and effectiveness of power generation."
Industrial_Gas_Turbines_AMY_Razak.txt,133,f9dc6ca75d0329229f33e5cfb1d820ab5c874dcbc8db04e3f0e8a9c0fa154e72,What is the effect of ambient temperature on the running line of a two-shaft gas turbine?,"The effect of ambient temperature on the running line of a two-shaft gas turbine is that for a given ambient temperature, T₁, the running line will be along a constant non-dimensional speed line on the LP compressor characteristic. This means that the performance of the gas turbine, including the operation of the LP compressor, LP turbine, and load, is influenced by the ambient temperature, which helps determine the operational characteristics of the turbine system."
Industrial_Gas_Turbines_AMY_Razak.txt,133,f9dc6ca75d0329229f33e5cfb1d820ab5c874dcbc8db04e3f0e8a9c0fa154e72,How does the running line for a two-shaft gas turbine differ from that of a three-shaft gas turbine?,"The running line for a two-shaft gas turbine differs from that of a three-shaft gas turbine in that the two-shaft configuration integrates the LP and power turbine as one component, with the LP turbine driving both the LP compressor and the load. In contrast, a three-shaft gas turbine operates with a free power turbine, allowing for more independent operation of the LP and power turbines. Additionally, in the two-shaft gas turbine, the LP compressor, LP turbine, and load operate at a constant speed corresponding to the synchronous speed of the generator, resulting in a running line along a constant non-dimensional speed line on the LP compressor characteristic. This integration makes the two-shaft gas turbine particularly suitable for applications such as electrical power generation."
Industrial_Gas_Turbines_AMY_Razak.txt,133,f9dc6ca75d0329229f33e5cfb1d820ab5c874dcbc8db04e3f0e8a9c0fa154e72,What happens to the LP compressor characteristic when the operating point moves along the HP compressor running line?,"When the operating point moves along the HP compressor running line, there is a decrease in the power turbine flow capacity, which results in an increase in the turbine entry temperature, T₄. This change causes the operating point to shift to a higher non-dimensional flow and pressure ratio along the HP compressor running line. Consequently, the effect on the LP compressor characteristic will be a decrease in pressure ratio along a given non-dimensional speed line."
