NODE_FILE_NAME,NODE_NUMBER,NODE_HASH,QUESTION,ANSWER
Industrial_Gas_Turbines_AMY_Razak.txt,150,9398f74ba28dd5260d14304a55095faf7dcae02a589a03ab0a89d60f2e0ec940,What factors can contribute to the failure of gas turbines beyond mechanical issues?,"Factors that can contribute to the failure of gas turbines beyond mechanical issues include organizational structures and methods. Additionally, the analysis of logged data, which encompasses operating conditions, events, and the performance of barriers or protection systems, is essential in identifying root causes of failures. This data-driven approach allows for the detection of trends and changes in component characteristics that may indicate potential faults, enabling proactive measures to prevent engine failures."
Industrial_Gas_Turbines_AMY_Razak.txt,150,9398f74ba28dd5260d14304a55095faf7dcae02a589a03ab0a89d60f2e0ec940,How can logging and analyzing data help in identifying the root causes of gas turbine failures?,"Logging and analyzing data can help identify the root causes of gas turbine failures by providing a comprehensive view of operating conditions, events, and any exceeded barriers or protection systems. By systematically collecting data on fault indices, which indicate changes in component characteristics due to faults, and examining trends in these indices, diagnostics can be performed to detect the onset of damage or faults before they lead to engine failure. This proactive approach allows for timely interventions, such as addressing compressor fouling or seal wear, which, while not typically resulting in immediate failure, can reduce efficiency and capacity if left unaddressed. By understanding these trends and their implications, operators can take preventive actions to enhance engine availability and profitability, ultimately minimizing the risk of serious failures and associated downtime."
Industrial_Gas_Turbines_AMY_Razak.txt,150,9398f74ba28dd5260d14304a55095faf7dcae02a589a03ab0a89d60f2e0ec940,What role do fault indices play in diagnosing issues within gas turbine components?,"Fault indices play a crucial role in diagnosing issues within gas turbine components by indicating changes in component characteristics due to faults. By examining the trends of these fault indices, diagnostics can be performed to detect the onset of damage and faults before they lead to engine failure. This proactive approach allows for timely interventions, such as addressing compressor fouling or seal wear, which are common during engine operation but typically do not result in failure. More serious issues, like blade rubs and hot end damage, can also be identified through trend analysis, enabling actions to be taken to prevent potential engine failures. Ultimately, this contributes to improved availability and profitability of gas turbines."
Industrial_Gas_Turbines_AMY_Razak.txt,150,9398f74ba28dd5260d14304a55095faf7dcae02a589a03ab0a89d60f2e0ec940,Why is it important to monitor trends in fault indices for gas turbines?,"Monitoring trends in fault indices for gas turbines is important because it allows for the early detection of changes in component characteristics that may indicate potential faults. By analyzing these trends, diagnostics can be performed to identify the onset of damage or faults before they lead to engine failure. This proactive approach enables timely interventions, such as maintenance or repairs, which can prevent more serious issues like blade rubs or hot end damage. Ultimately, monitoring fault indices helps improve the availability and profitability of gas turbines by minimizing downtime and optimizing operational efficiency."
Industrial_Gas_Turbines_AMY_Razak.txt,150,9398f74ba28dd5260d14304a55095faf7dcae02a589a03ab0a89d60f2e0ec940,What types of damage can be detected early to prevent engine failure in gas turbines?,"The types of damage that can be detected early to prevent engine failure in gas turbines include compressor fouling, seal wear, blade rubs, and hot end damage. By examining trends in fault indices related to these issues, maintenance actions can be taken before more serious failures occur, thereby improving engine availability and profitability."
Industrial_Gas_Turbines_AMY_Razak.txt,150,9398f74ba28dd5260d14304a55095faf7dcae02a589a03ab0a89d60f2e0ec940,How does compressor fouling affect the efficiency and capacity of gas turbines?,"Compressor fouling negatively affects the efficiency and capacity of gas turbines by reducing the compressor's ability to operate effectively. The build-up of dirt and deposits during engine operation leads to decreased airflow and pressure, which in turn diminishes the overall performance of the gas turbine. This reduction in efficiency can result in lower production output and profitability. Regular cleaning, typically through compressor washing, is necessary to maintain optimal performance and prevent significant losses in efficiency and capacity due to fouling."
Industrial_Gas_Turbines_AMY_Razak.txt,150,9398f74ba28dd5260d14304a55095faf7dcae02a589a03ab0a89d60f2e0ec940,What is the purpose of regularly washing the compressor in gas turbine operations?,"The purpose of regularly washing the compressor in gas turbine operations is to maintain the capacity and efficiency of the compressor by removing the build-up of dirt and deposits that occur during engine operation. This cleaning process helps to prevent a reduction in engine performance, which can adversely affect production and profitability. By optimizing the frequency of compressor washes, operators can minimize the loss in profit or revenue due to fouling and the downtime associated with washing."
Industrial_Gas_Turbines_AMY_Razak.txt,150,9398f74ba28dd5260d14304a55095faf7dcae02a589a03ab0a89d60f2e0ec940,What are the potential consequences of infrequent compressor washing on gas turbine performance?,"Infrequent compressor washing can lead to a reduction in gas turbine performance due to the build-up of dirt and deposits on the compressor. This fouling decreases the capacity and efficiency of the compressor, which can adversely affect production and profitability. As a result, the engine may experience decreased performance, leading to lower output and potentially reduced revenue. Additionally, the longer intervals between washes can result in more significant performance deterioration, further impacting the overall efficiency and operational availability of the gas turbine."
Industrial_Gas_Turbines_AMY_Razak.txt,150,9398f74ba28dd5260d14304a55095faf7dcae02a589a03ab0a89d60f2e0ec940,How does the frequency of compressor washing impact production and profitability?,"The frequency of compressor washing impacts production and profitability in several ways:

1. **Downtime**: Each time the compressor is washed, there is a period during which the engine is unavailable for operation. This downtime directly affects production, as the engine cannot generate revenue while it is being cleaned.

2. **Cost of Washing**: The cost associated with each wash must be considered alongside the lost revenue due to downtime. As the frequency of washing increases, the total cost incurred from washing also rises, which can further impact profitability.

3. **Engine Performance**: If washing is infrequent, the build-up of dirt and deposits can lead to reduced capacity and efficiency of the compressor. This deterioration in performance can result in lower production output and, consequently, reduced profitability.

4. **Optimisation of Frequency**: There is a need to find an optimal balance in the frequency of washing. Too frequent washing can lead to increased costs and downtime, while infrequent washing can decrease engine performance and production. Therefore, optimising the wash frequency is crucial to minimise the overall loss in profit or revenue caused by both fouling and the washing process itself.

In summary, the frequency of compressor washing has a significant effect on both production and profitability, necessitating careful management to ensure that the costs and downtime associated with washing do not outweigh the benefits of maintaining engine performance."
Industrial_Gas_Turbines_AMY_Razak.txt,150,9398f74ba28dd5260d14304a55095faf7dcae02a589a03ab0a89d60f2e0ec940,What factors should be considered when optimizing compressor wash frequency?,"When optimizing compressor wash frequency, the following factors should be considered:

1. **Impact on Engine Performance**: The build-up of dirt and deposits can reduce the capacity and efficiency of the compressor, leading to performance deterioration. Regular washing is necessary to maintain optimal performance.

2. **Downtime for Washing**: The time taken for washing the compressor affects engine availability. Increased downtime can lead to a direct loss of production and revenue.

3. **Cost of Washing**: The financial implications of each wash, including the direct costs associated with the washing process, should be factored in. This includes labor, materials, and any associated operational costs.

4. **Lost Revenue**: Calculate the lost revenue due to engine unavailability during washing. This includes the revenue lost per engine wash multiplied by the number of washes per annum.

5. **Frequency of Fouling**: Assess how often fouling occurs under current operating conditions to determine the optimal wash frequency that balances performance maintenance with operational costs.

6. **Profitability**: The overall impact on profitability should be evaluated, considering both the costs of washing and the potential revenue loss due to reduced engine performance from fouling.

7. **Trends in Fault Indices**: Monitoring trends in fault indices can provide insights into the condition of the compressor and help predict when washing may be necessary to prevent further issues.

8. **Operational Conditions**: Consider the specific operating conditions of the gas turbine, as different environments may lead to varying rates of fouling and thus influence the optimal wash frequency.

By evaluating these factors, one can determine a compressor wash frequency that minimizes costs while maximizing engine performance and profitability."
Industrial_Gas_Turbines_AMY_Razak.txt,150,9398f74ba28dd5260d14304a55095faf7dcae02a589a03ab0a89d60f2e0ec940,How does downtime for washing affect the revenue generated by gas turbines?,"Downtime for washing affects the revenue generated by gas turbines in several ways. When a gas turbine is taken offline for washing, it becomes unavailable for production, leading to a direct loss of revenue during that downtime. Additionally, the cost associated with the washing process itself must be factored in, further increasing the total cost incurred due to the washing. 

The lost revenue can be quantified as the revenue lost per engine wash multiplied by the number of washes conducted per year. As the frequency of washing increases, the total lost revenue also rises, which can adversely impact overall profitability. Therefore, optimizing the frequency of compressor washes is crucial to minimize the financial losses associated with both downtime and washing costs, ultimately enhancing production and profitability."
Industrial_Gas_Turbines_AMY_Razak.txt,150,9398f74ba28dd5260d14304a55095faf7dcae02a589a03ab0a89d60f2e0ec940,What calculation is used to determine the lost revenue due to engine washing?,The lost revenue per annum due to engine washing is calculated by multiplying the lost revenue per engine wash by the number of washes per annum. This calculation takes into account the increase in lost revenue associated with the frequency of the washes.
Industrial_Gas_Turbines_AMY_Razak.txt,150,9398f74ba28dd5260d14304a55095faf7dcae02a589a03ab0a89d60f2e0ec940,How does the cost of compressor washing contribute to the overall financial impact on gas turbine operations?,"The cost of compressor washing contributes to the overall financial impact on gas turbine operations in several ways:

1. **Downtime Costs**: Each time a compressor is washed, the gas turbine is unavailable for operation, leading to lost production. This downtime directly affects revenue, as the engine cannot generate income while it is being cleaned.

2. **Washing Frequency**: If compressor washing is performed too frequently, the cumulative downtime can significantly increase, resulting in higher lost revenue over time. Conversely, infrequent washing can lead to reduced engine performance due to fouling, which can also negatively impact production and profitability.

3. **Total Cost Calculation**: The total financial impact includes both the lost revenue from downtime and the direct costs associated with performing the washes. The lost revenue per annum due to washing can be calculated by multiplying the lost revenue per engine wash by the number of washes conducted each year. As the frequency of washing increases, so does the total cost associated with it.

4. **Optimization Needs**: There is a need to optimize the frequency of compressor washing to minimize the financial losses associated with both fouling and the washing process itself. This optimization can help balance the costs of washing against the potential revenue losses from reduced engine performance.

In summary, the cost of compressor washing affects gas turbine operations financially by contributing to downtime, requiring careful management of wash frequency to minimize overall costs, and impacting revenue generation."
Industrial_Gas_Turbines_AMY_Razak.txt,150,9398f74ba28dd5260d14304a55095faf7dcae02a589a03ab0a89d60f2e0ec940,What is the relationship between compressor fouling and engine performance?,"Compressor fouling negatively impacts engine performance by reducing the capacity and efficiency of the compressor. As dirt and deposits accumulate during engine operation, the compressor's ability to function optimally diminishes, leading to decreased production and profitability. Therefore, managing and optimizing the frequency of compressor washing is essential to mitigate the adverse effects of fouling on engine performance and maintain overall operational efficiency."
Industrial_Gas_Turbines_AMY_Razak.txt,150,9398f74ba28dd5260d14304a55095faf7dcae02a589a03ab0a89d60f2e0ec940,How can timely action based on fault indices improve the availability of gas turbines?,"Timely action based on fault indices can improve the availability of gas turbines by enabling early detection and intervention before significant damage occurs. By analyzing trends in fault indices, operators can identify changes in component characteristics that may indicate potential issues, such as compressor fouling or seal wear. 

When these trends are monitored, corrective actions can be taken proactively, preventing more serious problems like blade rubs or hot end damage that could lead to engine failure. This proactive maintenance approach helps to maintain the operational efficiency of the gas turbines, reducing unexpected downtimes and associated costs. Consequently, by minimizing the risk of failures and optimizing maintenance schedules, the overall availability and profitability of gas turbine operations can be significantly enhanced."
Industrial_Gas_Turbines_AMY_Razak.txt,150,9398f74ba28dd5260d14304a55095faf7dcae02a589a03ab0a89d60f2e0ec940,What types of damage are considered more serious than compressor fouling in gas turbines?,The types of damage that are considered more serious than compressor fouling in gas turbines include blade rubs and hot end damage.
Industrial_Gas_Turbines_AMY_Razak.txt,150,9398f74ba28dd5260d14304a55095faf7dcae02a589a03ab0a89d60f2e0ec940,How can data analysis prevent potential engine failures in gas turbines?,"Data analysis can prevent potential engine failures in gas turbines by logging and examining various operational data, which includes operating conditions, events, and the status of barriers or protection systems. By analyzing trends in fault indices, which indicate changes in component characteristics due to faults, diagnostics can be performed to detect the onset of damage or faults before they lead to engine failure. For instance, while compressor fouling or seal wear may not typically result in failure, monitoring these trends allows for timely interventions. Identifying more serious issues, such as blade rubs and hot end damage, through data analysis enables proactive measures to be taken, thereby improving engine availability and profitability. Additionally, optimizing maintenance practices, such as compressor washing, based on data analysis can minimize downtime and associated costs, further enhancing operational efficiency and reducing the risk of failures."
Industrial_Gas_Turbines_AMY_Razak.txt,150,9398f74ba28dd5260d14304a55095faf7dcae02a589a03ab0a89d60f2e0ec940,What are the implications of compressor washing frequency on operational costs?,"The frequency of compressor washing has significant implications on operational costs for gas turbines. Here are the key points:

1. **Downtime Costs**: Each time the compressor is washed, the engine is unavailable for operation, leading to lost production and revenue. Increased downtime directly affects the overall profitability of the operation.

2. **Washing Costs**: The cost associated with each compressor wash must be considered. This includes not only the direct costs of the washing process but also the indirect costs associated with the downtime.

3. **Balance of Frequency**: If compressor washing is performed too frequently, the cumulative costs from lost revenue and washing expenses can outweigh the benefits of maintaining engine performance. Conversely, infrequent washing can lead to performance deterioration due to fouling, which also negatively impacts production and profitability.

4. **Optimisation Requirement**: There is a need to optimise the frequency of compressor washing to minimize the total costs associated with both lost revenue and washing expenses. Finding the right balance can help maintain engine efficiency while reducing operational costs.

In summary, the implications of compressor washing frequency on operational costs involve a trade-off between maintaining engine performance and managing downtime and washing expenses. An optimal washing strategy is crucial for maximizing profitability."
Industrial_Gas_Turbines_AMY_Razak.txt,150,9398f74ba28dd5260d14304a55095faf7dcae02a589a03ab0a89d60f2e0ec940,How can organizations balance the costs of washing with the need for engine availability?,"Organizations can balance the costs of washing with the need for engine availability by optimizing the frequency of compressor washes. This involves analyzing the trade-offs between the costs associated with washing (including downtime and lost revenue) and the performance deterioration due to compressor fouling. 

To achieve this balance, organizations can:

1. **Monitor Performance Trends**: Regularly log and analyze data related to operating conditions and fault indices to identify when compressor fouling significantly impacts performance. This data helps in determining the optimal timing for washes.

2. **Establish a Washing Schedule**: Develop a washing schedule that minimizes downtime while ensuring that engine performance remains within acceptable limits. This schedule should be based on historical performance data and predictive maintenance strategies.

3. **Cost-Benefit Analysis**: Calculate the total costs associated with compressor washing, including lost revenue from downtime and the cost of the wash itself. This analysis can help identify the wash frequency that minimizes overall costs while maintaining engine availability.

4. **Implement Predictive Maintenance**: Use advanced diagnostics and monitoring systems to predict when fouling will occur and schedule washes proactively, rather than reactively, to avoid unexpected downtimes.

5. **Evaluate Engine Performance**: Continuously assess engine performance post-wash to determine if the frequency of washing can be adjusted based on the actual benefits observed.

By taking these steps, organizations can effectively manage the balance between the costs of washing and the necessity for engine availability, ultimately improving profitability and operational efficiency."
Industrial_Gas_Turbines_AMY_Razak.txt,150,9398f74ba28dd5260d14304a55095faf7dcae02a589a03ab0a89d60f2e0ec940,What strategies can be implemented to minimize the loss in profit due to compressor fouling and washing?,"To minimize the loss in profit due to compressor fouling and washing, the following strategies can be implemented:

1. **Optimized Washing Frequency**: Determine the optimal frequency for compressor washing that balances the costs of downtime and washing with the performance benefits gained from cleaner compressors. This involves analyzing the trends of fault indices and engine performance to identify the most effective intervals for washing.

2. **Data Logging and Analysis**: Implement a robust data logging system to continuously monitor operating conditions, fault indices, and performance metrics. Analyzing this data can help identify the onset of fouling and allow for timely washing before significant performance degradation occurs.

3. **Predictive Maintenance**: Use predictive analytics to forecast when compressor fouling is likely to occur based on historical data. This proactive approach can help schedule washes during planned downtime, minimizing production disruption.

4. **Cost-Benefit Analysis**: Conduct a thorough cost-benefit analysis to assess the financial impact of different washing frequencies. This analysis should include the costs associated with downtime, washing, and lost revenue, allowing for informed decision-making regarding maintenance schedules.

5. **Improved Cleaning Techniques**: Explore advanced cleaning technologies or methods that may reduce the time and cost associated with compressor washing. More efficient cleaning processes can minimize downtime and enhance overall engine performance.

6. **Training and Best Practices**: Ensure that maintenance personnel are well-trained in best practices for compressor maintenance and washing. This can help reduce unnecessary washes and improve the effectiveness of cleaning procedures.

7. **Monitoring Engine Performance**: Regularly monitor engine performance metrics to identify any signs of deterioration early. This can help in scheduling washes more effectively and avoiding unnecessary maintenance.

By implementing these strategies, organizations can effectively manage compressor fouling and washing, thereby minimizing the associated losses in profit and enhancing overall operational efficiency."
