NODE_FILE_NAME,NODE_NUMBER,NODE_HASH,QUESTION,ANSWER
Industrial_Gas_Turbines_AMY_Razak.txt,152,eb9e0724cd63e6cbe961cad0bee2949d345630daccf712bac42e327d1b5a7e39,What factors influence the optimal wash frequency for gas turbines?,"The factors that influence the optimal wash frequency for gas turbines include:

- Price of the product (e.g., electricity unit price)
- Production levels
- Fuel cost
- Emissions CO₂ taxes, if applicable
- Downtime and cost of the wash (including the cost of disposal of wash materials such as detergents)

Additionally, the power demand also plays a role; a higher power demand, where the engine operates near or at its limits (such as the Exhaust Gas Temperature, EGT), tends to increase the wash frequency."
Industrial_Gas_Turbines_AMY_Razak.txt,152,eb9e0724cd63e6cbe961cad0bee2949d345630daccf712bac42e327d1b5a7e39,How does an increase in the price of electricity affect wash frequency?,"An increase in the price of electricity tends to increase the wash frequency. This is because higher electricity prices can lead to a greater focus on maintaining engine performance and efficiency, prompting more frequent washing to minimize lost revenue associated with performance deterioration."
Industrial_Gas_Turbines_AMY_Razak.txt,152,eb9e0724cd63e6cbe961cad0bee2949d345630daccf712bac42e327d1b5a7e39,What is the relationship between fuel cost and compressor wash frequency?,"The relationship between fuel cost and compressor wash frequency is that an increase in fuel cost tends to increase the wash frequency. This is because higher fuel costs can lead to a greater emphasis on maintaining engine efficiency, prompting more frequent washes to mitigate performance loss due to fouling."
Industrial_Gas_Turbines_AMY_Razak.txt,152,eb9e0724cd63e6cbe961cad0bee2949d345630daccf712bac42e327d1b5a7e39,How do emissions CO₂ taxes impact the frequency of washing gas turbines?,"Emissions CO₂ taxes tend to increase the wash frequency of gas turbines. This is because higher emissions taxes can lead to increased operational costs, prompting operators to wash the turbines more frequently to maintain efficiency and reduce emissions."
Industrial_Gas_Turbines_AMY_Razak.txt,152,eb9e0724cd63e6cbe961cad0bee2949d345630daccf712bac42e327d1b5a7e39,What effect does downtime have on the decision to wash a gas turbine?,"Downtime tends to reduce the wash frequency of a gas turbine. This is because the costs associated with the downtime and the compressor wash activity, including the disposal of wash materials such as detergents, can make washing less favorable. Therefore, when downtime is significant, it may discourage the decision to perform a wash."
Industrial_Gas_Turbines_AMY_Razak.txt,152,eb9e0724cd63e6cbe961cad0bee2949d345630daccf712bac42e327d1b5a7e39,How does high power demand influence the frequency of compressor washes?,"High power demand influences the frequency of compressor washes by increasing the wash frequency. When the engine operates near or at its operating limit, such as the exhaust gas temperature (EGT), the need for maintenance increases due to the higher performance loss associated with fouling. Therefore, under high power demand conditions, the frequency of compressor washes tends to be higher to mitigate performance deterioration."
Industrial_Gas_Turbines_AMY_Razak.txt,152,eb9e0724cd63e6cbe961cad0bee2949d345630daccf712bac42e327d1b5a7e39,What is the difference between online and offline washing in gas turbines?,"The difference between online and offline washing in gas turbines lies primarily in their execution and effectiveness:

1. **Online Washing**:
   - Performed while the engine is operational, meaning there is no downtime for the turbine.
   - Generates a compressor fouling profile that shows a small offset in fault indices after each wash, but this offset increases progressively due to residual fouling.
   - Although it allows for continuous operation, online washing is generally not as effective as offline washing in restoring engine performance.
   - There are reports of potential negative impacts, such as damage and erosion to compressor blades resulting from the online washing process.

2. **Offline Washing**:
   - Conducted when the engine is not in operation, allowing for a more thorough cleaning of the compressor.
   - More effective in improving engine performance, especially when the performance loss due to residual fouling exceeds the benefits gained from online washing.
   - Involves a downtime penalty, as the engine must be taken offline for the washing process.

In summary, online washing is convenient and allows for continuous operation but is less effective and may cause damage, while offline washing is more effective but requires downtime."
Industrial_Gas_Turbines_AMY_Razak.txt,152,eb9e0724cd63e6cbe961cad0bee2949d345630daccf712bac42e327d1b5a7e39,How does the compressor fouling profile change with online washing?,"The compressor fouling profile changes with online washing in that it exhibits a small offset in the fault indices after each online wash. While online washing does not incur downtime, it is noted that online washing is not as effective as offline washes. Consequently, the fouling fault index profile will show a progressive increase in the offset after each online wash due to residual fouling. This means that, over time, the performance loss from residual fouling may outweigh the performance improvement gained from the online washes."
Industrial_Gas_Turbines_AMY_Razak.txt,152,eb9e0724cd63e6cbe961cad0bee2949d345630daccf712bac42e327d1b5a7e39,What are the potential drawbacks of online washing compared to offline washing?,"The potential drawbacks of online washing compared to offline washing include:

1. **Effectiveness**: Online washing is noted to be less effective than offline washes. The fouling fault index profile after online washing shows a small offset, indicating that residual fouling remains, which progressively increases after each wash.

2. **Performance Loss**: If the performance loss due to residual fouling exceeds the performance improvement gained from an online wash, it suggests that an offline wash would be more beneficial.

3. **Damage Risks**: There have been reports of impact damage and erosion to compressor blades resulting from online washes, which could adversely affect the engine's performance and longevity.

4. **High Wash Frequencies**: While online wash frequencies tend to be high due to high engine availability, this may not always correlate with improved performance, especially if the washes do not adequately address the fouling.

These drawbacks indicate that while online washing can reduce downtime, it may not provide the same level of performance restoration as offline washing and could potentially lead to mechanical issues."
Industrial_Gas_Turbines_AMY_Razak.txt,152,eb9e0724cd63e6cbe961cad0bee2949d345630daccf712bac42e327d1b5a7e39,What indicates that an offline wash may be beneficial for a gas turbine?,An offline wash may be beneficial for a gas turbine when the engine performance loss due to residual fouling is greater than the performance improvement achieved from an offline wash.
Industrial_Gas_Turbines_AMY_Razak.txt,152,eb9e0724cd63e6cbe961cad0bee2949d345630daccf712bac42e327d1b5a7e39,How does residual fouling affect engine performance after online washing?,"Residual fouling negatively affects engine performance after online washing by causing a performance loss that can exceed the improvement gained from the wash. While online washing does not incur downtime, it is generally less effective than offline washes. As a result, the fouling fault index profile shows a small offset after each online wash, which progressively increases due to residual fouling. This means that the engine may continue to experience performance degradation over time, leading to a situation where the benefits of online washing are diminished and may even necessitate an offline wash when the performance loss becomes significant. Additionally, there have been reports of potential damage and erosion to compressor blades from online washes, which could further impact engine performance."
Industrial_Gas_Turbines_AMY_Razak.txt,152,eb9e0724cd63e6cbe961cad0bee2949d345630daccf712bac42e327d1b5a7e39,What are the reported impacts of online washing on compressor blades?,"The reported impacts of online washing on compressor blades include potential damage and erosion. There have been reports indicating that online washes can lead to impact damage and erosion to the compressor blades, which may affect the overall performance and longevity of the engine."
Industrial_Gas_Turbines_AMY_Razak.txt,152,eb9e0724cd63e6cbe961cad0bee2949d345630daccf712bac42e327d1b5a7e39,Why might the frequency of online washes be high in engines with high availability?,"The frequency of online washes might be high in engines with high availability because these engines are operational more often, allowing for more frequent maintenance activities without significant downtime. Since online washing does not require the engine to be taken offline, it can be performed regularly to mitigate performance loss due to residual fouling. This approach helps maintain engine efficiency and performance while maximizing operational uptime."
Industrial_Gas_Turbines_AMY_Razak.txt,152,eb9e0724cd63e6cbe961cad0bee2949d345630daccf712bac42e327d1b5a7e39,What is the significance of the total lost revenue curve in determining wash frequency?,"The total lost revenue curve is significant in determining wash frequency because it helps identify the optimized wash frequency that minimizes total lost revenue. By analyzing the curve, one can understand how various factors, such as product price, production levels, fuel costs, emissions taxes, and the costs associated with washing (including downtime and disposal of wash materials), influence the frequency of compressor washes. The goal is to find a balance where the costs associated with washing and the revenue lost due to performance deterioration are minimized, ensuring efficient operation of the gas turbine."
Industrial_Gas_Turbines_AMY_Razak.txt,152,eb9e0724cd63e6cbe961cad0bee2949d345630daccf712bac42e327d1b5a7e39,How do costs associated with compressor wash activities influence wash frequency?,"Costs associated with compressor wash activities influence wash frequency by having an inverse relationship. Specifically, an increase in downtime and costs related to the compressor wash (including the cost of disposal of wash materials such as detergents) tends to reduce the wash frequency. This means that if the costs and downtime associated with washing the compressor are high, operators may choose to wash less frequently to minimize expenses. Conversely, lower costs and downtime could encourage more frequent washing."
Industrial_Gas_Turbines_AMY_Razak.txt,152,eb9e0724cd63e6cbe961cad0bee2949d345630daccf712bac42e327d1b5a7e39,What happens to the fouling fault index profile after each online wash?,"After each online wash, the fouling fault index profile will show a small offset, indicating a slight improvement. However, this offset will progressively get larger after each wash due to residual fouling, meaning that the effectiveness of online washing diminishes over time as fouling accumulates."
Industrial_Gas_Turbines_AMY_Razak.txt,152,eb9e0724cd63e6cbe961cad0bee2949d345630daccf712bac42e327d1b5a7e39,How can the method for determining wash frequency be adapted for online wash systems?,"The method for determining wash frequency can be adapted for online wash systems by generating the compressor fouling profile that results from online washing. This adaptation acknowledges that online washing is not as effective as offline washes, leading to a fouling fault index profile that shows a small offset in the fault indices after each online wash. Over time, this offset becomes progressively larger due to residual fouling. Despite the reduced effectiveness, online washing does not incur a downtime penalty, which allows for higher wash frequencies. The decision to switch to offline washing should be based on the point at which the performance loss due to residual fouling exceeds the performance improvement gained from an offline wash."
Industrial_Gas_Turbines_AMY_Razak.txt,152,eb9e0724cd63e6cbe961cad0bee2949d345630daccf712bac42e327d1b5a7e39,What is the effect of compressor wash costs on the frequency of washes?,"The costs associated with compressor washes, including downtime and the expenses related to the wash activity (such as the disposal of wash materials like detergents), tend to reduce the frequency of washes. Higher costs may discourage more frequent washing, while lower costs could encourage more regular maintenance."
Industrial_Gas_Turbines_AMY_Razak.txt,152,eb9e0724cd63e6cbe961cad0bee2949d345630daccf712bac42e327d1b5a7e39,How does operating near the engine limit affect wash frequency?,"Operating near the engine limit, such as the exhaust gas temperature (EGT), tends to increase the wash frequency. This is because higher power demand necessitates more frequent washing to maintain optimal performance and mitigate the effects of fouling on the engine."
Industrial_Gas_Turbines_AMY_Razak.txt,152,eb9e0724cd63e6cbe961cad0bee2949d345630daccf712bac42e327d1b5a7e39,What evidence is there regarding the effectiveness of online washing for gas turbines?,"The context information indicates that the effectiveness of online washing for gas turbines is not clearly demonstrated. While online washing allows for high engine availability and can be performed without downtime, it has been noted that the performance loss due to residual fouling may outweigh the performance improvement gained from an offline wash. Additionally, there have been reports of impact damage and erosion to compressor blades resulting from online washes, which could negatively affect the overall performance and reliability of the gas turbine. Therefore, the evidence suggests that while online washing can be convenient, its effectiveness compared to offline washing is questionable."
