NODE_FILE_NAME,NODE_NUMBER,NODE_HASH,QUESTION,ANSWER
Industrial_Gas_Turbines_AMY_Razak.txt,171,fe85d4c400a4aa5a073abdb05541fa3995d6e0cfa80b3f14cd34f0fa519557bf,What is the impact of changing fuel flow on the operating conditions of a gas turbine engine?,"Changing the fuel flow in a gas turbine engine results in a transition from one steady-state operating condition to another, leading to a transient response. During this transient response, the operating point deviates from the initial steady-state condition and remains in this altered state until a new steady-state condition is established. This change can lead to potential issues such as compressor surge and flameout during the transient period. Therefore, it is crucial to implement protective measures for the engine during these transient excursions."
Industrial_Gas_Turbines_AMY_Razak.txt,171,fe85d4c400a4aa5a073abdb05541fa3995d6e0cfa80b3f14cd34f0fa519557bf,How does a gas turbine respond during transient conditions after a change in fuel flow?,"During transient conditions following a change in fuel flow, a gas turbine will transition from one steady-state operating condition to another. This results in a transient response where the operating point deviates from the previous steady-state condition until a new steady-state is achieved. During this period, the gas turbine may encounter issues such as compressor surge and flameout. To predict the transient performance of the gas turbine, it is necessary to consider dynamic terms in the laws of conservation of mass, energy, and momentum, rather than just the steady-state aspects."
Industrial_Gas_Turbines_AMY_Razak.txt,171,fe85d4c400a4aa5a073abdb05541fa3995d6e0cfa80b3f14cd34f0fa519557bf,What problems can arise during transient excursions in gas turbine operation?,"During transient excursions in gas turbine operation, problems such as compressor surge and flameout can arise."
Industrial_Gas_Turbines_AMY_Razak.txt,171,fe85d4c400a4aa5a073abdb05541fa3995d6e0cfa80b3f14cd34f0fa519557bf,What measures can be taken to protect a gas turbine engine during transient periods?,"To protect a gas turbine engine during transient periods, several measures can be implemented, including:

1. **Surge Control Systems**: Implementing surge control mechanisms to prevent compressor surge during transient excursions. This may involve adjusting the fuel flow or using variable geometry components to maintain stable operation.

2. **Flameout Prevention**: Utilizing flame detection and monitoring systems to detect conditions that may lead to flameout, allowing for timely adjustments to fuel flow or air supply.

3. **Dynamic Performance Prediction**: Developing models to predict transient performance, which can help anticipate changes in operating conditions and allow for proactive adjustments to maintain stability.

4. **Energy Management**: Monitoring and managing the net energy entering and leaving engine components to ensure that the engine remains within safe operational limits during transients.

5. **Control Algorithms**: Implementing advanced control algorithms that can respond quickly to changes in operating conditions, adjusting parameters such as fuel flow and airflow to maintain performance.

6. **Regular Maintenance and Monitoring**: Conducting regular maintenance and real-time monitoring of engine parameters to identify potential issues before they lead to transient problems.

By employing these measures, the risk of issues such as compressor surge and flameout can be minimized, ensuring the safe operation of the gas turbine during transient conditions."
Industrial_Gas_Turbines_AMY_Razak.txt,171,fe85d4c400a4aa5a073abdb05541fa3995d6e0cfa80b3f14cd34f0fa519557bf,What factors are considered when predicting the steady-state performance of gas turbines?,"When predicting the steady-state performance of gas turbines, the factors considered include flow compatibility, which is based on the steady-state law of continuity or conservation of mass, and the power or energy balance between and within engine components such as compressors, turbines, and combustors. Additionally, only the steady-state aspect of the law of conservation of energy is taken into account."
Industrial_Gas_Turbines_AMY_Razak.txt,171,fe85d4c400a4aa5a073abdb05541fa3995d6e0cfa80b3f14cd34f0fa519557bf,How does the law of conservation of mass apply to the performance of gas turbines?,"The law of conservation of mass, also known as the steady-state law of continuity, applies to the performance of gas turbines by ensuring that the mass flow rate entering the engine components (such as compressors, turbines, and combustors) is equal to the mass flow rate exiting those components under steady-state conditions. This principle is crucial for predicting the steady-state performance of gas turbines, as it helps maintain a balance of mass throughout the system.

In the context of gas turbines, this means that for any given engine element, the mass flow rates (W₁ and W₂) at the inlet and outlet must be accounted for to ensure that the system operates efficiently and effectively. If there is a change in fuel flow, the engine may transition from one steady-state condition to another, leading to transient responses where the mass flow rates may temporarily deviate from this balance. Understanding and applying the law of conservation of mass is essential for accurately simulating both steady-state and transient performance of gas turbines."
Industrial_Gas_Turbines_AMY_Razak.txt,171,fe85d4c400a4aa5a073abdb05541fa3995d6e0cfa80b3f14cd34f0fa519557bf,What is the significance of flow compatibility in the context of gas turbine performance?,"In the context of gas turbine performance, flow compatibility is significant because it ensures that the flow rates, temperatures, and pressures within the engine components—such as compressors, turbines, and combustors—are balanced and adhere to the principles of mass conservation and energy balance. This steady-state condition is crucial for the efficient operation of the gas turbine. When predicting steady-state performance, flow compatibility allows for the assessment of how well the various components work together under stable conditions. However, during transient responses, where the engine shifts from one steady-state condition to another, flow compatibility must be re-evaluated to account for dynamic changes and potential issues such as compressor surge and flameout. Thus, understanding flow compatibility is essential for both predicting performance and ensuring the reliability and safety of gas turbine operations."
Industrial_Gas_Turbines_AMY_Razak.txt,171,fe85d4c400a4aa5a073abdb05541fa3995d6e0cfa80b3f14cd34f0fa519557bf,What additional factors must be considered to simulate the transient performance of a gas turbine?,"To simulate the transient performance of a gas turbine, it is necessary to consider the dynamic terms present in the laws of conservation of mass, energy, and momentum. This includes factors such as fluid flow rates, temperatures, and pressures at any given instance in time, as well as external forces and net energy on the engine elements."
Industrial_Gas_Turbines_AMY_Razak.txt,171,fe85d4c400a4aa5a073abdb05541fa3995d6e0cfa80b3f14cd34f0fa519557bf,How do dynamic terms influence the performance predictions of gas turbines?,"Dynamic terms influence the performance predictions of gas turbines by accounting for the changes in fluid flow rates, temperatures, pressures, and external forces during transient responses. Unlike steady-state performance predictions, which rely solely on conservation of mass and energy, dynamic terms incorporate the variations that occur when the engine transitions from one steady-state condition to another. This includes the effects of momentum conservation, which becomes crucial during transient excursions, such as those caused by changes in fuel flow. By considering these dynamic factors, predictions can more accurately reflect the engine's behavior during periods of instability, helping to identify potential issues like compressor surge and flameout, and allowing for better protective measures during these transient operations."
Industrial_Gas_Turbines_AMY_Razak.txt,171,fe85d4c400a4aa5a073abdb05541fa3995d6e0cfa80b3f14cd34f0fa519557bf,What role does the law of conservation of momentum play in gas turbine performance analysis?,"The law of conservation of momentum plays a crucial role in gas turbine performance analysis, particularly when simulating transient performance. While steady-state performance primarily considers flow compatibility and energy balance, the transient analysis requires an understanding of dynamic terms, including momentum changes. 

In the context of a gas turbine, as the operating conditions change (for example, during a fuel flow adjustment), the momentum of the fluid flowing through various engine components (such as compressors, turbines, and combustors) also changes. By applying the law of conservation of momentum, analysts can predict how forces and fluid velocities will vary during these transient excursions. This understanding helps in identifying potential issues, such as compressor surge or flameout, and in developing protective measures for the engine during these periods of operation. Thus, the conservation of momentum is essential for accurately modeling and predicting the behavior of gas turbines under dynamic conditions."
Industrial_Gas_Turbines_AMY_Razak.txt,171,fe85d4c400a4aa5a073abdb05541fa3995d6e0cfa80b3f14cd34f0fa519557bf,In what ways do fluid flow rates affect the performance of gas turbine engine components?,"Fluid flow rates significantly affect the performance of gas turbine engine components in several ways:

1. **Steady-State Performance**: The flow rate is crucial for maintaining the steady-state operating conditions of the gas turbine. Variations in fluid flow can lead to changes in the operating point, affecting efficiency and power output.

2. **Transient Response**: Changes in fuel flow result in transient responses, where the engine transitions from one steady-state condition to another. During this period, the performance can be unstable, leading to potential issues such as compressor surge or flameout.

3. **Energy Balance**: The flow rates impact the energy balance within the engine components, including compressors, turbines, and combustors. Accurate flow rates are essential for ensuring that the energy input and output are balanced, which is critical for optimal performance.

4. **Dynamic Terms**: To simulate the transient performance of the gas turbine, it is necessary to consider dynamic terms associated with fluid flow rates. These terms influence how the engine responds to changes in operating conditions over time.

5. **Conservation of Momentum**: Fluid flow rates are also linked to the laws of conservation of momentum. Changes in flow rates can affect the forces acting on engine components, which in turn influences their performance and stability.

Overall, fluid flow rates are fundamental to both the steady-state and transient performance of gas turbine engines, impacting efficiency, stability, and the ability to handle operational changes."
Industrial_Gas_Turbines_AMY_Razak.txt,171,fe85d4c400a4aa5a073abdb05541fa3995d6e0cfa80b3f14cd34f0fa519557bf,How do temperature and pressure variations impact the operation of gas turbine elements?,"Temperature and pressure variations significantly impact the operation of gas turbine elements by influencing their performance and efficiency during both steady-state and transient conditions. 

1. **Temperature Effects**: Changes in temperature can affect the thermodynamic properties of the working fluid (air and combustion gases) within the gas turbine. Higher temperatures can lead to increased energy output and efficiency, but they also pose risks of material degradation and thermal stress on components. During transient responses, temperature variations can lead to issues such as flameout, where the combustion process is disrupted, affecting overall engine stability.

2. **Pressure Effects**: Variations in pressure can influence the flow rates of the working fluid entering and exiting the turbine components. In particular, pressure drops across components like compressors and turbines can affect their performance, potentially leading to phenomena such as compressor surge, where the flow becomes unstable. During transient operations, pressure fluctuations can also impact the net energy balance within the turbine, affecting its ability to reach a new steady-state condition efficiently.

In summary, both temperature and pressure variations are critical factors that must be managed to ensure the reliable and efficient operation of gas turbine elements, particularly during transient conditions when the system is adjusting to changes in fuel flow or operational demands."
Industrial_Gas_Turbines_AMY_Razak.txt,171,fe85d4c400a4aa5a073abdb05541fa3995d6e0cfa80b3f14cd34f0fa519557bf,What external forces are relevant to the analysis of gas turbine engine elements?,"The context does not specify the exact external forces relevant to the analysis of gas turbine engine elements. However, it mentions that there are external forces acting on the engine elements during transient performance. Generally, in the analysis of gas turbine engine elements, relevant external forces could include aerodynamic forces, gravitational forces, and any forces resulting from the interaction with surrounding structures or components. These forces can influence the performance and stability of the gas turbine during operation."
Industrial_Gas_Turbines_AMY_Razak.txt,171,fe85d4c400a4aa5a073abdb05541fa3995d6e0cfa80b3f14cd34f0fa519557bf,How is net energy defined in the context of gas turbine engine performance?,"In the context of gas turbine engine performance, net energy (Enet) is defined as the total energy associated with the engine element, considering both the energy entering and leaving the element. It encompasses the energy contributions from fluid flow rates, temperatures, and pressures at the inlet and outlet of the element, as well as any external forces acting on it. This net energy is crucial for understanding the dynamic performance of the gas turbine during transient conditions, as it reflects the changes in energy balance that occur when the engine transitions from one steady-state condition to another."
Industrial_Gas_Turbines_AMY_Razak.txt,171,fe85d4c400a4aa5a073abdb05541fa3995d6e0cfa80b3f14cd34f0fa519557bf,What is the relationship between energy balance and the performance of gas turbine components?,"The relationship between energy balance and the performance of gas turbine components lies in the principles of conservation of energy and the power balance within the engine. In the context of gas turbines, the energy balance involves accounting for the energy entering and leaving each component, such as compressors, turbines, and combustors. This balance is crucial for predicting the steady-state performance of the gas turbine, as it ensures that the energy supplied to the system is equal to the energy used for work and losses.

When simulating the transient performance of gas turbines, it is important to consider not only the steady-state energy balance but also the dynamic terms that arise during changes in operating conditions. These dynamic terms reflect how energy is transferred and transformed within the components as the gas turbine responds to variations in fuel flow and other operational parameters. Thus, a proper understanding of energy balance is essential for accurately predicting both steady-state and transient performance, ensuring that the gas turbine operates efficiently and safely."
Industrial_Gas_Turbines_AMY_Razak.txt,171,fe85d4c400a4aa5a073abdb05541fa3995d6e0cfa80b3f14cd34f0fa519557bf,Why is it important to consider both steady-state and transient conditions in gas turbine analysis?,"It is important to consider both steady-state and transient conditions in gas turbine analysis because each condition affects the performance and safety of the engine in different ways. Steady-state conditions allow for the analysis of the gas turbine's performance based on flow compatibility and energy balance, ensuring efficient operation under stable conditions. However, during transient responses—such as changes in fuel flow—the engine can experience fluctuations that may lead to issues like compressor surge and flameout. By understanding and predicting these transient behaviors, engineers can implement protective measures and optimize the engine's response to dynamic changes, ultimately enhancing reliability and performance during varying operational scenarios."
Industrial_Gas_Turbines_AMY_Razak.txt,171,fe85d4c400a4aa5a073abdb05541fa3995d6e0cfa80b3f14cd34f0fa519557bf,How can understanding transient performance help in the design of gas turbine systems?,"Understanding transient performance is crucial in the design of gas turbine systems for several reasons:

1. **Predicting Behavior During Transitions**: Knowledge of transient performance allows engineers to predict how the gas turbine will respond to changes in operating conditions, such as fuel flow variations. This understanding helps in anticipating transient responses, which are critical for maintaining stable operation.

2. **Avoiding Operational Issues**: By analyzing transient performance, designers can identify potential problems such as compressor surge and flameout that may occur during transient excursions. This foresight enables the implementation of protective measures to safeguard the engine during these critical periods.

3. **Dynamic Modeling**: Incorporating dynamic terms into the design process allows for a more accurate simulation of the gas turbine's behavior under varying conditions. This includes considering the laws of conservation of momentum and energy, which are essential for understanding how the system will react over time.

4. **Optimizing Performance**: A comprehensive understanding of transient performance can lead to the optimization of gas turbine components, ensuring they can handle the stresses and changes in flow, temperature, and pressure that occur during transient operations.

5. **Enhancing Reliability and Efficiency**: By designing gas turbines with a thorough understanding of transient behavior, manufacturers can enhance the reliability and efficiency of the systems, leading to improved performance and reduced downtime.

Overall, understanding transient performance is integral to creating robust, efficient, and reliable gas turbine systems that can adapt to varying operational demands."
Industrial_Gas_Turbines_AMY_Razak.txt,171,fe85d4c400a4aa5a073abdb05541fa3995d6e0cfa80b3f14cd34f0fa519557bf,What are the key components of a gas turbine that must be analyzed for performance prediction?,"The key components of a gas turbine that must be analyzed for performance prediction include:

1. **Compressors** - These components are responsible for compressing the incoming air before it enters the combustion chamber.
2. **Turbines** - Turbines extract energy from the high-temperature, high-pressure gases produced in the combustion process to drive the compressors and generate power.
3. **Combustors** - The combustor is where the fuel is mixed with the compressed air and ignited to produce high-energy gases.
4. **Flow Rates** - The fluid flow rates entering and leaving each component (W₁ and W₂) must be considered.
5. **Temperatures** - The temperatures at various points (Ts₁ and Ts₂) within the system are crucial for energy balance calculations.
6. **Pressures** - The pressures at the inlet and outlet of each component (Ps₁ and Ps₂) are important for understanding the system's performance.
7. **External Forces** - Any external forces acting on the components should also be taken into account.
8. **Net Energy** - The net energy (Enet) associated with each component must be evaluated to predict overall performance.

These components and parameters are essential for simulating both steady-state and transient performance of the gas turbine."
Industrial_Gas_Turbines_AMY_Razak.txt,171,fe85d4c400a4aa5a073abdb05541fa3995d6e0cfa80b3f14cd34f0fa519557bf,How does the transient response of a gas turbine differ from its steady-state operation?,"The transient response of a gas turbine differs from its steady-state operation in that it involves a temporary change in operating conditions due to variations in fuel flow, which causes the engine to move away from its steady-state operating point. During this transient period, the gas turbine experiences fluctuations in parameters such as fluid flow rates, temperatures, and pressures, which can lead to issues like compressor surge and flameout. In contrast, steady-state operation is characterized by a stable condition where these parameters remain constant over time, and only flow compatibility and energy balance are considered without the influence of dynamic changes. To accurately predict transient performance, it is necessary to account for dynamic terms and the laws of conservation of momentum, which are not applicable in steady-state analysis."
Industrial_Gas_Turbines_AMY_Razak.txt,171,fe85d4c400a4aa5a073abdb05541fa3995d6e0cfa80b3f14cd34f0fa519557bf,What methods can be employed to predict the transient performance of gas turbines effectively?,"To predict the transient performance of gas turbines effectively, it is necessary to consider several methods that incorporate dynamic terms and the laws of conservation of momentum, in addition to the steady-state principles. These methods include:

1. **Dynamic Modeling**: This involves creating models that account for the time-dependent behavior of gas turbine components, capturing how they respond to changes in fuel flow and other operating conditions.

2. **Conservation Laws**: Utilizing the laws of conservation of mass, energy, and momentum to analyze the fluid flow rates, temperatures, and pressures at various points within the engine components during transient conditions.

3. **Simulation Tools**: Employing computational fluid dynamics (CFD) and other simulation software that can model the transient behavior of gas turbines under varying operational scenarios.

4. **Transient Response Analysis**: Conducting analyses that focus specifically on the transient response of the engine, including the identification and prediction of potential issues such as compressor surge and flameout during these excursions.

5. **Experimental Data**: Using empirical data from tests and operational experiences to validate and refine predictive models, ensuring they accurately reflect real-world performance during transient conditions.

By integrating these methods, engineers can better predict and manage the transient performance of gas turbines, ensuring reliable operation and minimizing risks associated with transient excursions."
