NODE_FILE_NAME,NODE_NUMBER,NODE_HASH,QUESTION,ANSWER
Industrial_Gas_Turbines_AMY_Razak.txt,181,71f16b18bce1265dc9c2258320cffe60a68d1e8a40be6dd54e28a8f3a17cdb2c,What is the title of the book authored by R.T.C. Harman that focuses on gas turbine engineering?,"The title of the book authored by R.T.C. Harman that focuses on gas turbine engineering is ""Gas Turbine Engineering."""
Industrial_Gas_Turbines_AMY_Razak.txt,181,71f16b18bce1265dc9c2258320cffe60a68d1e8a40be6dd54e28a8f3a17cdb2c,"Who are the authors of the book ""Gas Turbine Performance""?","The authors of the book ""Gas Turbine Performance"" are P.P. Walsh and P. Fletcher."
Industrial_Gas_Turbines_AMY_Razak.txt,181,71f16b18bce1265dc9c2258320cffe60a68d1e8a40be6dd54e28a8f3a17cdb2c,"In what year was the first edition of ""Gas Turbine Performance"" published?","The first edition of ""Gas Turbine Performance"" was published in 2004."
Industrial_Gas_Turbines_AMY_Razak.txt,181,71f16b18bce1265dc9c2258320cffe60a68d1e8a40be6dd54e28a8f3a17cdb2c,"Which publishing company released the book ""Gas Turbine Engineering""?","The book ""Gas Turbine Engineering"" was published by Macmillan Press Ltd."
Industrial_Gas_Turbines_AMY_Razak.txt,181,71f16b18bce1265dc9c2258320cffe60a68d1e8a40be6dd54e28a8f3a17cdb2c,What is the significance of the publication year 1981 in relation to gas turbine engineering literature?,"The publication year 1981 is significant in relation to gas turbine engineering literature because it marks the release of ""Gas Turbine Engineering"" by R.T.C. Harman, which contributes to the foundational knowledge and understanding of gas turbine technology during that period. This book likely provided insights into the design, operation, and performance of gas turbines, reflecting the state of the art in engineering practices and advancements at the time. Such publications are crucial for both historical context and for understanding the evolution of gas turbine technology leading up to more recent works, such as the 2004 edition of ""Gas Turbine Performance"" by Walsh and Fletcher."
Industrial_Gas_Turbines_AMY_Razak.txt,181,71f16b18bce1265dc9c2258320cffe60a68d1e8a40be6dd54e28a8f3a17cdb2c,"How does the second edition of ""Gas Turbine Performance"" differ from the first edition?","The context information provided does not include specific details about the differences between the first and second editions of ""Gas Turbine Performance"" by Walsh and Fletcher. To accurately answer how the second edition differs from the first, one would need to refer to the content of both editions or a summary that highlights the changes made in the second edition."
Industrial_Gas_Turbines_AMY_Razak.txt,181,71f16b18bce1265dc9c2258320cffe60a68d1e8a40be6dd54e28a8f3a17cdb2c,What type of engineering does the book by R.T.C. Harman primarily address?,The book by R.T.C. Harman primarily addresses gas turbine engineering.
Industrial_Gas_Turbines_AMY_Razak.txt,181,71f16b18bce1265dc9c2258320cffe60a68d1e8a40be6dd54e28a8f3a17cdb2c,"What is the primary focus of the book ""Gas Turbine Performance""?","The primary focus of the book ""Gas Turbine Performance"" is on the performance characteristics and operational aspects of gas turbines, as indicated by its title and the context provided. It likely covers topics related to the efficiency, performance metrics, and operational parameters of gas turbines in various applications."
Industrial_Gas_Turbines_AMY_Razak.txt,181,71f16b18bce1265dc9c2258320cffe60a68d1e8a40be6dd54e28a8f3a17cdb2c,"How might the information in ""Gas Turbine Engineering"" be applied in modern gas turbine design?","The information in ""Gas Turbine Engineering"" by Harman, R.T.C. could be applied in modern gas turbine design in several ways:

1. **Fundamental Principles**: The book likely covers the fundamental principles of gas turbine operation, which remain relevant today. Understanding these principles can help engineers design more efficient and effective turbines.

2. **Design Methodologies**: It may provide insights into design methodologies that can be adapted or improved upon using modern technology, such as computational fluid dynamics (CFD) and advanced materials.

3. **Performance Optimization**: The techniques and strategies discussed in the book for optimizing turbine performance can be utilized to enhance the efficiency and reliability of modern gas turbines.

4. **Historical Context**: Understanding the historical developments in gas turbine technology can inform current design practices and highlight the evolution of engineering solutions.

5. **Maintenance and Operation**: The engineering principles related to maintenance and operational efficiency discussed in the book can still be applied to ensure the longevity and performance of modern gas turbines.

By integrating the foundational knowledge from ""Gas Turbine Engineering"" with contemporary advancements, engineers can innovate and improve gas turbine designs for better performance and sustainability."
Industrial_Gas_Turbines_AMY_Razak.txt,181,71f16b18bce1265dc9c2258320cffe60a68d1e8a40be6dd54e28a8f3a17cdb2c,"What are some potential applications of the principles discussed in ""Gas Turbine Performance""?","The principles discussed in ""Gas Turbine Performance"" can be applied in various fields, including:

1. **Aerospace Engineering**: Gas turbines are widely used in aircraft engines, where performance optimization is crucial for efficiency and safety.

2. **Power Generation**: Gas turbines are employed in power plants for electricity generation, where understanding performance can enhance output and reduce emissions.

3. **Marine Propulsion**: Gas turbines can be used in naval ships and commercial vessels, improving speed and fuel efficiency.

4. **Industrial Applications**: Many industries utilize gas turbines for mechanical drive applications, such as in compressors and pumps.

5. **Combined Cycle Power Plants**: The principles can help optimize the integration of gas turbines with steam turbines to improve overall plant efficiency.

6. **Renewable Energy Systems**: Gas turbines can be part of hybrid systems that incorporate renewable energy sources, aiding in the transition to cleaner energy solutions.

7. **Research and Development**: The principles can guide innovations in turbine design, materials, and technologies to improve performance and reliability.

Understanding gas turbine performance is essential for engineers and designers in these applications to ensure optimal operation and efficiency."
Industrial_Gas_Turbines_AMY_Razak.txt,181,71f16b18bce1265dc9c2258320cffe60a68d1e8a40be6dd54e28a8f3a17cdb2c,"Why is it important for engineers to reference texts like ""Gas Turbine Engineering"" in their work?","It is important for engineers to reference texts like ""Gas Turbine Engineering"" in their work for several reasons:

1. **Credibility and Authority**: Referencing established texts lends credibility to the engineer's work. It shows that their conclusions and designs are based on recognized principles and findings in the field.

2. **Knowledge Foundation**: These texts provide foundational knowledge and detailed insights into gas turbine technology, which is essential for engineers to understand the complexities of their designs and analyses.

3. **Best Practices**: Engineering texts often include best practices, methodologies, and case studies that can guide engineers in their projects, helping them avoid common pitfalls and improve their designs.

4. **Research and Development**: Engineers can reference these texts to support their research and development efforts, ensuring that they are building on existing knowledge and contributing to the field in a meaningful way.

5. **Regulatory Compliance**: Many engineering standards and regulations are based on established texts. Referencing them can help ensure compliance with industry standards.

6. **Continual Learning**: Engineering is an ever-evolving field, and referencing authoritative texts helps engineers stay updated with the latest advancements and technologies.

Overall, referencing such texts is crucial for maintaining professionalism, ensuring accuracy, and fostering innovation in engineering practices."
Industrial_Gas_Turbines_AMY_Razak.txt,181,71f16b18bce1265dc9c2258320cffe60a68d1e8a40be6dd54e28a8f3a17cdb2c,"What advancements in gas turbine technology might be discussed in the second edition of ""Gas Turbine Performance""?","The second edition of ""Gas Turbine Performance"" by Walsh and Fletcher likely discusses advancements in gas turbine technology such as improvements in efficiency, advancements in materials and coatings that allow for higher operating temperatures, innovations in aerodynamics for turbine blades, and enhancements in control systems and monitoring technologies. It may also cover developments in emissions reduction technologies, integration with renewable energy sources, and advancements in design methodologies that improve overall performance and reliability of gas turbines."
Industrial_Gas_Turbines_AMY_Razak.txt,181,71f16b18bce1265dc9c2258320cffe60a68d1e8a40be6dd54e28a8f3a17cdb2c,How can the concepts from R.T.C. Harman's book be utilized in troubleshooting gas turbine issues?,"The concepts from R.T.C. Harman's book ""Gas Turbine Engineering"" can be utilized in troubleshooting gas turbine issues by applying the following approaches:

1. **Understanding Gas Turbine Fundamentals**: The book provides foundational knowledge about gas turbine operation, components, and thermodynamics. This understanding is crucial for identifying potential failure points and operational inefficiencies.

2. **Diagnostic Techniques**: Harman's work likely includes diagnostic methods and performance analysis techniques that can help engineers pinpoint specific issues within the gas turbine system, such as abnormal vibrations, temperature fluctuations, or pressure drops.

3. **Performance Analysis**: By utilizing the performance metrics and criteria discussed in the book, engineers can compare actual performance data against expected values to identify discrepancies that may indicate underlying problems.

4. **Maintenance Strategies**: The book may outline maintenance best practices and schedules that can prevent issues from arising or worsening, thus aiding in proactive troubleshooting.

5. **Case Studies and Examples**: If the book includes case studies or examples of troubleshooting scenarios, these can serve as valuable references for engineers facing similar challenges in their own gas turbine systems.

By integrating these concepts into their troubleshooting processes, engineers can enhance their ability to diagnose and resolve gas turbine issues effectively."
Industrial_Gas_Turbines_AMY_Razak.txt,181,71f16b18bce1265dc9c2258320cffe60a68d1e8a40be6dd54e28a8f3a17cdb2c,What role does Blackwell Publishing play in the dissemination of knowledge about gas turbine performance?,"Blackwell Publishing is the publisher of the book ""Gas Turbine Performance, 2nd Edition"" by P.P. Walsh and P. Fletcher, which contributes to the dissemination of knowledge about gas turbine performance. By publishing this work, Blackwell Publishing makes important research and findings accessible to engineers, researchers, and students in the field, thereby facilitating the understanding and advancement of gas turbine technology."
Industrial_Gas_Turbines_AMY_Razak.txt,181,71f16b18bce1265dc9c2258320cffe60a68d1e8a40be6dd54e28a8f3a17cdb2c,"How can students critically evaluate the methodologies presented in ""Gas Turbine Engineering""?","To critically evaluate the methodologies presented in ""Gas Turbine Engineering"" by Harman, R.T.C., students can follow these steps:

1. **Understand the Methodologies**: Begin by thoroughly reading the relevant sections of the book to grasp the methodologies used in gas turbine engineering. Take notes on key concepts, processes, and techniques discussed.

2. **Compare with Other Sources**: Look for other texts or research papers on gas turbine engineering, including ""Gas Turbine Performance"" by Walsh and Fletcher. Compare the methodologies presented in these sources to identify similarities and differences.

3. **Analyze the Rationale**: Evaluate the reasoning behind the methodologies. Consider whether the author provides sufficient justification for the chosen methods and whether they are based on sound engineering principles.

4. **Assess Practical Applications**: Examine how the methodologies are applied in real-world scenarios. Look for case studies or examples provided in the book and assess their effectiveness and relevance.

5. **Evaluate Limitations**: Identify any limitations or potential biases in the methodologies. Consider factors such as the scope of the research, assumptions made, and the context in which the methodologies were developed.

6. **Seek Peer Feedback**: Discuss the methodologies with peers or instructors to gain different perspectives. Engaging in discussions can help uncover aspects that may have been overlooked.

7. **Reflect on Outcomes**: Consider the outcomes of the methodologies. Analyze whether the results presented in the book align with industry standards and practices.

8. **Formulate Conclusions**: Based on the evaluation, draw conclusions about the strengths and weaknesses of the methodologies. Consider how they contribute to the field of gas turbine engineering and what improvements could be made.

By following these steps, students can develop a comprehensive understanding and critical evaluation of the methodologies presented in ""Gas Turbine Engineering."""
Industrial_Gas_Turbines_AMY_Razak.txt,181,71f16b18bce1265dc9c2258320cffe60a68d1e8a40be6dd54e28a8f3a17cdb2c,In what ways might the knowledge gained from these texts influence future gas turbine innovations?,"The knowledge gained from the texts ""Gas Turbine Engineering"" by Harman and ""Gas Turbine Performance"" by Walsh and Fletcher could influence future gas turbine innovations in several ways:

1. **Fundamental Principles**: These texts provide foundational knowledge on the design, operation, and performance of gas turbines. Understanding these principles can guide engineers in developing more efficient and effective turbine designs.

2. **Performance Metrics**: Insights into performance metrics and evaluation methods can help innovators identify key areas for improvement, such as efficiency, power output, and emissions reduction.

3. **Technological Advancements**: The historical context and advancements discussed in these texts may inspire new technologies or materials that enhance turbine performance, such as advanced cooling techniques or lightweight materials.

4. **Design Methodologies**: The engineering methodologies outlined can serve as a framework for future research and development, allowing engineers to systematically approach design challenges and innovate in turbine architecture.

5. **Case Studies and Examples**: Real-world applications and case studies presented in these texts can provide valuable lessons learned, helping innovators avoid past mistakes and build on successful strategies.

6. **Trends and Future Directions**: By analyzing past developments and trends in gas turbine technology, these texts may help predict future directions for innovation, such as the integration of renewable energy sources or hybrid systems.

7. **Collaboration and Interdisciplinary Approaches**: The knowledge shared in these works can foster collaboration among engineers, scientists, and industry stakeholders, promoting interdisciplinary approaches that can lead to groundbreaking innovations.

Overall, the insights and knowledge from these texts can serve as a critical foundation for future advancements in gas turbine technology, driving improvements in efficiency, sustainability, and performance."
Industrial_Gas_Turbines_AMY_Razak.txt,181,71f16b18bce1265dc9c2258320cffe60a68d1e8a40be6dd54e28a8f3a17cdb2c,"How can the principles outlined in ""Gas Turbine Performance"" be applied to improve efficiency in gas turbines?","The principles outlined in ""Gas Turbine Performance"" by Walsh and Fletcher can be applied to improve efficiency in gas turbines in several ways:

1. **Thermodynamic Cycle Optimization**: The book discusses the thermodynamic cycles that govern gas turbine operation. By optimizing these cycles, such as through the use of combined cycle systems, operators can enhance the overall efficiency of gas turbines.

2. **Component Design Improvements**: Insights into the design and performance of individual components, such as compressors and turbines, can lead to innovations that reduce losses and improve performance. For example, advancements in blade design can lead to better aerodynamic efficiency.

3. **Operational Strategies**: The book may provide guidelines on optimal operating conditions, such as temperature and pressure settings, which can help in maximizing efficiency during operation.

4. **Fuel Efficiency**: Understanding the combustion process and how different fuels affect performance can lead to strategies that optimize fuel consumption, thus improving overall efficiency.

5. **Maintenance Practices**: The principles of performance monitoring and maintenance discussed in the book can help in identifying inefficiencies and implementing corrective actions to maintain optimal performance over time.

By applying these principles, operators can enhance the efficiency and reliability of gas turbines, leading to reduced operational costs and improved performance."
Industrial_Gas_Turbines_AMY_Razak.txt,181,71f16b18bce1265dc9c2258320cffe60a68d1e8a40be6dd54e28a8f3a17cdb2c,"What technical skills are necessary to understand the content of ""Gas Turbine Engineering""?","To understand the content of ""Gas Turbine Engineering"" by Harman, R.T.C., the following technical skills are necessary:

1. **Fundamental Engineering Principles**: A solid understanding of basic engineering concepts, particularly in mechanical and aerospace engineering.

2. **Thermodynamics**: Knowledge of thermodynamic principles is crucial, as gas turbines operate based on thermodynamic cycles.

3. **Fluid Mechanics**: Understanding fluid dynamics is essential for analyzing airflow and combustion processes within gas turbines.

4. **Heat Transfer**: Familiarity with heat transfer mechanisms is important for understanding how energy is converted and managed in gas turbines.

5. **Materials Science**: Knowledge of materials used in gas turbine construction, including their properties and behavior under high temperatures and stresses.

6. **Control Systems**: Basic understanding of control theory and systems, as gas turbines often involve complex control mechanisms for optimal performance.

7. **Mathematics**: Proficiency in mathematics, particularly calculus and differential equations, to analyze and model turbine performance.

8. **Computer-Aided Design (CAD)**: Familiarity with CAD software may be beneficial for visualizing and designing turbine components.

These skills will help readers comprehend the technical details and engineering principles discussed in the book."
Industrial_Gas_Turbines_AMY_Razak.txt,181,71f16b18bce1265dc9c2258320cffe60a68d1e8a40be6dd54e28a8f3a17cdb2c,How might the historical context of the publications influence current gas turbine engineering practices?,"The historical context of the publications on gas turbine engineering, such as ""Gas Turbine Engineering"" by Harman (1981) and ""Gas Turbine Performance"" by Walsh and Fletcher (2004), can significantly influence current practices in several ways:

1. **Foundational Knowledge**: The earlier publication by Harman provides foundational theories and principles that continue to underpin modern gas turbine design and operation. Understanding these principles is essential for engineers to innovate and improve upon existing technologies.

2. **Evolution of Technology**: The progression from the 1981 publication to the 2004 edition reflects advancements in materials, design methodologies, and computational techniques. Current practices are likely influenced by the historical challenges and solutions documented in these works, guiding engineers in addressing contemporary issues.

3. **Performance Metrics**: The focus on performance metrics in Walsh and Fletcher's work highlights the importance of efficiency and reliability, which remain critical in today’s competitive energy market. Current engineering practices often build upon these metrics to optimize turbine performance.

4. **Regulatory and Environmental Considerations**: Historical publications may also provide insights into the regulatory landscape and environmental concerns of their time, which can inform current practices as engineers strive to meet modern environmental standards and sustainability goals.

5. **Case Studies and Lessons Learned**: These texts may include case studies or lessons learned from past projects that can inform current engineering decisions, helping to avoid previous mistakes and replicate successes.

Overall, the historical context of these publications serves as a valuable resource for understanding the evolution of gas turbine technology and guiding current engineering practices."
Industrial_Gas_Turbines_AMY_Razak.txt,181,71f16b18bce1265dc9c2258320cffe60a68d1e8a40be6dd54e28a8f3a17cdb2c,What criteria should engineers consider when selecting reference materials like those authored by Walsh and Fletcher?,"When selecting reference materials like those authored by Walsh and Fletcher, engineers should consider the following criteria:

1. **Relevance**: The material should be directly applicable to the specific area of gas turbine engineering or performance that the engineer is focusing on.

2. **Credibility of Authors**: The qualifications and expertise of the authors should be evaluated. Authors with a strong background in gas turbine technology or engineering are more likely to provide reliable information.

3. **Publication Date**: The recency of the publication is important, especially in fields like engineering where technology evolves rapidly. More recent editions may include updated information and advancements.

4. **Publisher Reputation**: The reputation of the publishing house can indicate the quality of the content. Established publishers in the field of engineering are often more reliable.

5. **Peer Reviews and Citations**: Materials that have undergone peer review or are frequently cited in other reputable works may be more trustworthy.

6. **Depth of Content**: The level of detail and comprehensiveness of the material should match the engineer's needs, whether they require a broad overview or in-depth technical information.

7. **Practical Applications**: Reference materials that include case studies, practical examples, or applications can be more beneficial for engineers looking to apply theoretical knowledge.

8. **Format and Accessibility**: The format of the material (e.g., textbook, journal article, online resource) should be accessible and user-friendly for the engineer's needs.

By considering these criteria, engineers can select reference materials that will best support their work and enhance their understanding of gas turbine engineering."
