,NODE_FILE_NAME,NODE_NUMBER,NODE_HASH,NODE_TEXT,Q,A1,A2,A3,A4,A5
0,Industrial_Gas_Turbines_AMY_Razak.txt,201,e25946e0973107e7e40505aa80162507b44976da9b48482d6050a98820339b12,11.24. ,What is the significance of the date 11.24 in the context of the provided text?,The date 11.24 is mentioned without additional context in the provided text.,"In the text, 11.24 appears as a standalone date, lacking further details.","11.24 is referenced in the text, but its importance or relevance is not explained.","The text includes the date 11.24, but does not elaborate on its significance.","Without more context, 11.24 is simply a date noted in the text."
1,Industrial_Gas_Turbines_AMY_Razak.txt,201,e25946e0973107e7e40505aa80162507b44976da9b48482d6050a98820339b12,11.24. ,Can you infer any possible meanings or events associated with 11.24 from the text?,No specific events or meanings are associated with 11.24 in the text.,The text does not provide enough information to infer anything about 11.24.,"Given the lack of context, it's impossible to deduce the significance of 11.24.",There are no clues in the text to understand what 11.24 refers to.,Inference about 11.24 is not possible based on the provided text alone.
2,Industrial_Gas_Turbines_AMY_Razak.txt,201,e25946e0973107e7e40505aa80162507b44976da9b48482d6050a98820339b12,11.24. ,How does the text present the information about 11.24?,The text presents 11.24 as a standalone piece of information without context.,11.24 is listed in the text without any accompanying explanation or details.,The manner in which 11.24 is presented offers no insight into its relevance.,"Information about 11.24 is given in isolation, making its purpose unclear.","The text mentions 11.24 briefly, without connecting it to any broader narrative."
3,Industrial_Gas_Turbines_AMY_Razak.txt,201,e25946e0973107e7e40505aa80162507b44976da9b48482d6050a98820339b12,11.24. ,Is there any relation between 11.24 and other elements in the text?,No relation between 11.24 and other text elements is evident.,The text does not suggest any connection between 11.24 and other parts.,"Without additional information, linking 11.24 to other elements is not feasible.","11.24 stands alone in the text, with no apparent links to other content.",There's no indication in the text that 11.24 relates to anything else mentioned.
4,Industrial_Gas_Turbines_AMY_Razak.txt,201,e25946e0973107e7e40505aa80162507b44976da9b48482d6050a98820339b12,11.24. ,What could be the reason for including 11.24 in the text?,The reason for including 11.24 is not specified in the text.,"It's unclear why 11.24 was included, as the text provides no explanation.",The inclusion of 11.24 might be relevant to a context not provided in the text.,"Without further details, the purpose of mentioning 11.24 remains a mystery.",The text does not justify or explain the presence of the date 11.24.
5,Industrial_Gas_Turbines_AMY_Razak.txt,201,e25946e0973107e7e40505aa80162507b44976da9b48482d6050a98820339b12,11.24. ,Does the text suggest that 11.24 is a date of importance?,The text does not indicate that 11.24 holds any particular importance.,There's no suggestion in the text that 11.24 is significant.,11.24 is not highlighted or emphasized in any way within the text.,"The text treats 11.24 neutrally, without implying its importance.",Importance of 11.24 is neither confirmed nor denied by the text.
6,Industrial_Gas_Turbines_AMY_Razak.txt,201,e25946e0973107e7e40505aa80162507b44976da9b48482d6050a98820339b12,11.24. ,How might additional context change the interpretation of 11.24?,Additional context could reveal the significance or irrelevance of 11.24.,"With more information, 11.24 might be understood as a key date or just a note.",The meaning of 11.24 could vary greatly depending on surrounding context.,Extra details could either clarify the purpose of 11.24 or leave it ambiguous.,Interpretation of 11.24 is entirely dependent on context not provided in the text.
7,Industrial_Gas_Turbines_AMY_Razak.txt,201,e25946e0973107e7e40505aa80162507b44976da9b48482d6050a98820339b12,11.24. ,What questions remain unanswered about 11.24 after reading the text?,The text leaves unanswered why 11.24 is mentioned and what it refers to.,Key questions about the relevance and context of 11.24 are not addressed.,"After reading, it's unclear if 11.24 is a date, code, or has another meaning.",The text does not answer whether 11.24 is connected to an event or person.,Unanswered questions include the origin and purpose of the 11.24 reference.
8,Industrial_Gas_Turbines_AMY_Razak.txt,201,e25946e0973107e7e40505aa80162507b44976da9b48482d6050a98820339b12,11.24. ,Is 11.24 likely to be a typographical error in the text?,There's no evidence in the text to suggest that 11.24 is a typo.,"Without context, it's impossible to determine if 11.24 was mistakenly included.",The possibility of 11.24 being a typographical error cannot be ruled out.,"Given the lack of surrounding information, 11.24's accuracy is unverifiable.",The text does not provide enough clues to assess if 11.24 is an error.
9,Industrial_Gas_Turbines_AMY_Razak.txt,201,e25946e0973107e7e40505aa80162507b44976da9b48482d6050a98820339b12,11.24. ,How would you summarize the mention of 11.24 in the text?,11.24 is mentioned briefly and without context in the text.,The text includes 11.24 as an isolated piece of information.,A summary would note that 11.24 appears without explanation or relevance.,"In summary, the text presents 11.24 without clarifying its significance.","The mention of 11.24 is standalone, offering no insight into its meaning."
