NODE_FILE_NAME,NODE_NUMBER,NODE_HASH,QUESTION,ANSWER
Industrial_Gas_Turbines_AMY_Razak.txt,71,a5be357d1ebe01e0dd98ff84f07f28cecd2d545958c1c1e6b1209716fab36d41,What effect does stator deflection have on whirl or tangential velocity in gas turbines?,Stator deflection leads to a reduction in whirl or tangential velocity (ΔVw) in gas turbines. This reduction results in a lower stage-loading coefficient.
Industrial_Gas_Turbines_AMY_Razak.txt,71,a5be357d1ebe01e0dd98ff84f07f28cecd2d545958c1c1e6b1209716fab36d41,How does stator closure impact the compressor characteristic curve?,"Stator closure impacts the compressor characteristic curve by altering the running line's interaction with the surge line. When the stators are closed, the running line does not intersect the surge line at low compressor speeds, which allows the engine to start successfully. However, at high compressor speeds, the front stages of the compressor begin to choke, leading to stall conditions in the back stages. Although it is possible to open the stators of the front stages to increase flow and mitigate stalling in the back stages, there is a limit to how much the stators can be opened. Consequently, this limitation suggests that the maximum pressure ratio achievable in a single spool is approximately 20."
Industrial_Gas_Turbines_AMY_Razak.txt,71,a5be357d1ebe01e0dd98ff84f07f28cecd2d545958c1c1e6b1209716fab36d41,What happens to the running line when the stators are closed at low compressor speeds?,"When the stators are closed at low compressor speeds, the running line does not intersect the surge line, allowing the engine to be started."
Industrial_Gas_Turbines_AMY_Razak.txt,71,a5be357d1ebe01e0dd98ff84f07f28cecd2d545958c1c1e6b1209716fab36d41,What is the significance of the surge line in relation to compressor speeds?,"The surge line is significant in relation to compressor speeds because it represents the boundary between stable and unstable operation of the compressor. When the running line of the compressor does not intersect the surge line at low compressor speeds, it indicates that the engine can be started without the risk of surging. However, at high compressor speeds, if the front stages of the compressor begin to choke, it can lead to the back stages stalling. This highlights the importance of managing compressor speeds to avoid instability and ensure efficient operation."
Industrial_Gas_Turbines_AMY_Razak.txt,71,a5be357d1ebe01e0dd98ff84f07f28cecd2d545958c1c1e6b1209716fab36d41,How does choking in the front stages affect the back stages of a gas turbine?,"Choking in the front stages of a gas turbine leads to a situation where the front stages cannot handle the increased flow demand, resulting in a restriction of airflow. This condition forces the back stages to stall, as they are unable to receive the necessary airflow to operate efficiently. The choking effect limits the overall performance of the turbine, and while it may be possible to open the stators of the front stages to allow more flow and mitigate the stalling in the back stages, there is a maximum limit to how much the stators can be opened. Consequently, this choking phenomenon contributes to a limitation on the maximum pressure ratio that can be achieved in a single spool, which is estimated to be around 20."
Industrial_Gas_Turbines_AMY_Razak.txt,71,a5be357d1ebe01e0dd98ff84f07f28cecd2d545958c1c1e6b1209716fab36d41,What potential solution exists to prevent back stages from stalling when front stages choke?,A potential solution to prevent back stages from stalling when front stages choke is to open the stators of the front stages to allow more flow.
Industrial_Gas_Turbines_AMY_Razak.txt,71,a5be357d1ebe01e0dd98ff84f07f28cecd2d545958c1c1e6b1209716fab36d41,What is the maximum pressure ratio achievable in a single spool gas turbine?,The maximum pressure ratio that can be achieved in a single spool gas turbine is thought to be about 20.
Industrial_Gas_Turbines_AMY_Razak.txt,71,a5be357d1ebe01e0dd98ff84f07f28cecd2d545958c1c1e6b1209716fab36d41,How does the reduction in whirl or tangential velocity influence stage-loading coefficients?,"The reduction in whirl or tangential velocity (ΔVw) leads to a lower stage-loading coefficient. This implies that as the tangential velocity decreases, the ability of the compressor stages to generate pressure and maintain flow is diminished, resulting in a lower loading on each stage of the compressor. Consequently, this can affect the overall performance and efficiency of the gas turbine system."
Industrial_Gas_Turbines_AMY_Razak.txt,71,a5be357d1ebe01e0dd98ff84f07f28cecd2d545958c1c1e6b1209716fab36d41,In what scenario can an engine be started with closed stators?,"An engine can be started with closed stators when the running line does not intersect the surge line at low compressor speeds. This indicates that the compressor is able to operate without stalling, allowing for successful engine start-up even with the stators in a closed position."
Industrial_Gas_Turbines_AMY_Razak.txt,71,a5be357d1ebe01e0dd98ff84f07f28cecd2d545958c1c1e6b1209716fab36d41,What are the implications of opening the stators of the front stages in a gas turbine?,"Opening the stators of the front stages in a gas turbine allows for increased flow into the compressor, which can help prevent the back stages from stalling, especially at high compressor speeds. However, there is a limit to how much the stators can be opened. This limitation means that while opening the stators can improve performance and stability in certain operating conditions, it also constrains the maximum pressure ratio that can be achieved in a single spool, which is thought to be around 20. Thus, while there are benefits to opening the stators, it is a balancing act that must consider the potential for choking and the overall efficiency of the engine."
Industrial_Gas_Turbines_AMY_Razak.txt,71,a5be357d1ebe01e0dd98ff84f07f28cecd2d545958c1c1e6b1209716fab36d41,How does the compressor's performance change at high compressor speeds with closed stators?,"At high compressor speeds with closed stators, the front stages of the compressor begin to choke, which leads to the back stages stalling. This indicates that the flow is restricted, causing performance issues. While it may be possible to open the stators of the front stages to allow more flow and attempt to prevent the back stages from stalling, there is a limit to how much the stators can be opened. Consequently, the maximum pressure ratio achievable in a single spool is thought to be limited to about 20."
Industrial_Gas_Turbines_AMY_Razak.txt,71,a5be357d1ebe01e0dd98ff84f07f28cecd2d545958c1c1e6b1209716fab36d41,What limitations exist regarding the opening of stators in gas turbines?,"The limitations regarding the opening of stators in gas turbines include the fact that there is a maximum limit to how much the stators can be opened. This limitation is significant because, while opening the stators of the front stages can allow for more flow and potentially prevent the back stages from stalling, it is thought that the maximum pressure ratio achievable in a single spool is limited to about 20."
Industrial_Gas_Turbines_AMY_Razak.txt,71,a5be357d1ebe01e0dd98ff84f07f28cecd2d545958c1c1e6b1209716fab36d41,How does stator closure affect the overall efficiency of a gas turbine?,"Stator closure affects the overall efficiency of a gas turbine by altering the compressor characteristics. When the stators are closed, the running line does not intersect the surge line at low compressor speeds, allowing the engine to start more reliably. However, at high compressor speeds, the front stages may begin to choke, which can lead to the back stages stalling. This stalling can negatively impact the overall efficiency of the gas turbine, as it limits the flow and pressure ratio that can be achieved. While opening the stators of the front stages could help prevent back stage stalling, there is a limit to how much they can be opened, which ultimately restricts the maximum pressure ratio achievable in a single spool, potentially affecting efficiency."
Industrial_Gas_Turbines_AMY_Razak.txt,71,a5be357d1ebe01e0dd98ff84f07f28cecd2d545958c1c1e6b1209716fab36d41,What role does the stage-loading coefficient play in gas turbine performance?,"The stage-loading coefficient in gas turbine performance is an important parameter that influences the efficiency and operational characteristics of the turbine. It is related to the amount of work done by the turbine stages relative to the flow of air or gas through them. A lower stage-loading coefficient, as mentioned in the context, indicates a reduction in whirl or tangential velocity, which can affect the overall performance of the turbine.

Specifically, a lower stage-loading coefficient can lead to improved stability at lower compressor speeds, allowing the engine to start more reliably without intersecting the surge line. However, at higher compressor speeds, a low stage-loading coefficient may result in choking of the front stages, which can force the back stages to stall. This interplay highlights the importance of optimizing the stage-loading coefficient to balance performance across different operating conditions, ultimately affecting the maximum pressure ratio that can be achieved in a gas turbine."
Industrial_Gas_Turbines_AMY_Razak.txt,71,a5be357d1ebe01e0dd98ff84f07f28cecd2d545958c1c1e6b1209716fab36d41,How can the characteristics of a gas turbine compressor be graphically represented?,"The characteristics of a gas turbine compressor can be graphically represented using performance curves, which typically include the running line and surge line on a graph. These curves illustrate the relationship between the compressor's pressure ratio and flow rate at various operating conditions. In the context provided, the change in compressor characteristics due to stator closure is depicted with dotted lines, showing how the running line behaves at different compressor speeds. The graph would indicate the points where the running line intersects the surge line, demonstrating the operational limits and performance of the compressor under varying conditions."
Industrial_Gas_Turbines_AMY_Razak.txt,71,a5be357d1ebe01e0dd98ff84f07f28cecd2d545958c1c1e6b1209716fab36d41,What challenges arise from the interaction between front and back stages in a gas turbine?,"The interaction between the front and back stages in a gas turbine presents several challenges. When the front stages start to choke at high compressor speeds, this can lead to a stall in the back stages. The choking occurs when the flow through the front stages is restricted, causing a reduction in the flow rate that can be handled by the back stages. 

To mitigate this issue, one potential solution is to open the stators of the front stages to allow more flow, which could help prevent the back stages from stalling. However, there is a limitation to how much the stators can be opened, which constrains the overall performance. Consequently, it is believed that the maximum pressure ratio achievable in a single spool is limited to about 20. This interplay between choking and stalling highlights the complexities of managing airflow and pressure ratios within the gas turbine system."
Industrial_Gas_Turbines_AMY_Razak.txt,71,a5be357d1ebe01e0dd98ff84f07f28cecd2d545958c1c1e6b1209716fab36d41,How does the design of gas turbine stators influence operational capabilities?,"The design of gas turbine stators significantly influences operational capabilities by affecting the compressor characteristics and overall engine performance. When stators are closed, the running line does not intersect the surge line at low compressor speeds, allowing the engine to start successfully. However, at high compressor speeds, the front stages may choke, leading to stall in the back stages. 

To mitigate this, opening the stators of the front stages can increase flow and help prevent back stage stalling, but there is a limit to how much the stators can be opened. This limitation contributes to a maximum pressure ratio of about 20 that can be achieved in a single spool. Thus, the design and operation of gas turbine stators are crucial for optimizing performance, managing flow, and preventing stall conditions."
Industrial_Gas_Turbines_AMY_Razak.txt,71,a5be357d1ebe01e0dd98ff84f07f28cecd2d545958c1c1e6b1209716fab36d41,What factors contribute to the choking of front stages in a gas turbine?,"The choking of front stages in a gas turbine is influenced by several factors, including:

1. **High Compressor Speeds**: At elevated compressor speeds, the front stages can begin to choke, which limits the airflow through those stages.

2. **Stator Closure**: The closure of the stators can alter the compressor characteristics, preventing the running line from intersecting the surge line at low speeds, which may lead to choking at high speeds.

3. **Back Stages Stalling**: When the front stages choke, it can force the back stages to stall, further complicating the airflow dynamics within the turbine.

4. **Limitations on Stator Opening**: While it is possible to open the stators of the front stages to allow more flow, there is a limit to how much they can be opened, which constrains the overall performance and pressure ratio achievable in the turbine.

These factors collectively contribute to the choking phenomenon in the gas turbine's front stages."
Industrial_Gas_Turbines_AMY_Razak.txt,71,a5be357d1ebe01e0dd98ff84f07f28cecd2d545958c1c1e6b1209716fab36d41,How can understanding stator dynamics improve gas turbine design?,"Understanding stator dynamics can significantly improve gas turbine design in several ways:

1. **Performance Optimization**: By analyzing stator deflection and its effects on whirl or tangential velocity, designers can optimize the compressor characteristics to enhance overall performance. This can lead to improved efficiency and power output.

2. **Surge Prevention**: Knowledge of how stator closure affects the running line and surge line intersections allows engineers to design systems that can avoid surge conditions at low compressor speeds, thereby improving engine reliability and operability.

3. **Choking and Stall Management**: Understanding the choking behavior of front stages and the potential for back stages to stall enables designers to implement strategies, such as adjustable stators, to manage airflow and prevent performance degradation.

4. **Pressure Ratio Limitations**: Recognizing the limitations imposed by stator dynamics on the maximum pressure ratio achievable in a single spool helps in setting realistic design goals and expectations, guiding the development of multi-spool designs or alternative configurations.

5. **Design Flexibility**: Insights into stator dynamics can lead to innovative design features, such as variable geometry stators, which can adapt to changing operational conditions, thus enhancing the versatility and adaptability of gas turbine systems.

Overall, a thorough understanding of stator dynamics allows for more informed design decisions, leading to more efficient, reliable, and high-performing gas turbines."
Industrial_Gas_Turbines_AMY_Razak.txt,71,a5be357d1ebe01e0dd98ff84f07f28cecd2d545958c1c1e6b1209716fab36d41,What are the consequences of exceeding the maximum pressure ratio in a gas turbine?,"Exceeding the maximum pressure ratio in a gas turbine can lead to several negative consequences, including:

1. **Choking of Front Stages**: When the pressure ratio exceeds the design limits, the front stages of the compressor may choke, which means they cannot handle the increased airflow effectively. This can disrupt the overall airflow through the turbine.

2. **Stalling of Back Stages**: As the front stages choke, the back stages may stall due to insufficient airflow. This can lead to a loss of efficiency and performance in the turbine.

3. **Engine Instability**: Operating beyond the maximum pressure ratio can result in instability within the engine, potentially causing fluctuations in performance and making it difficult to maintain consistent operation.

4. **Increased Wear and Tear**: Higher pressure ratios can lead to increased mechanical stress on the components of the gas turbine, resulting in accelerated wear and a higher likelihood of mechanical failure.

5. **Reduced Operational Lifespan**: The cumulative effects of choking, stalling, and increased wear can significantly reduce the operational lifespan of the gas turbine.

6. **Safety Risks**: In extreme cases, exceeding the maximum pressure ratio can pose safety risks, including the potential for catastrophic failure of the turbine components.

Overall, it is crucial to operate within the specified limits to ensure the reliability and efficiency of gas turbines."
