NODE_FILE_NAME,NODE_NUMBER,NODE_HASH,QUESTION,ANSWER
Industrial_Gas_Turbines_AMY_Razak.txt,90,17ba95cade8d28ced25a2410eab8b5e74568ba8834ddc549f36ed2b11cfd6780,What role does the nozzle play in the fuel injection process within a gas turbine combustor?,"The nozzle in a gas turbine combustor plays a crucial role in the fuel injection process by directing the fuel towards the eye of the vortex. This positioning allows the fuel to mix effectively with the swirling air, which helps break the fuel into fine droplets. This mixing is essential for initiating combustion, as it ensures that the fuel resides in the vortex for a sufficient length of time (residence time) to be oxidized, thereby liberating heat necessary for the combustion process."
Industrial_Gas_Turbines_AMY_Razak.txt,90,17ba95cade8d28ced25a2410eab8b5e74568ba8834ddc549f36ed2b11cfd6780,How does the swirl air contribute to the combustion process in a gas turbine?,"The swirl air contributes to the combustion process in a gas turbine by mixing with the injected fuel, which helps to break the fuel into fine droplets. This mixing occurs as the fuel is directed towards the eye of the vortex created by the swirl air. The swirling motion enhances the fuel-air interaction, allowing for more efficient combustion. As a result, combustion begins near the eye of the vortex, where the fuel resides for a sufficient length of time (residence time) to oxidize and liberate heat. This process is crucial for achieving effective combustion and minimizing unburned hydrocarbons and carbon monoxide in the combustion products."
Industrial_Gas_Turbines_AMY_Razak.txt,90,17ba95cade8d28ced25a2410eab8b5e74568ba8834ddc549f36ed2b11cfd6780,What is the significance of residence time in the combustion of fuel within a vortex?,"The significance of residence time in the combustion of fuel within a vortex is that it allows the fuel to remain in the vortex for a sufficient length of time to ensure complete oxidation. This process is crucial for effective combustion, as it enables the fuel to mix thoroughly with the swirl air, break up into fine droplets, and undergo the necessary chemical reactions to liberate heat. Adequate residence time helps to minimize the presence of unburned hydrocarbons (UHC) and carbon monoxide (CO) in the combustion gases, thereby reducing pollutants and improving combustion efficiency."
Industrial_Gas_Turbines_AMY_Razak.txt,90,17ba95cade8d28ced25a2410eab8b5e74568ba8834ddc549f36ed2b11cfd6780,At what temperature do the products of combustion typically leave the primary zone in a gas turbine combustor?,The products of combustion typically leave the primary zone in a gas turbine combustor at a temperature in the order of 2000 K.
Industrial_Gas_Turbines_AMY_Razak.txt,90,17ba95cade8d28ced25a2410eab8b5e74568ba8834ddc549f36ed2b11cfd6780,What types of unburned fuel species can be found in the combustion products at high temperatures?,"At high temperatures in the combustion products, the unburned fuel species can include unburned hydrocarbons (UHC) and carbon monoxide (CO)."
Industrial_Gas_Turbines_AMY_Razak.txt,90,17ba95cade8d28ced25a2410eab8b5e74568ba8834ddc549f36ed2b11cfd6780,How does the introduction of air in the intermediate zone affect the combustion gases?,"The introduction of air in the intermediate zone affects the combustion gases by reducing the temperature and encouraging the formation of carbon dioxide and water vapor. This process helps to lower the concentration of radicals and unburned fuel species, such as unburned hydrocarbons (UHC) and carbon monoxide (CO), which are indicative of poor combustion efficiency. By introducing small amounts of air, the intermediate zone effectively mitigates the potential pollutants that could arise if the combustion gases were to pass directly to the dilution zone without this intervention."
Industrial_Gas_Turbines_AMY_Razak.txt,90,17ba95cade8d28ced25a2410eab8b5e74568ba8834ddc549f36ed2b11cfd6780,What is the purpose of the dilution zone in a gas turbine combustor?,"The purpose of the dilution zone in a gas turbine combustor is to ensure that the gas temperature entering the turbine is satisfactory. It achieves this by admitting the remaining air to mix with the products of combustion, thereby reducing the temperature of the combustion gases, which leave the intermediate zone at about 1800 K. This mixing helps to prevent overheating of the turbine and ensures efficient operation."
Industrial_Gas_Turbines_AMY_Razak.txt,90,17ba95cade8d28ced25a2410eab8b5e74568ba8834ddc549f36ed2b11cfd6780,"How is the pattern factor (PF) calculated, and what does it indicate about the mixing process in the dilution zone?","The pattern factor (PF) is calculated using the formula:

\[ PF = \frac{T_{max} - T_2}{T_2 - T_1} \]

where:
- \( T_{max} \) is the maximum or peak temperature,
- \( T_2 \) is the average exit temperature,
- \( T_1 \) is the combustion inlet temperature, which usually corresponds to the compressor discharge temperature.

The pattern factor indicates how well the mixing has been performed by the dilution zone. A satisfactory value for the pattern factor is about 0.2. This means that a well-mixed combustion gas will have a relatively balanced temperature distribution, ensuring that the gas entering the turbine is at an appropriate temperature for optimal performance. A lower pattern factor may suggest poor mixing and potentially lead to higher temperatures or pollutants entering the turbine, indicating combustion inefficiency."
Industrial_Gas_Turbines_AMY_Razak.txt,90,17ba95cade8d28ced25a2410eab8b5e74568ba8834ddc549f36ed2b11cfd6780,What is considered a satisfactory value for the pattern factor in gas turbine combustion?,A satisfactory value for the pattern factor in gas turbine combustion is about 0.2.
Industrial_Gas_Turbines_AMY_Razak.txt,90,17ba95cade8d28ced25a2410eab8b5e74568ba8834ddc549f36ed2b11cfd6780,What cooling methods are employed to protect the flame tube in a gas turbine combustor?,"To protect the flame tube in a gas turbine combustor, several cooling methods are employed:

1. **Dilution Air Cooling**: Air that bypasses the combustion process (dilution air) provides some cooling to the flame tube.

2. **Cooling Slots**: A number of slots are included along the flame tube to generate a film of cooling air over the flame tube material. This film acts as a thermal barrier, protecting the flame tube from high temperatures.

3. **Transpiration Cooling**: This technique, which can be applied to flame tube cooling, involves the use of porous materials that allow cooling air to pass through, resulting in a significant reduction in cooling air requirements. It is noted that this method can lead to about a 50% reduction in the amount of cooling air needed for the flame tube.

These methods work together to ensure that the flame tube remains within safe temperature limits during operation."
Industrial_Gas_Turbines_AMY_Razak.txt,90,17ba95cade8d28ced25a2410eab8b5e74568ba8834ddc549f36ed2b11cfd6780,How does the bypassing of air contribute to the cooling of the flame tube during combustion?,"The bypassing of air contributes to the cooling of the flame tube during combustion by providing a flow of dilution air that helps to lower the temperature within the combustion chamber. This dilution air mixes with the combustion gases, which reduces the overall temperature of the gases that come into contact with the flame tube. While this dilution air offers some cooling effect, additional cooling is often required to protect the flame tube from the high temperatures generated during combustion. Techniques such as incorporating slots along the flame tube to create a film of cooling air further enhance this cooling effect, acting as a thermal barrier and significantly reducing the amount of cooling air needed."
Industrial_Gas_Turbines_AMY_Razak.txt,90,17ba95cade8d28ced25a2410eab8b5e74568ba8834ddc549f36ed2b11cfd6780,"What is transpiration cooling, and how does it benefit flame tube cooling in gas turbines?","Transpiration cooling is a technique used in gas turbine flame tube cooling that involves the introduction of cooling air through small holes or pores in the material of the flame tube. This creates a film of cooling air that flows over the surface of the flame tube, acting as a thermal barrier. 

The benefits of transpiration cooling in flame tube cooling include a significant reduction in the amount of cooling air required. It is claimed that this technique can lead to about a 50% reduction in the cooling air needed for the flame tube. By effectively managing the temperature and protecting the flame tube from the high temperatures generated during combustion, transpiration cooling enhances the durability and efficiency of the gas turbine system."
Industrial_Gas_Turbines_AMY_Razak.txt,90,17ba95cade8d28ced25a2410eab8b5e74568ba8834ddc549f36ed2b11cfd6780,What are the two main categories of gas turbine engines based on combustor requirements?,The two main categories of gas turbine engines based on combustor requirements are aero-derivatives and industrial gas turbines.
Industrial_Gas_Turbines_AMY_Razak.txt,90,17ba95cade8d28ced25a2410eab8b5e74568ba8834ddc549f36ed2b11cfd6780,What are the three types of combustors typically used in aero-derivative gas turbines?,"The three types of combustors typically used in aero-derivative gas turbines are the tubular combustor, the tuboannular combustor, and the annular combustor."
Industrial_Gas_Turbines_AMY_Razak.txt,90,17ba95cade8d28ced25a2410eab8b5e74568ba8834ddc549f36ed2b11cfd6780,Describe the structure and function of a tubular combustor in a gas turbine.,"A tubular combustor, also known as a ""can"" combustor, is a type of combustion chamber used in gas turbines, particularly in aero-derivative engines. The structure of a tubular combustor consists of a flame tube that is enclosed within a cylindrical liner. This configuration is designed to facilitate the combustion process while maintaining efficient thermal management.

### Structure:
- **Flame Tube**: The central component where the combustion occurs. It is designed to withstand high temperatures generated during the combustion of fuel and air.
- **Cylindrical Liner**: Surrounds the flame tube and serves to contain the combustion process while providing structural integrity.
- **Interconnector or Crossover Tubes**: These are additional tubes that connect multiple flame tubes within the combustor. Their primary function is to ensure that the flame can spread between the cans during the start-up phase, allowing all combustors to ignite effectively.

### Function:
- **Fuel Injection**: Fuel is injected into the flame tube, where it mixes with air to form a combustible mixture.
- **Combustion Process**: The combustion begins in the flame tube, where the fuel is oxidized, producing high-temperature gases.
- **Heat Management**: The design allows for efficient heat transfer and cooling, as the air that bypasses the combustion process (dilution air) helps cool the flame tube. Additional cooling techniques, such as film cooling, may be employed to protect the combustor structure from extreme temperatures.
- **Flexibility in Fuel Types**: Tubular combustors can accommodate a variety of fuel types, making them suitable for different operational requirements.

Overall, the tubular combustor is engineered to optimize combustion efficiency while managing the high temperatures and pressures typical in gas turbine operations."
Industrial_Gas_Turbines_AMY_Razak.txt,90,17ba95cade8d28ced25a2410eab8b5e74568ba8834ddc549f36ed2b11cfd6780,What is the purpose of interconnector or crossover tubes in a tubular combustor?,The purpose of interconnector or crossover tubes in a tubular combustor is to ensure the light-up of all the cans during start-up by allowing the flame to spread via the interconnector tubes. This ensures that combustion is initiated uniformly across the multiple flame tubes of the combustor.
Industrial_Gas_Turbines_AMY_Razak.txt,90,17ba95cade8d28ced25a2410eab8b5e74568ba8834ddc549f36ed2b11cfd6780,How does the temperature of combustion gases entering the turbine affect turbine performance?,"The temperature of combustion gases entering the turbine is critical for turbine performance for several reasons:

1. **Efficiency and Power Output**: The temperature of the gases affects the overall efficiency of the turbine. Higher temperatures generally lead to greater thermal efficiency and power output, as the turbine can extract more energy from the high-temperature gases. However, if the temperature is too high, it can lead to material stress and potential damage to the turbine components.

2. **Material Limitations**: Turbines are designed to operate within specific temperature limits. If the combustion gases are too hot when they enter the turbine, it can exceed the material limits of the turbine blades and other components, leading to failure or reduced lifespan. Therefore, maintaining an optimal gas temperature is essential for reliable operation.

3. **Combustion Efficiency**: The temperature of the gases is also indicative of combustion efficiency. If the gases are too hot, it may suggest incomplete combustion or the presence of pollutants, which can indicate inefficiencies in the combustion process. This can lead to increased emissions and operational costs.

4. **Cooling Requirements**: The dilution zone plays a crucial role in reducing the temperature of the combustion gases before they enter the turbine. By mixing the combustion gases with additional air, the dilution zone ensures that the gas temperature is satisfactory for turbine operation. A well-designed dilution zone can help achieve a balance between optimal performance and the thermal limits of the turbine.

In summary, the temperature of combustion gases entering the turbine significantly influences turbine performance by affecting efficiency, material integrity, combustion efficiency, and cooling requirements. Maintaining an appropriate temperature is crucial for optimal operation and longevity of the turbine."
Industrial_Gas_Turbines_AMY_Razak.txt,90,17ba95cade8d28ced25a2410eab8b5e74568ba8834ddc549f36ed2b11cfd6780,What pollutants may indicate poor combustion efficiency in a gas turbine system?,"The pollutants that may indicate poor combustion efficiency in a gas turbine system include unburned hydrocarbons (UHC) and carbon monoxide (CO). These species can be present due to the dissociation of carbon dioxide and water at high temperatures, and their presence suggests that combustion gases have not been adequately oxidized."
Industrial_Gas_Turbines_AMY_Razak.txt,90,17ba95cade8d28ced25a2410eab8b5e74568ba8834ddc549f36ed2b11cfd6780,How does the intermediate zone contribute to reducing radicals and pollutants in combustion gases?,"The intermediate zone contributes to reducing radicals and pollutants in combustion gases by introducing small amounts of air into the combustion process. This addition of air lowers the temperature of the gases, which helps to reduce the concentration of unburned hydrocarbons (UHC) and carbon monoxide (CO) that may be present due to the dissociation of carbon dioxide and water at high temperatures. By effectively managing the combustion conditions, the intermediate zone encourages the formation of more benign products, such as carbon dioxide and water vapor, thereby minimizing the pollutants that would otherwise be present if the combustion gases passed directly to the dilution zone."
Industrial_Gas_Turbines_AMY_Razak.txt,90,17ba95cade8d28ced25a2410eab8b5e74568ba8834ddc549f36ed2b11cfd6780,What is the typical temperature of combustion gases exiting the intermediate zone before entering the dilution zone?,The typical temperature of combustion gases exiting the intermediate zone before entering the dilution zone is about 1800 K.
Industrial_Gas_Turbines_AMY_Razak.txt,90,17ba95cade8d28ced25a2410eab8b5e74568ba8834ddc549f36ed2b11cfd6780,What are the three types of combustors commonly used in aero-derivative gas turbines?,"The three types of combustors commonly used in aero-derivative gas turbines are:

1. Tubular combustor
2. Tuboannular combustor
3. Annular combustor"
Industrial_Gas_Turbines_AMY_Razak.txt,90,17ba95cade8d28ced25a2410eab8b5e74568ba8834ddc549f36ed2b11cfd6780,How does the design of a tubular combustor differ from that of a tuboannular combustor?,"The design of a tubular combustor differs from that of a tuboannular combustor primarily in the arrangement of the flame tubes and the air supply system. 

In a tubular combustor, also known as a 'can' combustor, each flame tube is enclosed within its own cylindrical liner and has a separate combustion air supply. This design requires interconnector or crossover tubes to ensure that all the flame tubes light up during start-up by allowing the flame to spread between them.

In contrast, a tuboannular combustor features multiple flame tubes that share a common air supply, which is achieved by placing the flame tubes within a single cylindrical casing. This design results in a more compact and lighter combustor compared to the tubular combustor. However, it presents challenges in achieving a satisfactory distribution of combustion air between the flame tubes."
Industrial_Gas_Turbines_AMY_Razak.txt,90,17ba95cade8d28ced25a2410eab8b5e74568ba8834ddc549f36ed2b11cfd6780,What is the primary function of interconnector tubes in a tubular combustor?,The primary function of interconnector tubes in a tubular combustor is to ensure light-up of all the cans during start-up by allowing the flame to spread via the interconnector tubes.
Industrial_Gas_Turbines_AMY_Razak.txt,90,17ba95cade8d28ced25a2410eab8b5e74568ba8834ddc549f36ed2b11cfd6780,Why were tubular combustors eventually replaced by tuboannular combustors?,"Tubular combustors were eventually replaced by tuboannular combustors primarily due to their heavy weight and high pressure loss. The tubular combustor design, which consists of individual flame tubes with separate combustion air supplies, resulted in a less compact and heavier system. In contrast, the tuboannular combustor features a common air supply for all flame tubes within a single cylindrical casing, making it more compact and lighter. Additionally, the tuboannular design allows for better integration and efficiency, despite the challenge of achieving a satisfactory distribution of combustion air between the flame tubes. Overall, the advantages of reduced weight and improved compactness led to the widespread adoption of tuboannular combustors over tubular combustors."
Industrial_Gas_Turbines_AMY_Razak.txt,90,17ba95cade8d28ced25a2410eab8b5e74568ba8834ddc549f36ed2b11cfd6780,In what way does the common air supply in a tuboannular combustor affect its design?,"The common air supply in a tuboannular combustor affects its design by allowing all the flame tubes to share a single cylindrical casing, which results in a more compact and lighter combustor compared to the tubular combustor. However, this design introduces challenges in achieving a satisfactory distribution of combustion air between the flame tubes, making it more difficult to ensure even combustion across all tubes. Despite this challenge, the tuboannular combustor has been extensively used due to its advantages in size and weight."
Industrial_Gas_Turbines_AMY_Razak.txt,90,17ba95cade8d28ced25a2410eab8b5e74568ba8834ddc549f36ed2b11cfd6780,What advantages does an annular combustor have over a tuboannular combustor?,"The annular combustor has several advantages over a tuboannular combustor, including:

1. **Lower Pressure Loss**: The annular combustor design results in lower pressure losses compared to the tuboannular combustor, which can enhance overall efficiency.

2. **More Compact Design**: The annular combustor is more compact than the tuboannular combustor, making it advantageous in applications where space is a consideration.

3. **Widespread Use**: The annular combustor is now widely used in aero-engines and aero-derived gas turbines, indicating its effectiveness and reliability in various applications.

These advantages make the annular combustor a preferred choice in many modern gas turbine applications."
Industrial_Gas_Turbines_AMY_Razak.txt,90,17ba95cade8d28ced25a2410eab8b5e74568ba8834ddc549f36ed2b11cfd6780,How does the size of industrial gas turbine combustors compare to that of aero-derivative combustors?,"Industrial gas turbine combustors are generally much larger than aero-derivative combustors. This larger size allows industrial combustors to accommodate a wider range of fuels and results in increased residence time, enabling the burning of lower quality fuels. In contrast, aero-derivative combustors are designed with size and weight constraints in mind, leading to more compact designs."
Industrial_Gas_Turbines_AMY_Razak.txt,90,17ba95cade8d28ced25a2410eab8b5e74568ba8834ddc549f36ed2b11cfd6780,What impact does increased combustor size have on the residence time of fuels?,"Increased combustor size results in an increase in the residence time of fuels. This longer residence time enables the combustion of lower quality fuels, as the larger size allows for more thorough mixing and combustion of the fuel within the combustor."
Industrial_Gas_Turbines_AMY_Razak.txt,90,17ba95cade8d28ced25a2410eab8b5e74568ba8834ddc549f36ed2b11cfd6780,Why are industrial combustors designed to burn a wider range of fuels compared to aero-derivative combustors?,"Industrial combustors are designed to burn a wider range of fuels compared to aero-derivative combustors primarily because they are not constrained by size and weight limitations. This allows industrial combustors to be larger, which increases the residence time of the fuel within the combustor. A longer residence time enables the combustion of lower quality fuels, ranging from natural gas to treated crude oil. Additionally, the larger size of industrial combustors results in lower gas velocities, which contributes to reduced pressure losses during combustion, further accommodating a variety of fuel types."
Industrial_Gas_Turbines_AMY_Razak.txt,90,17ba95cade8d28ced25a2410eab8b5e74568ba8834ddc549f36ed2b11cfd6780,What are the implications of lower gas velocities in industrial combustors?,"Lower gas velocities in industrial combustors result in several implications:

1. **Reduced Pressure Loss**: Lower gas velocities lead to decreased pressure losses within the combustor. This can enhance the overall efficiency of the gas turbine system.

2. **Increased Residence Time**: With lower gas velocities, the residence time of the combustion gases within the combustor is increased. This allows for more complete combustion of the fuel, which is particularly beneficial when burning lower quality fuels.

3. **Flexibility in Fuel Types**: The ability to burn a wider range of fuels, including those of lower quality, is facilitated by the longer residence time and lower velocities. This flexibility can be advantageous for industrial applications that may require the use of various fuel types.

4. **Larger Combustor Size**: The design of industrial combustors, which are generally larger than aero-derived combustors, accommodates the lower gas velocities. This larger size can contribute to the overall robustness and durability of the combustor.

Overall, the implications of lower gas velocities in industrial combustors contribute to improved combustion efficiency and the capability to utilize a broader spectrum of fuels."
Industrial_Gas_Turbines_AMY_Razak.txt,90,17ba95cade8d28ced25a2410eab8b5e74568ba8834ddc549f36ed2b11cfd6780,How does the pressure loss in an annular combustor compare to that in a tubular combustor?,"The pressure loss in an annular combustor is lower compared to that in a tubular combustor. The annular combustor is designed to be more compact and efficient, resulting in reduced pressure losses."
Industrial_Gas_Turbines_AMY_Razak.txt,90,17ba95cade8d28ced25a2410eab8b5e74568ba8834ddc549f36ed2b11cfd6780,What type of combustor was used in early gas turbines such as the Whittle W2B and the Jumo 004?,"The type of combustor used in early gas turbines such as the Whittle W2B and the Jumo 004 was the tubular combustor, also known as the 'can' combustor."
Industrial_Gas_Turbines_AMY_Razak.txt,90,17ba95cade8d28ced25a2410eab8b5e74568ba8834ddc549f36ed2b11cfd6780,What challenges are associated with achieving a satisfactory distribution of combustion air in tuboannular combustors?,"The main challenge associated with achieving a satisfactory distribution of combustion air in tuboannular combustors is the difficulty in ensuring that all flame tubes receive an adequate and uniform supply of combustion air. Unlike tubular combustors, which have individual air supplies for each flame tube, tuboannular combustors rely on a common air supply for all flame tubes housed within a single cylindrical casing. This arrangement can lead to uneven air distribution, making it challenging to maintain optimal combustion conditions across all flame tubes."
Industrial_Gas_Turbines_AMY_Razak.txt,90,17ba95cade8d28ced25a2410eab8b5e74568ba8834ddc549f36ed2b11cfd6780,How does the design of an annular combustor contribute to its widespread use in aero-engines?,"The design of an annular combustor contributes to its widespread use in aero-engines due to its lower pressure loss and more compact structure compared to other combustor types, such as the tuboannular combustor. The annular configuration allows for a more efficient flow of combustion air around the flame tube, which enhances combustion efficiency. This compactness and efficiency make annular combustors suitable for the performance demands of aero-engines, leading to their prevalent adoption in both aero-engines and aero-derived gas turbines."
