NODE_FILE_NAME,NODE_NUMBER,NODE_HASH,QUESTION,ANSWER
msd_servo_drive.txt,14,0cb5d3add71d2916ce7c2fa3383a8c06c2b9f5d7bc290bb7a037f1992a047800,What is the shut-off threshold based on measurement tolerances for the servo drive system?,The shut-off threshold based on measurement tolerances for the servo drive system is 110% of the nominal value.
msd_servo_drive.txt,14,0cb5d3add71d2916ce7c2fa3383a8c06c2b9f5d7bc290bb7a037f1992a047800,Which connectors can the temperature sensor cable be connected to in the MSD Single-Axis Servo Drive Compact?,The temperature sensor cable can be connected to both X6 and X7 in the MSD Single-Axis Servo Drive Compact.
msd_servo_drive.txt,14,0cb5d3add71d2916ce7c2fa3383a8c06c2b9f5d7bc290bb7a037f1992a047800,What type of adapter is required for the MSD Single-Axis Servo Drive Compact and MSD Servo Drive Safety?,An NTC adapter - 220 kOhm is required for the MSD Single-Axis Servo Drive Compact and MSD Servo Drive Safety.
msd_servo_drive.txt,14,0cb5d3add71d2916ce7c2fa3383a8c06c2b9f5d7bc290bb7a037f1992a047800,What is the resistance value of the NTC adapter mentioned for the servo drive?,The resistance value of the NTC adapter mentioned for the servo drive is 220 kOhm.
msd_servo_drive.txt,14,0cb5d3add71d2916ce7c2fa3383a8c06c2b9f5d7bc290bb7a037f1992a047800,"What does the I²t type setting ""THERM(1)"" depend on in a synchronous motor?","The I²t type setting ""THERM(1)"" in a synchronous motor depends on the thermal time constant. When this setting is selected, all other settings apart from the thermal time constant are disabled."
msd_servo_drive.txt,14,0cb5d3add71d2916ce7c2fa3383a8c06c2b9f5d7bc290bb7a037f1992a047800,How does the loss in a synchronous motor compare to that of an asynchronous motor?,"A synchronous motor has lower loss compared to an asynchronous motor because it uses permanent magnets to replace the magnetizing current, resulting in improved efficiency."
msd_servo_drive.txt,14,0cb5d3add71d2916ce7c2fa3383a8c06c2b9f5d7bc290bb7a037f1992a047800,"What happens to the settings when the I²t type is set to ""THERM(1)""?","When the I²t type is set to ""THERM(1) = Thermal time constant dependent,"" all settings apart from the thermal time constant are disabled."
msd_servo_drive.txt,14,0cb5d3add71d2916ce7c2fa3383a8c06c2b9f5d7bc290bb7a037f1992a047800,What is the significance of the thermal time constant in the context of I²t monitoring?,"The thermal time constant in the context of I²t monitoring is significant because it determines how the thermal response of the synchronous motor is managed. When the I²t type is set to ""THERM(1) = Thermal time constant dependent,"" it indicates that the motor's thermal behavior is being monitored based on its specific thermal time constant. This means that the settings related to the motor's thermal performance, except for the thermal time constant itself, are disabled. 

The thermal time constant essentially reflects how quickly the motor can respond to changes in temperature and how heat is dissipated. A lower thermal time constant means the motor can reach its thermal limits more quickly, while a higher constant indicates a slower response. By using this parameter in I²t monitoring, the system can more accurately assess the thermal state of the motor, ensuring that it operates within safe limits and preventing overheating, which could lead to damage or failure."
msd_servo_drive.txt,14,0cb5d3add71d2916ce7c2fa3383a8c06c2b9f5d7bc290bb7a037f1992a047800,What is the purpose of the selection options for sensor types in relation to the plug-in connectors?,"The selection options for sensor types in relation to the plug-in connectors (X5, X6, X7, and X8) provide users with the ability to choose the appropriate sensor type that can be connected to the MSD Servo Drive and MSD Single-Axis Servo Drive Compact. This allows for flexibility in monitoring and managing temperature and other parameters, ensuring that the system can be tailored to specific operational needs and configurations. The overview helps users understand which sensors are compatible with the available connectors, facilitating proper installation and functionality of the servo drive systems."
msd_servo_drive.txt,14,0cb5d3add71d2916ce7c2fa3383a8c06c2b9f5d7bc290bb7a037f1992a047800,What is the MOOG ID number associated with the MSD ServoDrive documentation?,The MOOG ID number associated with the MSD ServoDrive documentation is CB40859-001.
msd_servo_drive.txt,14,0cb5d3add71d2916ce7c2fa3383a8c06c2b9f5d7bc290bb7a037f1992a047800,What date is listed on the MSD ServoDrive documentation?,The date listed on the MSD ServoDrive documentation is 11/2020.
msd_servo_drive.txt,14,0cb5d3add71d2916ce7c2fa3383a8c06c2b9f5d7bc290bb7a037f1992a047800,How many plug-in connectors are mentioned for the MSD Servo Drive and MSD Single-Axis Servo Drive Compact?,"Four plug-in connectors are mentioned for the MSD Servo Drive and MSD Single-Axis Servo Drive Compact: X5, X6, X7, and X8."
msd_servo_drive.txt,14,0cb5d3add71d2916ce7c2fa3383a8c06c2b9f5d7bc290bb7a037f1992a047800,What is the primary advantage of using a synchronous motor over an asynchronous motor?,"The primary advantage of using a synchronous motor over an asynchronous motor is that a synchronous motor has lower losses due to the use of permanent magnets, which replace the magnetizing current found in asynchronous motors. This design leads to improved efficiency in synchronous motors."
msd_servo_drive.txt,14,0cb5d3add71d2916ce7c2fa3383a8c06c2b9f5d7bc290bb7a037f1992a047800,What type of monitoring is discussed in the context of the MSD ServoDrive?,"The context discusses ""temperature monitoring"" and ""I²t monitoring"" for the MSD ServoDrive."
msd_servo_drive.txt,14,0cb5d3add71d2916ce7c2fa3383a8c06c2b9f5d7bc290bb7a037f1992a047800,In what scenario are all settings apart from the thermal time constant disabled for the I²t monitoring?,"All settings apart from the thermal time constant are disabled for the I²t monitoring when the I2t type is set to ""THERM(1) = Thermal time constant dependent."""
msd_servo_drive.txt,14,0cb5d3add71d2916ce7c2fa3383a8c06c2b9f5d7bc290bb7a037f1992a047800,What is the role of permanent magnets in the design of a synchronous motor?,"The role of permanent magnets in the design of a synchronous motor is to replace the magnetizing current that is typically required in asynchronous motors. This design choice allows synchronous motors to have lower losses compared to asynchronous motors, as the use of permanent magnets eliminates the need for additional current to create the magnetic field, resulting in improved efficiency."
msd_servo_drive.txt,14,0cb5d3add71d2916ce7c2fa3383a8c06c2b9f5d7bc290bb7a037f1992a047800,"What does the term ""shut-off threshold"" refer to in the context of servo drive systems?","In the context of servo drive systems, the term ""shut-off threshold"" refers to a specific limit or value that, when exceeded, triggers the system to shut down or stop operating. This threshold is based on measurement tolerances and is set at 110% of the nominal value. It serves as a safety mechanism to prevent damage to the system or components by ensuring that operating conditions remain within safe limits."
msd_servo_drive.txt,14,0cb5d3add71d2916ce7c2fa3383a8c06c2b9f5d7bc290bb7a037f1992a047800,How can the temperature monitoring parameters be applied in practical scenarios involving servo drives?,"The temperature monitoring parameters for servo drives, as outlined in the provided context, can be applied in practical scenarios in several ways:

1. **Temperature Sensor Connection**: The MSD Single-Axis Servo Drive Compact allows for temperature sensors to be connected to multiple terminals (X6 and X7). This flexibility enables users to choose the most convenient connection point based on their specific setup and wiring configurations.

2. **Safety and Performance Monitoring**: By implementing temperature monitoring, operators can ensure that the servo drive operates within safe temperature limits. The shut-off threshold set at 110% of the nominal value serves as a critical safety measure to prevent overheating, which could lead to equipment failure or damage.

3. **Adaptation for Different Sensor Types**: The overview of selection options for sensor types allows users to select appropriate sensors based on their application needs. The availability of an NTC adapter (220 kOhm) for specific drive models ensures compatibility with various temperature sensors, enhancing the system's adaptability.

4. **Thermal Time Constant Monitoring**: The I²t monitoring feature, particularly when set to ""THERM(1) = Thermal time constant dependent,"" allows for dynamic monitoring of the motor's thermal state. This means that the system can adjust its operation based on the thermal characteristics of the motor, providing better protection and efficiency.

5. **Enhanced Motor Efficiency**: Understanding the thermal characteristics of synchronous motors, which have lower losses compared to asynchronous motors, can help in optimizing their performance. By monitoring temperature, operators can ensure that the motor runs efficiently without exceeding safe operating temperatures.

6. **Preventive Maintenance**: Regular monitoring of temperature parameters can serve as an early warning system for potential issues. If temperatures approach the shut-off threshold, maintenance can be scheduled proactively to address any underlying problems before they lead to failure.

In summary, applying temperature monitoring parameters in practical scenarios involving servo drives enhances safety, efficiency, and reliability, ultimately contributing to better performance and longevity of the equipment."
msd_servo_drive.txt,14,0cb5d3add71d2916ce7c2fa3383a8c06c2b9f5d7bc290bb7a037f1992a047800,What implications does the connection of the temperature sensor cable have for system performance?,"The connection of the temperature sensor cable to either X6 or X7 on the MSD Single-Axis Servo Drive Compact can have several implications for system performance:

1. **Temperature Monitoring**: Proper connection of the temperature sensor is crucial for effective temperature monitoring. Accurate temperature readings help ensure that the servo drive operates within safe thermal limits, preventing overheating and potential damage to the motor.

2. **Safety and Reliability**: By monitoring temperature, the system can implement safety measures, such as shutting down the drive if temperatures exceed the shut-off threshold (110% of the nominal value). This enhances the reliability and longevity of the system.

3. **Performance Optimization**: The temperature data can be used to optimize performance. For example, if the system detects that the motor is operating at higher temperatures, it may adjust operational parameters to prevent overheating, thereby maintaining optimal performance.

4. **Compatibility with Other Components**: The requirement for an NTC adapter (220 kOhm) for the MSD Single-Axis Servo Drive Compact and MSD Servo Drive Safety indicates that proper sensor connection is essential for compatibility with the drive's monitoring systems. Failure to use the correct adapter may lead to inaccurate readings or system malfunctions.

5. **Impact on Control Algorithms**: The temperature readings can influence control algorithms, particularly in systems using I²t monitoring. If the I2t type is set to ""THERM(1)"", the thermal time constant becomes a critical parameter, and any inaccuracies in temperature sensing could lead to improper settings and affect the motor's performance.

In summary, the connection of the temperature sensor cable is vital for ensuring safe operation, optimizing performance, and maintaining the reliability of the MSD Servo Drive system."
msd_servo_drive.txt,14,0cb5d3add71d2916ce7c2fa3383a8c06c2b9f5d7bc290bb7a037f1992a047800,How can understanding the differences between synchronous and asynchronous motors impact the selection of drive systems?,"Understanding the differences between synchronous and asynchronous motors can significantly impact the selection of drive systems in several ways:

1. **Efficiency**: Synchronous motors typically have higher efficiency compared to asynchronous motors due to the use of permanent magnets, which reduces energy losses associated with magnetizing current. This can lead to lower operational costs and improved performance in applications where energy efficiency is critical.

2. **Control Requirements**: Synchronous motors often require more sophisticated control systems to maintain synchronization with the supply frequency. This may influence the choice of drive systems, as a more advanced drive may be necessary for synchronous motors to achieve precise control over speed and torque.

3. **Performance Characteristics**: Synchronous motors provide constant speed under varying load conditions, making them suitable for applications requiring consistent performance. In contrast, asynchronous motors may experience speed variations with load changes. This characteristic can dictate the type of drive system needed based on the application's performance requirements.

4. **Thermal Management**: As mentioned in the context, synchronous motors can have lower losses, which can affect thermal management strategies. The drive system may need to incorporate specific monitoring features, such as I²t monitoring, to prevent overheating and ensure reliable operation, particularly in synchronous motors where thermal time constants are critical.

5. **Application Suitability**: The choice between synchronous and asynchronous motors can depend on the specific application. For instance, synchronous motors are often preferred in high-performance applications like robotics or CNC machines, while asynchronous motors may be more suitable for simpler, cost-sensitive applications. The drive system selected must align with these application needs.

In summary, understanding the differences between these motor types helps in selecting the most appropriate drive system, ensuring optimal performance, efficiency, and reliability for the intended application."
