NODE_FILE_NAME,NODE_NUMBER,NODE_HASH,QUESTION,ANSWER
msd_servo_drive.txt,43,0935fe1040a3a5b176fad162cbcbdf3d141d1487e12ea6e60497507349554bba,What is the first step to take after making adjustments to the device settings?,The first step to take after making adjustments to the device settings is to save the values.
msd_servo_drive.txt,43,0935fe1040a3a5b176fad162cbcbdf3d141d1487e12ea6e60497507349554bba,What action should be taken to ensure the device operates with the new values?,"To ensure the device operates with the new values, you should save the values and then restart the device. After restarting, start control by executing homing in position control and then move to any position to apply the momentary correction value."
msd_servo_drive.txt,43,0935fe1040a3a5b176fad162cbcbdf3d141d1487e12ea6e60497507349554bba,Which parameter indicates the position end value of the correction range?,The parameter that indicates the position end value of the correction range is P 592 - ENC_ACOR_PosEnd.
msd_servo_drive.txt,43,0935fe1040a3a5b176fad162cbcbdf3d141d1487e12ea6e60497507349554bba,What happens to the momentary correction value during the control process?,"During the control process, the momentary correction value is written to P 594 - ENC_ACOR_Val. This value is then subtracted from the approached position value."
msd_servo_drive.txt,43,0935fe1040a3a5b176fad162cbcbdf3d141d1487e12ea6e60497507349554bba,Where is the momentary correction value recorded after executing homing?,The momentary correction value is recorded in P 594 - ENC_ACOR_Val after executing homing.
msd_servo_drive.txt,43,0935fe1040a3a5b176fad162cbcbdf3d141d1487e12ea6e60497507349554bba,How does the momentary correction value affect the approached position value?,"The momentary correction value, which is written to P 594 - ENC_ACOR_Val, is subtracted from the approached position value. This means that when the system moves to a position, the correction value is applied to adjust the final position by reducing it based on the correction."
msd_servo_drive.txt,43,0935fe1040a3a5b176fad162cbcbdf3d141d1487e12ea6e60497507349554bba,What is the significance of executing homing in position control?,"Executing homing in position control is significant because it establishes a reference point for the system. This process allows the device to determine its current position accurately before moving to any target position. By performing homing, the system can ensure that subsequent movements are based on a known starting point, which is crucial for precise positioning and effective correction of any positional errors. This is particularly important in applications where accuracy and repeatability are essential."
msd_servo_drive.txt,43,0935fe1040a3a5b176fad162cbcbdf3d141d1487e12ea6e60497507349554bba,What is the purpose of moving to any position after starting control?,"The purpose of moving to any position after starting control is to execute the homing process and to determine the momentary correction value, which is recorded in P 594 - ENC_ACOR_Val. This correction value is then subtracted from the approached position value, allowing for accurate positioning by compensating for any discrepancies in the system."
msd_servo_drive.txt,43,0935fe1040a3a5b176fad162cbcbdf3d141d1487e12ea6e60497507349554bba,Which parameter is updated with the momentary correction value during operation?,The parameter that is updated with the momentary correction value during operation is P 594 - ENC_ACOR_Val.
msd_servo_drive.txt,43,0935fe1040a3a5b176fad162cbcbdf3d141d1487e12ea6e60497507349554bba,What should be done to finalize the adjustments made to the device?,"To finalize the adjustments made to the device, you should save the values and then restart the device."
msd_servo_drive.txt,43,0935fe1040a3a5b176fad162cbcbdf3d141d1487e12ea6e60497507349554bba,How does the position end value relate to the correction range?,"The position end value, indicated by P 592 - ENC_ACOR_PosEnd, represents the maximum limit of the correction range. This means that it defines the endpoint within which corrections can be applied to the position. When the control system executes homing and moves to a specific position, the momentary correction value is calculated and recorded in P 594 - ENC_ACOR_Val, which is then subtracted from the approached position value. Thus, the position end value is crucial as it sets the boundary for the allowable corrections to ensure accurate positioning within the defined range."
msd_servo_drive.txt,43,0935fe1040a3a5b176fad162cbcbdf3d141d1487e12ea6e60497507349554bba,What is the consequence of not saving the values before restarting the device?,"The consequence of not saving the values before restarting the device is that any changes or adjustments made to the settings, such as the position end value of the correction range (P 592 - ENC_ACOR_PosEnd) and the momentary correction value (P 594 - ENC_ACOR_Val), will be lost. This could result in the device not operating correctly or reverting to default settings, leading to potential errors in position control and overall performance."
msd_servo_drive.txt,43,0935fe1040a3a5b176fad162cbcbdf3d141d1487e12ea6e60497507349554bba,Why is it important to restart the device after making changes?,"Restarting the device after making changes is important because it ensures that all modifications are properly applied and that the system operates with the most current settings. This process helps to reset the device's state, clear any temporary data or errors, and initialize the new configurations, which can lead to improved performance and accuracy in operations, such as position control in this context."
msd_servo_drive.txt,43,0935fe1040a3a5b176fad162cbcbdf3d141d1487e12ea6e60497507349554bba,What role does the parameter P 594 play in the control process?,"The parameter P 594, labeled as ENC_ACOR_Val, plays a crucial role in the control process by holding the momentary correction value. This value is subtracted from the approached position value during the control operation, which helps to adjust the position accurately based on the correction range. Essentially, it ensures that the system accounts for any necessary adjustments to achieve the desired position."
msd_servo_drive.txt,43,0935fe1040a3a5b176fad162cbcbdf3d141d1487e12ea6e60497507349554bba,"What does the term ""momentary correction value"" refer to in this context?","In this context, the term ""momentary correction value"" refers to the instantaneous adjustment or correction applied to the position of the servo drive at a given moment. When the device is in position control and has executed homing, this value is recorded in P 594 - ENC_ACOR_Val. It represents the difference between the approached position and the actual position, which is used to ensure accurate positioning by compensating for any discrepancies."
msd_servo_drive.txt,43,0935fe1040a3a5b176fad162cbcbdf3d141d1487e12ea6e60497507349554bba,How can the approach to a position be influenced by the correction value?,"The approach to a position can be influenced by the correction value because the momentary correction value, which is stored in P 594 - ENC_ACOR_Val, is subtracted from the approached position value. This means that when the system moves to a target position, the actual position it aims for is adjusted by this correction value. If the correction value is positive, the effective target position will be lower than the approached position, and if the correction value is negative, the effective target position will be higher. This adjustment helps in fine-tuning the movement to ensure accuracy in reaching the desired position."
msd_servo_drive.txt,43,0935fe1040a3a5b176fad162cbcbdf3d141d1487e12ea6e60497507349554bba,What is the sequence of actions that must be taken after adjusting the device settings?,"After adjusting the device settings, the sequence of actions that must be taken is as follows:

1. Save the values.
2. Restart the device.
3. Execute homing in position control.
4. Move to any position. 

During this process, the momentary correction value will be written to P 594 - ENC_ACOR_Val, which will then be subtracted from the approached position value."
msd_servo_drive.txt,43,0935fe1040a3a5b176fad162cbcbdf3d141d1487e12ea6e60497507349554bba,What does executing homing ensure in the context of position control?,Executing homing in the context of position control ensures that the system establishes a reference point or zero position for the servo drive. This process allows the device to accurately determine its current position before moving to any other specified position. It is a critical step that helps in calibrating the system and ensuring precise control over movements.
msd_servo_drive.txt,43,0935fe1040a3a5b176fad162cbcbdf3d141d1487e12ea6e60497507349554bba,How can the updated values impact the overall functionality of the device?,"The updated values, specifically the position end value of the correction range (P 592 - ENC_ACOR_PosEnd) and the momentary correction value (P 594 - ENC_ACOR_Val), play a crucial role in the overall functionality of the device. 

1. **Precision in Positioning**: The position end value defines the limits of the correction range, ensuring that the device operates within specified parameters. This helps in achieving precise positioning, which is critical for applications requiring accuracy.

2. **Dynamic Corrections**: The momentary correction value allows the device to adjust in real-time based on its current position. By subtracting this value from the approached position, the device can compensate for any discrepancies, leading to smoother and more accurate movements.

3. **Improved Performance**: By implementing these updated values, the device can enhance its performance during control operations, such as homing and moving to specified positions. This can result in faster response times and reduced errors in positioning.

4. **Reliability and Stability**: Regular updates and corrections help maintain the reliability and stability of the device. It reduces the risk of overshooting or undershooting target positions, which can lead to mechanical wear or failure.

Overall, the updated values contribute to the device's ability to operate effectively, ensuring that it meets operational requirements and maintains high performance standards."
msd_servo_drive.txt,43,0935fe1040a3a5b176fad162cbcbdf3d141d1487e12ea6e60497507349554bba,What is the relationship between the approached position and the correction value?,The approached position is adjusted by subtracting the momentary correction value (stored in P 594 - ENC_ACOR_Val) from it. This means that the correction value is used to modify the approached position to account for any necessary adjustments in the control process.
