NODE_FILE_NAME,NODE_NUMBER,NODE_HASH,QUESTION,ANSWER
msd_servo_drive.txt,67,7e1ccc3087ba4929b3fdf5e8fdeafb1406d95541ce6b1502a6e99e56dbcbbfcf,How is the gear ratio represented in the motion profile table?,"In the motion profile table, the gear ratio is represented under the index name ""MPRO_402_GearRatio"" with the identifier 6091H. It includes two entries: 

- The first entry (2254, 0) represents the gear ratio in terms of revolutions (rev).
- The second entry (2254, 1) also represents the gear ratio in terms of revolutions (rev). 

The specific details of the gear ratio are not provided in the context, but it is indicated that the values for the gear ratio are entered as integer fractions."
msd_servo_drive.txt,67,7e1ccc3087ba4929b3fdf5e8fdeafb1406d95541ce6b1502a6e99e56dbcbbfcf,What is the purpose of defining a limit value for the circumferential length in a rotary table application?,"The purpose of defining a limit value for the circumferential length in a rotary table application is to establish a point at which a revolution is considered complete. This limit value allows the system to recognize when the rotary table has completed a full rotation, enabling accurate positioning and indexing. It ensures that the motion control system can effectively manage the movement of the table, preventing overshooting and facilitating precise control over the rotary motion."
msd_servo_drive.txt,67,7e1ccc3087ba4929b3fdf5e8fdeafb1406d95541ce6b1502a6e99e56dbcbbfcf,What factors are included in the DS402 velocity encoder factor?,"The DS402 velocity encoder factor includes the following factors:

1. **MPRO_402_VelFact** (Index 2257)
   - 0: in increments per second (incr/s)
   - 1: in revolutions per minute (rev/min)

2. **MPRO_402_VelFact1** (Index 2258)
   - 0: (no specific unit mentioned)
   - 1: (no specific unit mentioned)

3. **MPRO_402_VelFact2** (Index 2259)
   - 0: (no specific unit mentioned)
   - 1: (no specific unit mentioned)

These factors are used to define the velocity measurement in different units."
msd_servo_drive.txt,67,7e1ccc3087ba4929b3fdf5e8fdeafb1406d95541ce6b1502a6e99e56dbcbbfcf,How does the position factor relate to increments and degrees in a servo drive system?,"In a servo drive system, the position factor is used to convert the encoder increments into meaningful physical units, such as degrees. The position factor has two components:

1. **Increments**: This refers to the number of discrete steps or counts that the encoder can detect. The position factor in increments allows the system to interpret the raw data from the encoder in terms of how many increments correspond to a specific position.

2. **Degrees (mDegree)**: This is a physical measurement of angle, where the position factor in degrees translates the increments into actual angular positions. For example, if the position factor indicates that a certain number of increments equals a specific number of degrees, the system can calculate the exact position of the motor shaft in terms of rotation.

Thus, the position factor serves as a conversion mechanism between the raw encoder data (increments) and the desired physical representation (degrees), enabling precise control and positioning in the servo drive system."
msd_servo_drive.txt,67,7e1ccc3087ba4929b3fdf5e8fdeafb1406d95541ce6b1502a6e99e56dbcbbfcf,What are the two units used to measure the acceleration factor in the motion profile?,"The two units used to measure the acceleration factor in the motion profile are ""incr/s/s"" (increments per second squared) and ""rev/min/s"" (revolutions per minute per second)."
msd_servo_drive.txt,67,7e1ccc3087ba4929b3fdf5e8fdeafb1406d95541ce6b1502a6e99e56dbcbbfcf,"What is the role of the ""indexing table function"" in a rotary table application?","The ""indexing table function"" in a rotary table application is used to define specific positions or increments around the table for precise movement and control. It allows the system to recognize a complete revolution based on a set circumferential length, which is referred to as the ""upper position."" This functionality enables the rotary table to accurately position itself at predetermined angles or locations, facilitating tasks such as automated indexing, part placement, or repetitive motion in applications like machining, assembly, or material handling."
msd_servo_drive.txt,67,7e1ccc3087ba4929b3fdf5e8fdeafb1406d95541ce6b1502a6e99e56dbcbbfcf,How is the resolution of the velocity encoder defined in terms of increments per second?,"The resolution of the velocity encoder is defined in terms of increments per second as follows:

- For the DS402 velocity encoder resolution, the index name is **MPRO_402_VelEncRes**. 
- The specific entry for increments per second is indicated by the index **2253** with a unit of **incr/s** (encoder increments per second)."
msd_servo_drive.txt,67,7e1ccc3087ba4929b3fdf5e8fdeafb1406d95541ce6b1502a6e99e56dbcbbfcf,"What does the term ""DriveShaftRev"" represent in the context of the feed constant?","In the context of the feed constant, ""DriveShaftRev"" represents the number of revolutions of the drive shaft. It is used as a unit of measurement to indicate the amount of movement or distance traveled by the drive mechanism in relation to the feed constant."
msd_servo_drive.txt,67,7e1ccc3087ba4929b3fdf5e8fdeafb1406d95541ce6b1502a6e99e56dbcbbfcf,How many different velocity factors are specified in the motion profile table?,"In the motion profile table, there are two different velocity factors specified: 

1. **MPRO_402_VelFact** (velocity encoder factor)
2. **MPRO_402_VelFact1** (velocity factor 1)
3. **MPRO_402_VelFact2** (velocity factor 2)

Thus, there are a total of **three different velocity factors** specified."
msd_servo_drive.txt,67,7e1ccc3087ba4929b3fdf5e8fdeafb1406d95541ce6b1502a6e99e56dbcbbfcf,What is the relationship between the single-turn position and the number of bits used for resolution?,"The single-turn position is determined by the resolution of the position controller, which can be adapted variably to the application. In the default setting, 20 bits are used for the single-turn position out of a total of 32 bits available. This means that the resolution of the single-turn position is directly related to the number of bits allocated for it; more bits allow for a higher resolution, enabling more precise positioning within a single turn."
msd_servo_drive.txt,67,7e1ccc3087ba4929b3fdf5e8fdeafb1406d95541ce6b1502a6e99e56dbcbbfcf,"What information is conveyed by the index name ""MPRO_402_VelEncRes"" in the motion profile?","The index name ""MPRO_402_VelEncRes"" in the motion profile conveys information about the velocity encoder resolution as defined in the DS402 standard. It includes two specific parameters:

1. **Encoder increments per second (incr/s)** - This indicates the resolution of the velocity encoder in terms of the number of increments it can detect per second.
2. **Motor revolutions per second (rev/s)** - This indicates the resolution of the velocity encoder in terms of the number of motor revolutions it can detect per second.

Overall, ""MPRO_402_VelEncRes"" provides details on how finely the system can measure and control the velocity of the motor based on encoder feedback."
msd_servo_drive.txt,67,7e1ccc3087ba4929b3fdf5e8fdeafb1406d95541ce6b1502a6e99e56dbcbbfcf,What is the limit value that defines the point at which a revolution is complete for circumferential length?,The limit value that defines the point at which a revolution is complete for circumferential length is set to 360°.
msd_servo_drive.txt,67,7e1ccc3087ba4929b3fdf5e8fdeafb1406d95541ce6b1502a6e99e56dbcbbfcf,How is the circumferential length set in the “As linear” process option?,"In the “As linear” process option, the circumferential length is set to 360°. When the position reaches 360°, the actual position is reset to 0°. There is no need to set a negative setpoint for direction reversal."
msd_servo_drive.txt,67,7e1ccc3087ba4929b3fdf5e8fdeafb1406d95541ce6b1502a6e99e56dbcbbfcf,What happens to the actual position when 360° is reached in the “As linear” process option?,"When 360° is reached in the “As linear” process option, the actual position is set to 0°."
msd_servo_drive.txt,67,7e1ccc3087ba4929b3fdf5e8fdeafb1406d95541ce6b1502a6e99e56dbcbbfcf,Is it necessary to set a negative setpoint for direction reversal in the “As linear” process option?,"No, it is not necessary to set a negative setpoint for direction reversal in the “As linear” process option."
msd_servo_drive.txt,67,7e1ccc3087ba4929b3fdf5e8fdeafb1406d95541ce6b1502a6e99e56dbcbbfcf,What is the circumferential length set to when using the “Left/right-hand rotation” process option?,The circumferential length is set to 360° when using the “Left/right-hand rotation” process option.
msd_servo_drive.txt,67,7e1ccc3087ba4929b3fdf5e8fdeafb1406d95541ce6b1502a6e99e56dbcbbfcf,"In the “Left/right-hand rotation” process option, what occurs after reaching 360° in the positive direction?","In the “Left/right-hand rotation” process option, after reaching 360° in the positive direction, the actual position is set to 0°."
msd_servo_drive.txt,67,7e1ccc3087ba4929b3fdf5e8fdeafb1406d95541ce6b1502a6e99e56dbcbbfcf,What parameter is associated with the DS402 Polarity?,The parameter associated with the DS402 Polarity is **MPRO_402_Polarity**.
msd_servo_drive.txt,67,7e1ccc3087ba4929b3fdf5e8fdeafb1406d95541ce6b1502a6e99e56dbcbbfcf,Which parameter corresponds to the DS402 position notation index?,The parameter that corresponds to the DS402 position notation index is **MPRO_402_PosNotInd**.
msd_servo_drive.txt,67,7e1ccc3087ba4929b3fdf5e8fdeafb1406d95541ce6b1502a6e99e56dbcbbfcf,What is the significance of the MPRO_402_VelNotInd parameter?,"The MPRO_402_VelNotInd parameter, as indicated in the context information, refers to the velocity notation index in the DS402 standard. Its significance lies in defining how the velocity of a system or component is represented or notated within the context of the drive's configuration. This parameter is essential for ensuring that the system can interpret and communicate velocity values correctly, which is crucial for precise control and operation of servo drives in automation and motion control applications."
msd_servo_drive.txt,67,7e1ccc3087ba4929b3fdf5e8fdeafb1406d95541ce6b1502a6e99e56dbcbbfcf,How many parameters are listed under the “Standardization / units - Standard/CiA 402” section?,There are 6 parameters listed under the “Standardization / units - Standard/CiA 402” section.
msd_servo_drive.txt,67,7e1ccc3087ba4929b3fdf5e8fdeafb1406d95541ce6b1502a6e99e56dbcbbfcf,What does the MPRO_402_AccDimInd parameter represent?,The MPRO_402_AccDimInd parameter represents the 608EH DS402 acceleration dimension index.
msd_servo_drive.txt,67,7e1ccc3087ba4929b3fdf5e8fdeafb1406d95541ce6b1502a6e99e56dbcbbfcf,What notation index is associated with the DS402 acceleration?,"The notation index associated with the DS402 acceleration is 608DH, as indicated by the parameter MPRO_402_AccNotInd."
msd_servo_drive.txt,67,7e1ccc3087ba4929b3fdf5e8fdeafb1406d95541ce6b1502a6e99e56dbcbbfcf,What is the function of the MPRO_FG_Config parameter?,"The MPRO_FG_Config parameter, identified as ""Factor group configuration,"" is likely used to configure various settings related to the operation of the servo drive within the context of the standardization and units defined by CiA 402. It serves as a configuration point for managing how the drive interprets and processes different factors related to motion, such as polarity, position notation, velocity notation, and acceleration notation, as indicated by the other parameters listed in the table."
msd_servo_drive.txt,67,7e1ccc3087ba4929b3fdf5e8fdeafb1406d95541ce6b1502a6e99e56dbcbbfcf,How does the “as linear” indexing table function operate in terms of position reset?,"The “as linear” indexing table function operates by setting the circumferential length to 360°. When the actual position reaches 360°, it is reset to 0°. This means that once a complete revolution is achieved, the position is effectively reset to the starting point without the need to set a negative setpoint for direction reversal."
msd_servo_drive.txt,67,7e1ccc3087ba4929b3fdf5e8fdeafb1406d95541ce6b1502a6e99e56dbcbbfcf,What is the role of the MPRO_402_PosDimInd parameter in the context of position measurement?,"The MPRO_402_PosDimInd parameter, as indicated in the context, refers to the ""608AH DS402 position dimension index."" Its role in the context of position measurement is to define the unit of measurement for the position values within the system. This parameter helps standardize how position data is represented and interpreted, ensuring consistency in the measurement of position across different devices and applications that adhere to the DS402 standard."
msd_servo_drive.txt,67,7e1ccc3087ba4929b3fdf5e8fdeafb1406d95541ce6b1502a6e99e56dbcbbfcf,Which parameter is linked to the DS402 velocity dimension index?,The parameter linked to the DS402 velocity dimension index is **MPRO_402_VelDimInd**.
msd_servo_drive.txt,67,7e1ccc3087ba4929b3fdf5e8fdeafb1406d95541ce6b1502a6e99e56dbcbbfcf,What is the purpose of defining the circumferential length in a drive system?,"The purpose of defining the circumferential length in a drive system is to establish a limit value that indicates when a complete revolution has occurred. This allows the system to reset the actual position to 0° upon reaching the defined circumferential length (e.g., 360°), facilitating accurate position tracking and control of the drive's movement. It also ensures that the system can handle direction reversals without the need for negative setpoints, thereby simplifying the operation of the drive system."
msd_servo_drive.txt,67,7e1ccc3087ba4929b3fdf5e8fdeafb1406d95541ce6b1502a6e99e56dbcbbfcf,How does the circumferential length affect the actual position in a servo drive?,"The circumferential length in a servo drive defines the complete revolution point. When the circumferential length is set to 360°, reaching this value results in the actual position being reset to 0°. This means that the servo drive interprets a full rotation (360°) as completing a cycle, allowing for continuous movement without needing to set a negative setpoint for direction reversal. In the case of left/right-hand rotation, the same principle applies: after completing a full revolution, the actual position resets to 0°, facilitating smooth transitions in movement direction."
msd_servo_drive.txt,67,7e1ccc3087ba4929b3fdf5e8fdeafb1406d95541ce6b1502a6e99e56dbcbbfcf,"What does the term ""direction of rotation left/right"" refer to in the context of the drive system?","In the context of the drive system, the term ""direction of rotation left/right"" refers to the orientation in which the drive system rotates. Specifically, it indicates whether the drive is set to rotate in a clockwise (right-hand) or counterclockwise (left-hand) direction. This setting is important for determining how the system interprets the movement and position of the drive, particularly when it comes to completing a revolution and resetting the actual position to 0° after reaching the defined circumferential length of 360°."
msd_servo_drive.txt,67,7e1ccc3087ba4929b3fdf5e8fdeafb1406d95541ce6b1502a6e99e56dbcbbfcf,How does the configuration of the MPRO parameters influence the operation of a servo drive?,"The configuration of the MPRO parameters plays a crucial role in the operation of a servo drive by defining how the drive interprets and manages various aspects of motion control. Each parameter has a specific function that influences the behavior of the servo drive in the following ways:

1. **Polarity (MPRO_402_Polarity)**: This parameter determines the direction of the output signals. Correctly configuring the polarity ensures that the servo drive moves in the intended direction when commanded.

2. **Position Notation Index (MPRO_402_PosNotInd)**: This setting specifies how position values are represented. It affects how the drive interprets the position data, which is essential for accurate positioning and movement.

3. **Position Dimension Index (MPRO_402_PosDimInd)**: This parameter defines the unit of measurement for position (e.g., degrees, millimeters). Proper configuration ensures that the servo drive understands the scale of movement, which is critical for precision applications.

4. **Velocity Notation Index (MPRO_402_VelNotInd)**: This parameter indicates how velocity is expressed. It influences the drive's response to velocity commands, affecting acceleration and deceleration profiles.

5. **Velocity Dimension Index (MPRO_402_VelDimInd)**: Similar to the position dimension, this parameter specifies the unit for velocity. Accurate configuration is necessary for the drive to achieve desired speed settings.

6. **Acceleration Notation Index (MPRO_402_AccNotInd)**: This parameter defines how acceleration values are represented. It impacts the drive's ability to ramp up or down smoothly, which is important for avoiding mechanical stress and ensuring smooth operation.

7. **Acceleration Dimension Index (MPRO_402_AccDimInd)**: This specifies the unit of measurement for acceleration. Correctly setting this parameter ensures that the drive can interpret acceleration commands accurately.

In summary, the MPRO parameters configure the servo drive's understanding of motion commands, including direction, position, velocity, and acceleration. Proper configuration is essential for achieving precise control, ensuring that the servo drive operates effectively within its intended application."
