NODE_FILE_NAME,NODE_NUMBER,NODE_HASH,QUESTION,ANSWER
msd_servo_drive.txt,67,7e1ccc3087ba4929b3fdf5e8fdeafb1406d95541ce6b1502a6e99e56dbcbbfcf,What is the significance of the homing maximum distance in motion profile settings?,"The homing maximum distance in motion profile settings is significant because it defines the maximum distance the system can travel to locate its home position during the homing process. This parameter is crucial for ensuring that the servo drive can accurately find its reference point, which is essential for precise positioning and operation. Setting the correct homing maximum distance helps prevent the drive from overshooting or damaging itself by moving beyond its physical limits during the homing sequence. It also ensures that the system can reliably return to a known starting position for subsequent movements and operations."
msd_servo_drive.txt,67,7e1ccc3087ba4929b3fdf5e8fdeafb1406d95541ce6b1502a6e99e56dbcbbfcf,How does the scaling profile affect the direction of rotation for the motor?,"The scaling profile affects the direction of rotation for the motor by determining how the scaling is entered and interpreted. According to the context information, when using the ""Standard / CiA 402"" scaling profile, the positive direction of rotation is defined as clockwise when viewed from the motor shaft's perspective (specifically from the A-side bearing plate). This means that the scaling settings will dictate how the motor responds to control commands regarding its rotational direction, with the scaling being entered using exponent syntax. Additionally, when using interpolating operation modes via fieldbus, the scaling must be performed using the CiA 402 scaling assistant, which further ensures that the direction of rotation aligns with the defined scaling parameters."
msd_servo_drive.txt,67,7e1ccc3087ba4929b3fdf5e8fdeafb1406d95541ce6b1502a6e99e56dbcbbfcf,What types of commands are associated with the control and reference value channel settings?,"The types of commands associated with the control and reference value channel settings include:

- Control/Reference
- Profile
- Interpolation
- Limitation
- Reference filter
- Smoothing"
msd_servo_drive.txt,67,7e1ccc3087ba4929b3fdf5e8fdeafb1406d95541ce6b1502a6e99e56dbcbbfcf,What additional settings are required for closed-loop control and reference in motion profiles?,"The additional settings required for closed-loop control and reference in motion profiles include:

- Homing method
- Speeds (cam/zero point search)
- Acceleration
- Offset
- Homing maximum distance

These settings help ensure that the application’s physical data aligns with the Servo Drive’s data."
msd_servo_drive.txt,67,7e1ccc3087ba4929b3fdf5e8fdeafb1406d95541ce6b1502a6e99e56dbcbbfcf,What is the significance of the positive direction being clockwise when viewed from the motor shaft's A-side bearing plate?,"The significance of the positive direction being clockwise when viewed from the motor shaft's A-side bearing plate is that it establishes a standard reference point for defining motor movement. This convention ensures consistency in the interpretation of motor commands and behavior across different applications and systems. By defining the positive direction as clockwise, it allows engineers and operators to uniformly understand and program the motor's operation, particularly when dealing with scaling, control modes, and integration with other systems using the CiA 402 standard. This clarity is essential for effective communication and troubleshooting in automated systems."
msd_servo_drive.txt,67,7e1ccc3087ba4929b3fdf5e8fdeafb1406d95541ce6b1502a6e99e56dbcbbfcf,How should scaling be performed when using interpolating operation modes via fieldbus?,"When using interpolating operation modes (CSV, CSP, CST) via fieldbus, scaling must be performed using the CiA 402 scaling assistant."
msd_servo_drive.txt,67,7e1ccc3087ba4929b3fdf5e8fdeafb1406d95541ce6b1502a6e99e56dbcbbfcf,What does the feed constant represent in relation to motor revolutions and gear units?,"The feed constant represents the path travelled in relation to one motor revolution or, when a gear unit is used, to the output-side revolution. This means that the distance covered is directly proportional to the number of revolutions made by the motor or the output side of the gear unit."
msd_servo_drive.txt,67,7e1ccc3087ba4929b3fdf5e8fdeafb1406d95541ce6b1502a6e99e56dbcbbfcf,How is the gear ratio defined in the context of motor revolutions and gear output side revolutions?,The gear ratio is defined as the ratio of one motor revolution before the gearing to the number of revolutions on the gear output side. This means that it represents how many times the motor must turn to achieve a certain number of turns on the output side of the gear. The values for the gear ratio are entered in the system as integer fractions.
msd_servo_drive.txt,67,7e1ccc3087ba4929b3fdf5e8fdeafb1406d95541ce6b1502a6e99e56dbcbbfcf,What is the maximum number of bits available for the single-turn resolution of the position controller?,The maximum number of bits available for the single-turn resolution of the position controller is 32 bits.
msd_servo_drive.txt,67,7e1ccc3087ba4929b3fdf5e8fdeafb1406d95541ce6b1502a6e99e56dbcbbfcf,"In the default setting, how many bits are utilized for the single-turn position in the position controller?","In the default setting, 20 bits are utilized for the single-turn position in the position controller."
msd_servo_drive.txt,67,7e1ccc3087ba4929b3fdf5e8fdeafb1406d95541ce6b1502a6e99e56dbcbbfcf,What is the purpose of the CiA 402 scaling assistant in the context of motor control?,"The purpose of the CiA 402 scaling assistant in the context of motor control is to facilitate the proper scaling of parameters when using interpolating operation modes (such as CSV, CSP, CST) via fieldbus. This ensures that the scaling of the motor's movements and positions is accurately represented and managed according to the specifications outlined in the CiA 402 standard, particularly when dealing with the relationship between motor revolutions and the output-side revolutions in gear units."
msd_servo_drive.txt,67,7e1ccc3087ba4929b3fdf5e8fdeafb1406d95541ce6b1502a6e99e56dbcbbfcf,How does the single-turn resolution of the position controller impact its adaptability to different applications?,"The single-turn resolution of the position controller impacts its adaptability to different applications by allowing the resolution to be adjusted based on the specific requirements of the application. With a total of 32 bits available for resolution, the default setting uses 20 bits for single-turn position, which provides a certain level of precision. However, since this resolution can be variably adapted, it means that applications requiring higher precision can utilize more bits for single-turn resolution, while those that do not need as much precision can use fewer bits. This flexibility ensures that the position controller can be tailored to meet the unique demands of various tasks, enhancing its performance and effectiveness in different operational scenarios."
msd_servo_drive.txt,67,7e1ccc3087ba4929b3fdf5e8fdeafb1406d95541ce6b1502a6e99e56dbcbbfcf,What type of information is displayed on the “Standardization profile - Standard/CiA 402 - Units” screen?,"The “Standardization profile - Standard/CiA 402 - Units” screen displays information related to the units used for scaling and measurement in the context of the MSD ServoDrive. It likely includes details on how scaling is entered using exponent syntax, the direction of rotation for the motor, and possibly other unit-related settings relevant to the operation of the servo drive."
msd_servo_drive.txt,67,7e1ccc3087ba4929b3fdf5e8fdeafb1406d95541ce6b1502a6e99e56dbcbbfcf,What is the relationship between the path traveled and the motor revolution when using a gear unit?,"The path traveled is proportionate to one motor revolution or, when using a gear unit, to the output-side revolution. This means that the distance covered is directly related to the number of revolutions made by the motor, and when a gear unit is involved, it is the revolutions at the output side of the gear that determine the path traveled."
msd_servo_drive.txt,67,7e1ccc3087ba4929b3fdf5e8fdeafb1406d95541ce6b1502a6e99e56dbcbbfcf,"How are gear ratio values entered into the system, and what format is used?",Gear ratio values are entered into the system as integer fractions.
msd_servo_drive.txt,67,7e1ccc3087ba4929b3fdf5e8fdeafb1406d95541ce6b1502a6e99e56dbcbbfcf,What is the role of the “Standardization profile - Standard/CiA 402 - Direction of rotation” screen?,"The ""Standardization profile - Standard/CiA 402 - Direction of rotation"" screen is used to define and display the direction of rotation for the motor. It indicates that the positive direction is clockwise when viewed from the A-side bearing plate of the motor shaft. This screen is part of the configuration process for ensuring that the motor operates correctly according to the specified standards and settings in the CiA 402 profile."
msd_servo_drive.txt,67,7e1ccc3087ba4929b3fdf5e8fdeafb1406d95541ce6b1502a6e99e56dbcbbfcf,How does the scaling method affect the operation of the MSD ServoDrive in different modes?,"The scaling method affects the operation of the MSD ServoDrive by determining how the motor's movement is interpreted and executed in different operation modes. Specifically, when using interpolating operation modes such as CSV (Constant Speed Velocity), CSP (Constant Speed Position), and CST (Constant Speed Torque) via fieldbus, scaling must be performed using the CiA 402 scaling assistant. This ensures that the motor's movements are accurately represented in relation to the desired output, taking into account factors like gear ratio and position controller resolution.

In essence, the scaling method allows for precise control of the motor's performance, ensuring that the path traveled corresponds correctly to the motor's revolutions or the output-side revolutions when a gear unit is involved. Proper scaling is crucial for achieving the desired motion profiles and maintaining the accuracy and efficiency of the servo drive's operation across various applications."
msd_servo_drive.txt,67,7e1ccc3087ba4929b3fdf5e8fdeafb1406d95541ce6b1502a6e99e56dbcbbfcf,What are the implications of using a gear unit on the output-side revolution in motor applications?,"Using a gear unit in motor applications has several implications for the output-side revolution:

1. **Gear Ratio Impact**: The gear ratio determines how many revolutions of the motor correspond to one revolution of the output shaft. A higher gear ratio means that the motor must turn more times to achieve one output revolution, which can affect the speed and torque characteristics of the system.

2. **Torque Amplification**: Gear units can amplify torque. When the gear ratio is increased, the output torque is also increased, which can be beneficial for applications requiring higher force at the output.

3. **Speed Reduction**: Conversely, using a gear unit typically reduces the speed of the output shaft relative to the motor speed. This is important for applications where lower speeds are needed for precision control.

4. **Position Control**: The relationship between motor revolutions and output revolutions must be carefully considered in position control applications. The scaling for position feedback must account for the gear ratio to ensure accurate positioning.

5. **Complexity in Control**: The presence of a gear unit adds complexity to the control algorithms, as the system must account for the gear ratio when calculating the desired position, speed, and torque.

6. **Wear and Maintenance**: Gear units can introduce additional wear and require maintenance, which may affect the overall reliability and longevity of the motor system.

In summary, using a gear unit affects the relationship between motor revolutions and output-side revolutions, influencing torque, speed, control complexity, and maintenance requirements."
msd_servo_drive.txt,67,7e1ccc3087ba4929b3fdf5e8fdeafb1406d95541ce6b1502a6e99e56dbcbbfcf,How does the resolution of the position controller influence the precision of motor positioning?,"The resolution of the position controller directly influences the precision of motor positioning by determining how finely the position can be adjusted and measured. In the context provided, the single-turn resolution of the position controller can be adapted variably, with a total of 32 bits available. In the default setting, 20 bits are used for the single-turn position.

This means that the position controller can represent a wide range of positions within a single revolution of the motor shaft. The higher the number of bits allocated to the resolution, the more precise the positioning can be, as each bit effectively doubles the number of distinguishable positions. For example, with 20 bits, the controller can differentiate between 2^20 (1,048,576) different positions within one revolution, allowing for very fine adjustments.

Conversely, if fewer bits are used for the resolution, the precision decreases, resulting in larger steps between distinguishable positions and potentially less accurate motor control. Therefore, optimizing the resolution of the position controller is crucial for applications requiring high precision in motor positioning."
msd_servo_drive.txt,67,7e1ccc3087ba4929b3fdf5e8fdeafb1406d95541ce6b1502a6e99e56dbcbbfcf,What type of information can be found on the “Standardization profile - Standard/CiA 402 - Feed/gearing/resolution/process format” screen?,"The “Standardization profile - Standard/CiA 402 - Feed/gearing/resolution/process format” screen likely contains information related to the following aspects:

1. **Feed Constant**: It may detail how the path traveled is proportional to one motor revolution or the output-side revolution when using a gear unit.

2. **Gear Ratio**: The screen might provide information on the ratio of one motor revolution to the number of revolutions on the gear output side, including how to enter these values as integer fractions.

3. **Position Controller Single-Turn Resolution**: It could include details on how the single-turn resolution of the position controller can be adapted for specific applications, indicating the total bits available and the default bit usage for single-turn position.

4. **Process Format**: The screen may also present information on the process format related to the motion profile and how it integrates with the scaling and gearing settings.

Overall, this screen is likely to provide a comprehensive overview of the parameters and settings relevant to motion control in the context of the CiA 402 standard."
msd_servo_drive.txt,67,7e1ccc3087ba4929b3fdf5e8fdeafb1406d95541ce6b1502a6e99e56dbcbbfcf,In what scenarios might the single-turn resolution need to be adjusted for optimal performance?,"The single-turn resolution may need to be adjusted for optimal performance in the following scenarios:

1. **Application-Specific Requirements**: Different applications may have varying precision requirements. For instance, applications requiring high precision in positioning (such as robotics or CNC machinery) may benefit from a higher single-turn resolution.

2. **Load Characteristics**: If the load being driven by the servo motor changes (e.g., heavier loads or varying inertia), adjusting the resolution can help maintain performance and responsiveness.

3. **Speed of Operation**: In scenarios where the motor operates at high speeds, a higher resolution may be necessary to ensure accurate positioning and control, preventing overshooting or oscillations.

4. **Control Mode**: Different control modes (e.g., position control, velocity control) may require different resolutions to achieve the desired performance characteristics.

5. **Environmental Factors**: In environments with vibrations or disturbances, adjusting the resolution can help improve stability and accuracy in the motor's response.

6. **Feedback System Limitations**: If the feedback system (e.g., encoders) has limitations in resolution, adjusting the single-turn resolution can help align the controller's performance with the feedback capabilities.

7. **Tuning for Specific Motion Profiles**: When implementing specific motion profiles that require precise control over acceleration and deceleration, adjusting the resolution can enhance the overall motion quality.

In summary, the need to adjust single-turn resolution arises from the specific demands of the application, load conditions, operational speed, control strategies, environmental factors, feedback system capabilities, and motion profile requirements."
msd_servo_drive.txt,67,7e1ccc3087ba4929b3fdf5e8fdeafb1406d95541ce6b1502a6e99e56dbcbbfcf,What factors should be considered when entering gear ratio values into the system?,"When entering gear ratio values into the system, the following factors should be considered:

1. **Ratio Definition**: The gear ratio is defined as the ratio of one motor revolution before the gearing to the number of revolutions on the gear output side. Ensure that this relationship is clearly understood.

2. **Integer Fractions**: The values for the gear ratio must be entered as integer fractions in the system. This means that the ratio should be expressed in a form that can be simplified to whole numbers.

3. **Application Requirements**: The gear ratio should be selected based on the specific requirements of the application, including the desired output speed and torque.

4. **Impact on Motion Control**: Consider how the chosen gear ratio will affect the motion control parameters, such as feed constant and position controller resolution.

5. **Compatibility with Other Settings**: Ensure that the gear ratio is compatible with other settings in the system, such as the single-turn resolution of the position controller and the overall motion profile.

By taking these factors into account, you can ensure accurate and effective configuration of the gear ratio in the system."
msd_servo_drive.txt,67,7e1ccc3087ba4929b3fdf5e8fdeafb1406d95541ce6b1502a6e99e56dbcbbfcf,How does the concept of feed constant relate to the overall functionality of the MSD ServoDrive?,"The concept of feed constant in the MSD ServoDrive relates to the overall functionality by establishing a direct relationship between the movement of the motor and the distance traveled by the connected mechanism. Specifically, the feed constant defines how far the system moves for each complete revolution of the motor. This is particularly important when a gear unit is involved, as the feed constant will then correspond to the output-side revolution, allowing for precise control of motion based on the motor's operation.

By ensuring that the path traveled is proportionate to the motor's revolutions, the feed constant enables accurate positioning and movement control, which is essential for applications requiring high precision. This functionality is crucial for the effective operation of the position controller and contributes to the overall performance and reliability of the MSD ServoDrive in various motion control applications."
msd_servo_drive.txt,67,7e1ccc3087ba4929b3fdf5e8fdeafb1406d95541ce6b1502a6e99e56dbcbbfcf,What are the potential consequences of incorrect scaling in interpolating operation modes?,"Incorrect scaling in interpolating operation modes (CSV, CSP, CST) can lead to several potential consequences, including:

1. **Inaccurate Positioning**: The system may not reach the intended position accurately, resulting in misalignment or improper functioning of the machinery.

2. **Reduced Performance**: The overall performance of the servo drive may be compromised, leading to slower response times or erratic movements.

3. **Increased Wear and Tear**: Incorrect scaling can cause the motor to operate outside its optimal parameters, potentially leading to increased wear and tear on mechanical components.

4. **System Instability**: The drive may become unstable, resulting in oscillations or jerky movements, which can affect the quality of the output.

5. **Safety Risks**: In industrial applications, incorrect scaling could pose safety risks to operators and equipment, especially if the system behaves unpredictably.

6. **Data Misinterpretation**: If the scaling is not correctly applied, the data being interpreted by the control system may be inaccurate, leading to poor decision-making by the system.

7. **Increased Energy Consumption**: Inefficient scaling may lead to higher energy consumption as the system struggles to achieve the desired performance.

To avoid these consequences, it is crucial to use the CiA 402 scaling assistant for proper scaling when operating in interpolating modes."
msd_servo_drive.txt,67,7e1ccc3087ba4929b3fdf5e8fdeafb1406d95541ce6b1502a6e99e56dbcbbfcf,What is the relationship between the path travelled and motor revolutions in a servo drive system?,"The path travelled in a servo drive system is directly proportional to one motor revolution. If a gear unit is used, the relationship is based on the number of revolutions on the output side of the gear. This means that the distance covered by the system is determined by how many times the motor rotates, either directly or through the gear mechanism."
msd_servo_drive.txt,67,7e1ccc3087ba4929b3fdf5e8fdeafb1406d95541ce6b1502a6e99e56dbcbbfcf,How is the gear ratio defined in terms of motor revolutions and gear output revolutions?,"The gear ratio is defined as the ratio of one motor revolution before the gearing to the number of revolutions on the gear output side. This means that for every complete revolution made by the motor, the gear output will make a corresponding number of revolutions based on the specified gear ratio. The values for the gear ratio are entered as integer fractions."
msd_servo_drive.txt,67,7e1ccc3087ba4929b3fdf5e8fdeafb1406d95541ce6b1502a6e99e56dbcbbfcf,What is the default bit allocation for the single-turn resolution of a position controller?,The default bit allocation for the single-turn resolution of a position controller is 20 bits.
msd_servo_drive.txt,67,7e1ccc3087ba4929b3fdf5e8fdeafb1406d95541ce6b1502a6e99e56dbcbbfcf,"What type of information is represented by the index name ""MPRO_402"" in the motion profile?","The index name ""MPRO_402"" in the motion profile represents various parameters related to the position encoder resolution, velocity encoder resolution, gear ratio, feed constant, position factor, velocity factor, and acceleration factor. It encompasses information about how the motor's position and velocity are measured and controlled, as well as the relationship between motor revolutions and the output of the gear system."
msd_servo_drive.txt,67,7e1ccc3087ba4929b3fdf5e8fdeafb1406d95541ce6b1502a6e99e56dbcbbfcf,How many bits are available for the single-turn resolution in a position controller?,A total of 32 bits are available for the single-turn resolution in a position controller.
msd_servo_drive.txt,67,7e1ccc3087ba4929b3fdf5e8fdeafb1406d95541ce6b1502a6e99e56dbcbbfcf,What unit is used to measure the encoder increments for the DS402 position encoder resolution?,"The unit used to measure the encoder increments for the DS402 position encoder resolution is ""incr"" (increments)."
msd_servo_drive.txt,67,7e1ccc3087ba4929b3fdf5e8fdeafb1406d95541ce6b1502a6e99e56dbcbbfcf,"What does the term ""feed constant"" refer to in the context of servo drive systems?","In the context of servo drive systems, the term ""feed constant"" refers to a parameter that defines the relationship between the distance traveled by the system and the motor's revolutions. Specifically, it indicates the distance (in millidegrees) that corresponds to one complete revolution of the drive shaft. This constant is crucial for determining the precise movement and positioning of the servo system based on the motor's rotational output."
msd_servo_drive.txt,67,7e1ccc3087ba4929b3fdf5e8fdeafb1406d95541ce6b1502a6e99e56dbcbbfcf,"In the motion profile, what units are used for measuring motor revolution per second?","In the motion profile, the unit used for measuring motor revolution per second is ""rev/s."""
msd_servo_drive.txt,67,7e1ccc3087ba4929b3fdf5e8fdeafb1406d95541ce6b1502a6e99e56dbcbbfcf,"What is the significance of the ""Modulo (rotary table)"" process format in a servo drive system?","The ""Modulo (rotary table)"" process format in a servo drive system is significant because it activates the indexing table function, which allows for precise control of the position of a rotary table. This format is particularly useful for applications where the rotation needs to be managed in a cyclic manner, such as in automated machinery or robotics.

In this context, the user must define a limit value for the circumferential length, which indicates the point at which a revolution is considered complete. This feature enables the system to recognize when it has completed a full rotation and can reset or continue indexing from the starting position. This capability is crucial for applications that require repetitive positioning or for tasks that involve multiple rotations, ensuring accuracy and efficiency in the operation of the servo drive system."
