NODE_FILE_NAME,NODE_NUMBER,NODE_HASH,QUESTION,ANSWER
msd_servo_drive.txt,67,7e1ccc3087ba4929b3fdf5e8fdeafb1406d95541ce6b1502a6e99e56dbcbbfcf,What is the purpose of using table index 0 in the operation mode setting?,The purpose of using table index 0 in the operation mode setting is for position control. This index is part of the configuration that allows the system to manage and control the position of the hydraulic system effectively.
msd_servo_drive.txt,67,7e1ccc3087ba4929b3fdf5e8fdeafb1406d95541ce6b1502a6e99e56dbcbbfcf,How is the switching between position control and speed control achieved in the system?,"The switching between position control and speed control in the system is achieved by using a motion block table and a timer. The table index for position control is set to 0, while the index for speed control is set to 1. The operating mode must be configured to ""Tab(4) = via motion block table"" by setting the parameter P 2862 - HydOpMode. Additionally, for valve control, ""Tab(2) = valve control via motion block table"" is selected using parameter P 2840[11] - CylValueSwSel. This setup allows the system to specify valve positions for the respective table index in the motion block table (P 2863 - Hyd_TabCtrl), enabling the transition between the two control modes."
msd_servo_drive.txt,67,7e1ccc3087ba4929b3fdf5e8fdeafb1406d95541ce6b1502a6e99e56dbcbbfcf,"What must be set to ""Tab(4) = via motion block table"" to enable the operation mode for hydraulics?","The table operating mode P 2862 - HydOpMode must be set to ""Tab(4) = via motion block table"" to enable the operation mode for hydraulics."
msd_servo_drive.txt,67,7e1ccc3087ba4929b3fdf5e8fdeafb1406d95541ce6b1502a6e99e56dbcbbfcf,Which table index is designated for valve control in the system?,The table index designated for valve control in the system is table index 1.
msd_servo_drive.txt,67,7e1ccc3087ba4929b3fdf5e8fdeafb1406d95541ce6b1502a6e99e56dbcbbfcf,"What does the value ""TAB2"" signify in the context of valve control?","In the context of valve control, the value ""TAB2"" signifies that the valve control is being managed via the motion block table. Specifically, it is associated with the function selector for the valve switchover of the cylinder, as indicated by the parameter P 2840[11] - CylValueSwSel. This means that the valve positions must be specified for the respective table index in the motion block table."
msd_servo_drive.txt,67,7e1ccc3087ba4929b3fdf5e8fdeafb1406d95541ce6b1502a6e99e56dbcbbfcf,"In the motion block table, what parameters can be set regarding reference values and waiting times?","In the motion block table, you can set the following parameters regarding reference values and waiting times:

1. **Reference Values**: These are the target values for position and speed control that the system will aim to achieve.
2. **Ramps**: These parameters define the rate of change for the reference values, allowing for smooth acceleration and deceleration.
3. **Valve Positions**: The specific positions for the valves must be specified for the respective table index.
4. **Waiting Time**: The duration for which the system will wait at each table index before proceeding to the next motion block.

These parameters help in controlling the operation of the hydraulic system effectively."
msd_servo_drive.txt,67,7e1ccc3087ba4929b3fdf5e8fdeafb1406d95541ce6b1502a6e99e56dbcbbfcf,What is the significance of the timer in the motion block table operation?,"The timer in the motion block table operation is significant because it is used to switch between different control modes, specifically between position control (table index 0) and speed control (table index 1). By utilizing the timer, the system can automatically transition between these modes based on the defined timing parameters, allowing for dynamic control of the hydraulic system. This functionality is essential for ensuring that the appropriate control strategy is applied at the right time, enhancing the overall performance and responsiveness of the system."
msd_servo_drive.txt,67,7e1ccc3087ba4929b3fdf5e8fdeafb1406d95541ce6b1502a6e99e56dbcbbfcf,How does the function selector for the valve switchover of the cylinder relate to the operation mode?,"The function selector for the valve switchover of the cylinder, indicated by the parameter P 2840[11] - CylValueSwSel, is set to ""TAB2,"" which specifies that valve control is managed via the motion block table. This means that the valve positions must be defined for the respective table index used for control. 

In relation to the operation mode, which is set by P 2862 - HydOpMode to ""TAB4,"" this configuration allows the system to switch between different control modes (position control or speed control) based on the motion block table. Essentially, the operation mode determines how the hydraulic system operates, while the function selector dictates how the valve switchover is managed within that operational framework. Therefore, both parameters work together to ensure that the hydraulic system functions correctly according to the specified control strategy."
msd_servo_drive.txt,67,7e1ccc3087ba4929b3fdf5e8fdeafb1406d95541ce6b1502a6e99e56dbcbbfcf,What is the ID number associated with the hydraulics operation mode setting?,The ID number associated with the hydraulics operation mode setting is 2862.
msd_servo_drive.txt,67,7e1ccc3087ba4929b3fdf5e8fdeafb1406d95541ce6b1502a6e99e56dbcbbfcf,"What does the unit ""HYD_OpMode"" represent in the context of the operation mode setting?","In the context of the operation mode setting, the unit ""HYD_OpMode"" represents the hydraulic operation mode for the system. Specifically, it indicates the mode of operation for the hydraulics, which in this case is set to ""TAB4"" to enable operation via the motion block table."
msd_servo_drive.txt,67,7e1ccc3087ba4929b3fdf5e8fdeafb1406d95541ce6b1502a6e99e56dbcbbfcf,How does the system specify valve positions for the respective table index?,"The system specifies valve positions for the respective table index by selecting ""Tab(2) = valve control via motion block table"" for the valve control (P 2840[11] - CylValueSwSel). This means that the valve positions must be defined in the motion block table (P 2863 - Hyd_TabCtrl) for each corresponding table index used in the operation."
msd_servo_drive.txt,67,7e1ccc3087ba4929b3fdf5e8fdeafb1406d95541ce6b1502a6e99e56dbcbbfcf,What is the role of the motion block table in controlling hydraulic functions?,"The motion block table plays a crucial role in controlling hydraulic functions by allowing for the specification of various parameters such as reference values, ramps, valve positions, and waiting times associated with different table indices. In the provided context, it facilitates the switching between position control and speed control by using a timer, as indicated by the configuration of the operating modes and valve control settings. This structured approach enables precise control over hydraulic operations by defining how the system should behave under different conditions, thus ensuring effective and coordinated movement of hydraulic components."
msd_servo_drive.txt,67,7e1ccc3087ba4929b3fdf5e8fdeafb1406d95541ce6b1502a6e99e56dbcbbfcf,What is the ID number for the function selector for the valve switchover?,The ID number for the function selector for the valve switchover is 2840.
msd_servo_drive.txt,67,7e1ccc3087ba4929b3fdf5e8fdeafb1406d95541ce6b1502a6e99e56dbcbbfcf,What type of control does table index 1 provide in the system?,Table index 1 provides speed control in the system.
msd_servo_drive.txt,67,7e1ccc3087ba4929b3fdf5e8fdeafb1406d95541ce6b1502a6e99e56dbcbbfcf,How are reference values and ramps utilized in the motion block table?,"Reference values and ramps are utilized in the motion block table to define the desired positions and speeds for the hydraulic system's operation. Specifically, reference values indicate the target positions or speeds that the system should achieve, while ramps are used to control the rate of change to these values, ensuring smooth transitions and preventing abrupt movements. This setup allows for precise control of the hydraulic system by specifying how quickly the system should move to the reference values, thereby enhancing performance and stability during operation."
msd_servo_drive.txt,67,7e1ccc3087ba4929b3fdf5e8fdeafb1406d95541ce6b1502a6e99e56dbcbbfcf,What is the importance of the waiting time in the motion block table?,"The waiting time in the motion block table is important because it allows for the proper timing and synchronization of operations between different control actions, such as position and speed control. By specifying a waiting time, the system can ensure that the necessary conditions are met before proceeding to the next action in the motion sequence. This helps to prevent issues such as overshooting or undershooting the desired position or speed, and ensures smooth transitions between different states of operation. Additionally, it allows for the hydraulic system to stabilize before executing subsequent commands, which is crucial for maintaining system performance and reliability."
msd_servo_drive.txt,67,7e1ccc3087ba4929b3fdf5e8fdeafb1406d95541ce6b1502a6e99e56dbcbbfcf,"What does the term ""CylValueSwSel"" refer to in the context of valve control?","In the context of valve control, ""CylValueSwSel"" refers to the function selector for the valve switchover of the cylinder. It is associated with the parameter ID 2840 and is set to ""TAB2,"" indicating that valve control is managed via the motion block table. This means that the valve positions must be specified for the respective table index in the motion block table."
msd_servo_drive.txt,67,7e1ccc3087ba4929b3fdf5e8fdeafb1406d95541ce6b1502a6e99e56dbcbbfcf,What is the purpose of specifying valve positions in the motion block table?,"The purpose of specifying valve positions in the motion block table is to control the valve switchover for the cylinder, which is necessary for the operation of the hydraulic system. By defining the valve positions for the respective table index, the system can effectively manage the hydraulic functions, ensuring that the correct valve settings are applied during operation based on the selected control mode. This allows for precise control of the hydraulic movements, whether for position or speed control, as indicated by the table indices."
msd_servo_drive.txt,67,7e1ccc3087ba4929b3fdf5e8fdeafb1406d95541ce6b1502a6e99e56dbcbbfcf,How does the operation mode setting influence the overall functionality of the MSD ServoDrive?,"The operation mode setting, specifically the parameter P 2862 - HydOpMode, influences the overall functionality of the MSD ServoDrive by determining how the system operates in terms of control strategies. By setting the operation mode to ""Tab(4) = via motion block table,"" the system can switch between different control indices, such as position control (index 0) and speed control (index 1), based on the motion block table. This allows for more flexible and dynamic control of the hydraulic system.

Additionally, the valve control is managed through the motion block table as indicated by the selection of ""Tab(2) = valve control via motion block table"" for P 2840[11] - CylValueSwSel. This means that the valve positions must be defined for each table index, enabling precise control over the hydraulic cylinders' operation.

Overall, the operation mode setting facilitates the integration of various control parameters, including reference values, ramps, and waiting times, which are essential for achieving desired motion profiles and ensuring the effective operation of the MSD ServoDrive in various applications."
msd_servo_drive.txt,67,7e1ccc3087ba4929b3fdf5e8fdeafb1406d95541ce6b1502a6e99e56dbcbbfcf,What is the date associated with the MOOG ID No.: CB40859-001?,The date associated with the MOOG ID No.: CB40859-001 is 11/2020.
msd_servo_drive.txt,67,7e1ccc3087ba4929b3fdf5e8fdeafb1406d95541ce6b1502a6e99e56dbcbbfcf,What is the purpose of the HYD_OpMode parameter in hydraulic systems?,"The purpose of the HYD_OpMode parameter in hydraulic systems is to set the operation mode of the hydraulics. This parameter allows the system to be configured for different operational modes, which can affect how the hydraulic system behaves and responds during operation."
msd_servo_drive.txt,67,7e1ccc3087ba4929b3fdf5e8fdeafb1406d95541ce6b1502a6e99e56dbcbbfcf,How does the CylValveSwSel function selector impact the operation of the cylinder?,"The CylValveSwSel function selector is used to determine the valve switchover function for the cylinder in the hydraulic system. By selecting a specific function, it influences how the hydraulic cylinder operates, including the control of fluid flow and pressure, which ultimately affects the cylinder's movement and performance. The specific impact would depend on the selected function, as it could alter the mode of operation, such as switching between different control strategies (e.g., pressure control, volume flow rate control, etc.) for the hydraulic system. This selection is crucial for optimizing the cylinder's response to commands and ensuring it operates effectively within the desired parameters."
msd_servo_drive.txt,67,7e1ccc3087ba4929b3fdf5e8fdeafb1406d95541ce6b1502a6e99e56dbcbbfcf,What are the different control modes available for hydraulic systems as indicated by the HYD_ConMode parameter?,"The different control modes available for hydraulic systems as indicated by the HYD_ConMode parameter are:

1. Pressure control (PressCon) - 0
2. Volume flow rate control (pressure limited) (VolConPlim) - 1
3. Speed control (SpeedCon) - 2
4. Position control (PosCon) - 3
5. Pump speed control (NPumpCon) - 4
6. Volume flow rate control (without pressure control) (VolCon) - 5"
msd_servo_drive.txt,67,7e1ccc3087ba4929b3fdf5e8fdeafb1406d95541ce6b1502a6e99e56dbcbbfcf,What is the significance of the HYD_Ref parameter in hydraulic control?,"The HYD_Ref parameter, identified by ID 2857, is significant in hydraulic control as it represents the setpoint for volumetric flow rate, pressure, speed, or position within the hydraulic system. This parameter is crucial for controlling the hydraulic performance, as it defines the desired operational values that the system should achieve. By setting the HYD_Ref, operators can dictate how the hydraulic system responds to commands, ensuring that it operates within specified parameters for optimal performance and efficiency."
msd_servo_drive.txt,67,7e1ccc3087ba4929b3fdf5e8fdeafb1406d95541ce6b1502a6e99e56dbcbbfcf,How does the first reference value derivative (HYD_dRef) affect hydraulic performance?,"The first reference value derivative (HYD_dRef) is crucial for controlling the dynamics of hydraulic systems. It represents the rate of change of the hydraulic setpoint, which can influence how quickly the system responds to changes in demand for volumetric flow rate, pressure, speed, or position. 

By adjusting the first reference value derivative, you can manage the responsiveness and stability of the hydraulic system. A higher derivative value may lead to a quicker response, allowing the system to reach the desired setpoint more rapidly. However, if set too high, it could cause instability or oscillations in the hydraulic performance. Conversely, a lower derivative value may result in a more gradual response, which can enhance stability but may also lead to slower performance in reaching the desired setpoint.

In summary, the first reference value derivative (HYD_dRef) directly affects the speed and stability of the hydraulic system's response to control inputs, making it a critical parameter for optimizing hydraulic performance."
msd_servo_drive.txt,67,7e1ccc3087ba4929b3fdf5e8fdeafb1406d95541ce6b1502a6e99e56dbcbbfcf,What role does the second reference value derivative (HYD_d2Ref) play in hydraulic systems?,"The second reference value derivative (HYD_d2Ref) in hydraulic systems is primarily associated with jerk limitation or acceleration control when dealing with position references. It helps manage the rate of change of acceleration, ensuring that the system does not experience abrupt changes that could lead to instability or mechanical stress. By regulating the second derivative of the setpoint, the hydraulic system can achieve smoother transitions in motion, enhancing overall performance and safety during operation."
msd_servo_drive.txt,67,7e1ccc3087ba4929b3fdf5e8fdeafb1406d95541ce6b1502a6e99e56dbcbbfcf,Explain the function of the HYD_TabCtrl parameter in hydraulic table control.,"The HYD_TabCtrl parameter, identified by ID 2863, is used as the hydraulic table control word. Its function is to control the position of the hydraulic valve within the system. This parameter plays a crucial role in determining how the hydraulic system responds to commands related to flow rate, pressure, and other operational modes. By setting the HYD_TabCtrl value, the operator can influence the behavior of the hydraulic system, ensuring that it operates according to the desired specifications and requirements for the application at hand."
msd_servo_drive.txt,67,7e1ccc3087ba4929b3fdf5e8fdeafb1406d95541ce6b1502a6e99e56dbcbbfcf,What is the effect of setting the HYD_TabWaitTime parameter in an automatic hydraulic system?,"Setting the HYD_TabWaitTime parameter in an automatic hydraulic system determines the delay time for the hydraulic table. This delay allows the system to pause for a specified duration before proceeding to the next operation or motion block. By configuring this wait time, the system can ensure that the hydraulic components have adequate time to stabilize or respond to previous commands before executing subsequent actions. This can help improve the overall performance and reliability of the hydraulic system by preventing abrupt changes that could lead to inefficiencies or mechanical issues."
msd_servo_drive.txt,67,7e1ccc3087ba4929b3fdf5e8fdeafb1406d95541ce6b1502a6e99e56dbcbbfcf,How does the HYD_TabNextIdx parameter determine the subsequent motion block in hydraulic operations?,"The HYD_TabNextIdx parameter, identified by ID 2865, specifies the next default index for the hydraulic table in hydraulic operations. This parameter determines which motion block will be executed following the current operation. When the hydraulic system completes its current task, it refers to the value set in the HYD_TabNextIdx to identify the next motion block to execute. This allows for a predefined sequence of operations to be carried out automatically, facilitating smooth transitions between different stages of hydraulic control without manual intervention."
msd_servo_drive.txt,67,7e1ccc3087ba4929b3fdf5e8fdeafb1406d95541ce6b1502a6e99e56dbcbbfcf,What is the purpose of the HYD_TabAltIdx parameter in hydraulic systems?,"The purpose of the HYD_TabAltIdx parameter in hydraulic systems is to specify the next alternative index for the hydraulic table. This parameter allows for the selection of an alternative motion block, which can be used in various operational scenarios or conditions within the hydraulic control system."
msd_servo_drive.txt,67,7e1ccc3087ba4929b3fdf5e8fdeafb1406d95541ce6b1502a6e99e56dbcbbfcf,Describe the significance of the HYD_TabCondType parameter in hydraulic table operations.,"The HYD_TabCondType parameter is significant in hydraulic table operations as it defines the state of the hydraulic table. This parameter plays a crucial role in determining the conditions under which the hydraulic system will operate or transition between different states or modes. By specifying the type of condition, it allows for the control of the hydraulic system's behavior based on predefined criteria, which can include factors such as pressure, flow rate, or other operational metrics. This ensures that the hydraulic system responds appropriately to varying operational demands, enhancing both efficiency and safety in hydraulic applications."
msd_servo_drive.txt,67,7e1ccc3087ba4929b3fdf5e8fdeafb1406d95541ce6b1502a6e99e56dbcbbfcf,What does the HYD_TabCondVal parameter represent in the context of hydraulic comparison states?,"The HYD_TabCondVal parameter represents the hydraulic table comparison state, which is an optional comparison value used to determine the condition of the hydraulic table in the system. This parameter is likely used to evaluate specific conditions or thresholds that influence the operation of the hydraulic system."
msd_servo_drive.txt,67,7e1ccc3087ba4929b3fdf5e8fdeafb1406d95541ce6b1502a6e99e56dbcbbfcf,"How can the selection of a control mode (e.g., Pressure control or Speed control) impact hydraulic system performance?","The selection of a control mode in a hydraulic system, such as Pressure control, Speed control, or others, significantly impacts the system's performance in various ways:

1. **Response Time**: Different control modes have varying response times to changes in input signals. For instance, Speed control may allow for quicker adjustments in the speed of hydraulic actuators, while Pressure control may prioritize maintaining a specific pressure level, potentially leading to slower adjustments in actuator speed.

2. **Precision and Stability**: Pressure control can provide more stable operation under varying load conditions, as it maintains a constant pressure despite fluctuations. In contrast, Speed control may lead to oscillations or instability if not properly tuned, especially under varying loads.

3. **Energy Efficiency**: The choice of control mode can influence energy consumption. For example, Volume flow rate control (pressure limited) may optimize energy use by adjusting flow rates based on demand, while constant pressure control might lead to higher energy usage if the system maintains pressure when not needed.

4. **System Wear and Tear**: Different control modes can affect the wear on hydraulic components. For example, frequent changes in speed (as in Speed control) may lead to increased wear on motors and actuators compared to a more stable Pressure control mode, which may reduce mechanical stress.

5. **Application Suitability**: Certain applications may require specific control modes for optimal performance. For example, applications requiring precise positioning may benefit from Position control, while those needing quick response to load changes may perform better under Speed control.

6. **Operational Flexibility**: Some control modes allow for more flexible operation in terms of adapting to different tasks or conditions. For instance, switching between Volume flow rate control and Pressure control can enable the system to handle varying operational demands effectively.

In summary, the selection of a control mode directly affects the hydraulic system's efficiency, stability, responsiveness, and overall performance, making it crucial to choose the appropriate mode based on the specific application requirements."
msd_servo_drive.txt,67,7e1ccc3087ba4929b3fdf5e8fdeafb1406d95541ce6b1502a6e99e56dbcbbfcf,In what scenarios would a user choose volume flow rate control with pressure limitation over other control modes?,"A user might choose volume flow rate control with pressure limitation (VolConPlim) over other control modes in the following scenarios:

1. **Preventing Overpressure**: When there is a risk of exceeding the maximum allowable pressure in the hydraulic system, volume flow rate control with pressure limitation ensures that the system operates within safe pressure limits while still allowing for volume flow adjustments.

2. **Maintaining System Stability**: In applications where maintaining a stable flow rate is critical, this control mode allows for precise volume flow management while automatically adjusting to pressure changes, preventing sudden spikes that could destabilize the system.

3. **Optimizing Performance**: In scenarios where the application requires a balance between flow rate and pressure, such as in hydraulic actuators or cylinders, this mode allows for efficient operation by optimizing the flow rate without compromising pressure requirements.

4. **Energy Efficiency**: By controlling the flow rate while limiting pressure, this mode can help reduce energy consumption in hydraulic systems, making it suitable for applications where energy efficiency is a priority.

5. **Complex Load Conditions**: In situations where the load conditions are variable and unpredictable, volume flow rate control with pressure limitation can adapt to changing demands without risking damage to the system due to excessive pressure.

6. **Safety Considerations**: In applications where safety is paramount, such as in construction or manufacturing environments, using this control mode can help mitigate risks associated with hydraulic failures by ensuring that pressure does not exceed safe thresholds.

Overall, volume flow rate control with pressure limitation is particularly beneficial in applications where flow stability, safety, and energy efficiency are essential considerations."
